,author_id,author_id_new,conv_id_new,conversation_id,created_at,entities.mentions,id,id_new,public_metrics.like_count,public_metrics.quote_count,public_metrics.reply_count,public_metrics.retweet_count,referenced_tweets,text,users.created_at,users.description,users.id,users.name,users.public_metrics.followers_count,users.public_metrics.following_count,users.public_metrics.listed_count,users.public_metrics.tweet_count,users.username,users.verified
0,3131144855,author_id: 3131144855,conv_id: 1223380683357335552,1223380683357335552,2020-01-31T23:00:58.000Z,,1223380683357335552,id: 1223380683357335552,99832,2884,9221,18006,,Tonight we have left the EU - an extraordinary turning point in the life of this country. Let us come together now to make the most of all the opportunities Brexit will bring - and let’s unleash the potential of the whole UK. 🇬🇧,2015-04-01T20:15:49.000Z,Prime Minister of the United Kingdom and @Conservatives leader. Member of Parliament for Uxbridge and South Ruislip.,3131144855,Boris Johnson,4481059,459,10421,5833,BorisJohnson,True
1,3131144855,author_id: 3131144855,conv_id: 1223375648628137990,1223375648628137990,2020-01-31T22:40:58.000Z,"[{'start': 3, 'end': 19, 'username': '10DowningStreet', 'id': '14224719'}]",1223375648628137990,id: 1223375648628137990,0,0,0,1339,"[{'type': 'retweeted', 'id': '1223375358667345921'}]",RT @10DowningStreet: WATCH LIVE: We are counting down to leaving the EU ahead of our departure at 11pm https://t.co/xgV5BrtLQS,2015-04-01T20:15:49.000Z,Prime Minister of the United Kingdom and @Conservatives leader. Member of Parliament for Uxbridge and South Ruislip.,3131144855,Boris Johnson,4481059,459,10421,5833,BorisJohnson,True
2,3131144855,author_id: 3131144855,conv_id: 1223365339494453248,1223365339494453248,2020-01-31T22:00:00.000Z,,1223365339494453248,id: 1223365339494453248,48148,2284,6330,10709,,Tonight we are leaving the European Union. https://t.co/zZBsrf4BLe,2015-04-01T20:15:49.000Z,Prime Minister of the United Kingdom and @Conservatives leader. Member of Parliament for Uxbridge and South Ruislip.,3131144855,Boris Johnson,4481059,459,10421,5833,BorisJohnson,True
3,3131144855,author_id: 3131144855,conv_id: 1223305800405463040,1223305800405463040,2020-01-31T18:03:25.000Z,"[{'start': 3, 'end': 19, 'username': '10DowningStreet', 'id': '14224719'}, {'start': 24, 'end': 37, 'username': 'BorisJohnson', 'id': '3131144855'}]",1223305800405463040,id: 1223305800405463040,0,0,0,332,"[{'type': 'retweeted', 'id': '1223302258974175239'}]","RT @10DowningStreet: PM @BorisJohnson chaired the last Cabinet meeting before we leave the EU in Sunderland. 

He visited local businesses…",2015-04-01T20:15:49.000Z,Prime Minister of the United Kingdom and @Conservatives leader. Member of Parliament for Uxbridge and South Ruislip.,3131144855,Boris Johnson,4481059,459,10421,5833,BorisJohnson,True
4,3131144855,author_id: 3131144855,conv_id: 1223289439671275521,1223289439671275521,2020-01-31T16:58:24.000Z,"[{'start': 3, 'end': 17, 'username': 'Conservatives', 'id': '14281853'}, {'start': 83, 'end': 96, 'username': 'BorisJohnson', 'id': '3131144855'}]",1223289439671275521,id: 1223289439671275521,0,0,0,413,"[{'type': 'retweeted', 'id': '1223289260704501760'}]","RT @Conservatives: 🇬🇧 Britain is leaving the EU tonight 🇬🇧

📺 Watch Prime Minister @BorisJohnson’s Address to the Nation on his Facebook pa…",2015-04-01T20:15:49.000Z,Prime Minister of the United Kingdom and @Conservatives leader. Member of Parliament for Uxbridge and South Ruislip.,3131144855,Boris Johnson,4481059,459,10421,5833,BorisJohnson,True
5,3131144855,author_id: 3131144855,conv_id: 1223223151125024768,1223223151125024768,2020-01-31T12:35:00.000Z,,1223223151125024768,id: 1223223151125024768,13226,598,3168,2593,,"This government will unite and level up our country.

And as we build a new relationship with the EU, I urge everyone to find closure and let the healing begin. https://t.co/DnEdK4uiKY",2015-04-01T20:15:49.000Z,Prime Minister of the United Kingdom and @Conservatives leader. Member of Parliament for Uxbridge and South Ruislip.,3131144855,Boris Johnson,4481059,459,10421,5833,BorisJohnson,True
6,3131144855,author_id: 3131144855,conv_id: 1223217041735409665,1223217041735409665,2020-01-31T12:10:43.000Z,,1223217041735409665,id: 1223217041735409665,7876,302,1701,1376,,"Tonight at 10pm I’ll be giving an address to the nation, which you can watch on my Facebook page: https://t.co/ido2hy9GGX",2015-04-01T20:15:49.000Z,Prime Minister of the United Kingdom and @Conservatives leader. Member of Parliament for Uxbridge and South Ruislip.,3131144855,Boris Johnson,4481059,459,10421,5833,BorisJohnson,True
7,3131144855,author_id: 3131144855,conv_id: 1223216282834755584,1223216282834755584,2020-01-31T12:07:42.000Z,"[{'start': 3, 'end': 17, 'username': 'Conservatives', 'id': '14281853'}, {'start': 102, 'end': 115, 'username': 'BorisJohnson', 'id': '3131144855'}]",1223216282834755584,id: 1223216282834755584,0,0,0,286,"[{'type': 'retweeted', 'id': '1223210815903485952'}]","RT @Conservatives: 💬 What: The Prime Minister's Address to the Nation.
⏰ When: 10pm tonight.
📲 Where: @BorisJohnson's Facebook page.

#Brex…",2015-04-01T20:15:49.000Z,Prime Minister of the United Kingdom and @Conservatives leader. Member of Parliament for Uxbridge and South Ruislip.,3131144855,Boris Johnson,4481059,459,10421,5833,BorisJohnson,True
8,3131144855,author_id: 3131144855,conv_id: 1223167616044478464,1223167616044478464,2020-01-31T08:54:19.000Z,"[{'start': 3, 'end': 19, 'username': '10DowningStreet', 'id': '14224719'}]",1223167616044478464,id: 1223167616044478464,0,0,0,2650,"[{'type': 'retweeted', 'id': '1223162184181669888'}]",RT @10DowningStreet: Today is the day the UK is leaving the EU. https://t.co/Zuhzl0l5sT,2015-04-01T20:15:49.000Z,Prime Minister of the United Kingdom and @Conservatives leader. Member of Parliament for Uxbridge and South Ruislip.,3131144855,Boris Johnson,4481059,459,10421,5833,BorisJohnson,True
9,3131144855,author_id: 3131144855,conv_id: 1223005872361758721,1223005872361758721,2020-01-30T22:11:36.000Z,"[{'start': 3, 'end': 19, 'username': '10DowningStreet', 'id': '14224719'}, {'start': 30, 'end': 43, 'username': 'BorisJohnson', 'id': '3131144855'}]",1223005872361758721,id: 1223005872361758721,0,0,0,488,"[{'type': 'retweeted', 'id': '1223005521550114816'}]",RT @10DowningStreet: Today PM @BorisJohnson hosted a Kids' Question Time at Downing Street. Watch what happened here. https://t.co/qvqzaq64…,2015-04-01T20:15:49.000Z,Prime Minister of the United Kingdom and @Conservatives leader. Member of Parliament for Uxbridge and South Ruislip.,3131144855,Boris Johnson,4481059,459,10421,5833,BorisJohnson,True
10,3131144855,author_id: 3131144855,conv_id: 1222954956044623872,1222954956044623872,2020-01-30T18:49:17.000Z,,1222954956044623872,id: 1222954956044623872,3362,106,626,478,,"Today I invited children from across our country to Downing Street to ask me their questions about the future of the UK. 

We spoke about climate change, the NHS, education, science, tech and much more. https://t.co/R7UFhmYB4Q",2015-04-01T20:15:49.000Z,Prime Minister of the United Kingdom and @Conservatives leader. Member of Parliament for Uxbridge and South Ruislip.,3131144855,Boris Johnson,4481059,459,10421,5833,BorisJohnson,True
11,3131144855,author_id: 3131144855,conv_id: 1222869992728932352,1222869992728932352,2020-01-30T13:11:40.000Z,"[{'start': 3, 'end': 19, 'username': '10DowningStreet', 'id': '14224719'}]",1222869992728932352,id: 1222869992728932352,0,0,0,1388,"[{'type': 'retweeted', 'id': '1222867409381490693'}]",RT @10DowningStreet: Tomorrow at 11pm the UK will leave the EU. The countdown is on. https://t.co/vt4OUbpy61,2015-04-01T20:15:49.000Z,Prime Minister of the United Kingdom and @Conservatives leader. Member of Parliament for Uxbridge and South Ruislip.,3131144855,Boris Johnson,4481059,459,10421,5833,BorisJohnson,True
12,3131144855,author_id: 3131144855,conv_id: 1222842823826866178,1222842823826866178,2020-01-30T11:23:43.000Z,"[{'start': 3, 'end': 17, 'username': 'Conservatives', 'id': '14281853'}]",1222842823826866178,id: 1222842823826866178,0,0,0,408,"[{'type': 'retweeted', 'id': '1222841657864921088'}]","RT @Conservatives: 🗣 The Prime Minister will address the nation from 10 Downing Street on Friday night.

📲 Tune in from 10pm on @BorisJohns…",2015-04-01T20:15:49.000Z,Prime Minister of the United Kingdom and @Conservatives leader. Member of Parliament for Uxbridge and South Ruislip.,3131144855,Boris Johnson,4481059,459,10421,5833,BorisJohnson,True
13,3131144855,author_id: 3131144855,conv_id: 1222792312121647104,1222792312121647104,2020-01-30T08:03:00.000Z,,1222792312121647104,id: 1222792312121647104,5527,405,1587,984,,We're going to tackle homelessness by addressing its root causes. #PeoplesPMQS https://t.co/2UpzVlSBfh,2015-04-01T20:15:49.000Z,Prime Minister of the United Kingdom and @Conservatives leader. Member of Parliament for Uxbridge and South Ruislip.,3131144855,Boris Johnson,4481059,459,10421,5833,BorisJohnson,True
14,3131144855,author_id: 3131144855,conv_id: 1222630495944466434,1222630495944466434,2020-01-29T21:20:00.000Z,,1222630495944466434,id: 1222630495944466434,3617,123,602,611,,Youth knife crime is a massive issue for this country. We need to tackle it. #PeoplesPMQs https://t.co/R6JYU0OIcw,2015-04-01T20:15:49.000Z,Prime Minister of the United Kingdom and @Conservatives leader. Member of Parliament for Uxbridge and South Ruislip.,3131144855,Boris Johnson,4481059,459,10421,5833,BorisJohnson,True
15,3131144855,author_id: 3131144855,conv_id: 1222609873051029504,1222609873051029504,2020-01-29T19:58:03.000Z,,1222609873051029504,id: 1222609873051029504,6140,213,924,1229,,What I will be doing when we leave the EU at 11pm this Friday. #PeoplesPMQs https://t.co/KrQ4C2f6Oe,2015-04-01T20:15:49.000Z,Prime Minister of the United Kingdom and @Conservatives leader. Member of Parliament for Uxbridge and South Ruislip.,3131144855,Boris Johnson,4481059,459,10421,5833,BorisJohnson,True
16,3131144855,author_id: 3131144855,conv_id: 1222593769083736064,1222593769083736064,2020-01-29T18:54:03.000Z,,1222593769083736064,id: 1222593769083736064,1373,25,217,190,,"Thank you for your questions this evening for the #PeoplesPMQs. 

Tune in for my address this Friday at 10pm. https://t.co/FHyNQJ4AUN",2015-04-01T20:15:49.000Z,Prime Minister of the United Kingdom and @Conservatives leader. Member of Parliament for Uxbridge and South Ruislip.,3131144855,Boris Johnson,4481059,459,10421,5833,BorisJohnson,True
17,3131144855,author_id: 3131144855,conv_id: 1222565223648890880,1222565223648890880,2020-01-29T17:00:38.000Z,,1222565223648890880,id: 1222565223648890880,1839,71,840,428,,I’m answering your questions live from Downing Street https://t.co/Cu20XxEkaL,2015-04-01T20:15:49.000Z,Prime Minister of the United Kingdom and @Conservatives leader. Member of Parliament for Uxbridge and South Ruislip.,3131144855,Boris Johnson,4481059,459,10421,5833,BorisJohnson,True
18,3131144855,author_id: 3131144855,conv_id: 1222507286444281856,1222507286444281856,2020-01-29T13:10:24.000Z,"[{'start': 3, 'end': 17, 'username': 'Conservatives', 'id': '14281853'}]",1222507286444281856,id: 1222507286444281856,0,0,0,426,"[{'type': 'retweeted', 'id': '1222473413467557888'}]","RT @Conservatives: 2 days.
👇
Until #BrexitDay 
👇
We're getting it done. https://t.co/0bf7Uidnrc",2015-04-01T20:15:49.000Z,Prime Minister of the United Kingdom and @Conservatives leader. Member of Parliament for Uxbridge and South Ruislip.,3131144855,Boris Johnson,4481059,459,10421,5833,BorisJohnson,True
19,3131144855,author_id: 3131144855,conv_id: 1222280472132308993,1222280472132308993,2020-01-28T22:09:08.000Z,,1222280472132308993,id: 1222280472132308993,10132,940,2641,2404,,"“Will Brexit affect my holiday?”
 
I’ve answered some of your top searched questions about Brexit and what happens when we leave the EU on Friday. https://t.co/3LelRgfFPb",2015-04-01T20:15:49.000Z,Prime Minister of the United Kingdom and @Conservatives leader. Member of Parliament for Uxbridge and South Ruislip.,3131144855,Boris Johnson,4481059,459,10421,5833,BorisJohnson,True
20,3131144855,author_id: 3131144855,conv_id: 1222204658241982464,1222204658241982464,2020-01-28T17:07:52.000Z,,1222204658241982464,id: 1222204658241982464,1803,115,996,391,,"🎙 Get ready for another #PeoplesPMQs, 5pm tomorrow night!

💬 Send me your questions here:  https://t.co/wr6740CPjj https://t.co/orxegNtTyB",2015-04-01T20:15:49.000Z,Prime Minister of the United Kingdom and @Conservatives leader. Member of Parliament for Uxbridge and South Ruislip.,3131144855,Boris Johnson,4481059,459,10421,5833,BorisJohnson,True
21,3131144855,author_id: 3131144855,conv_id: 1222107272010260481,1222107272010260481,2020-01-28T10:40:53.000Z,"[{'start': 19, 'end': 32, 'username': 'BorisJohnson', 'id': '3131144855'}]",1222107272010260481,id: 1222107272010260481,0,0,0,150,"[{'type': 'retweeted', 'id': '1222096366303956993'}]","RT @InvestInGREAT: @BorisJohnson has just announced that a fast-track ""global talent"" visa will launch on Feb 20th to simplify entry to the…",2015-04-01T20:15:49.000Z,Prime Minister of the United Kingdom and @Conservatives leader. Member of Parliament for Uxbridge and South Ruislip.,3131144855,Boris Johnson,4481059,459,10421,5833,BorisJohnson,True
22,3131144855,author_id: 3131144855,conv_id: 1222071582190907392,1222071582190907392,2020-01-28T08:19:04.000Z,"[{'start': 22, 'end': 33, 'username': 'sainsburys', 'id': '80685646'}]",1222071582190907392,id: 1222071582190907392,2116,73,425,302,"[{'type': 'quoted', 'id': '1222056719326552064'}]","I’m delighted to hear @Sainsburys is leading the way for UK business by pledging to go carbon neutral, backed by significant investment. We must all work together to achieve Net Zero emissions. https://t.co/slrlvp1EKy",2015-04-01T20:15:49.000Z,Prime Minister of the United Kingdom and @Conservatives leader. Member of Parliament for Uxbridge and South Ruislip.,3131144855,Boris Johnson,4481059,459,10421,5833,BorisJohnson,True
23,3131144855,author_id: 3131144855,conv_id: 1222063761399468034,1222063761399468034,2020-01-28T07:48:00.000Z,"[{'start': 19, 'end': 35, 'username': 'kingsmathschool', 'id': '1560373122'}]",1222063761399468034,id: 1222063761399468034,1443,29,193,231,,"Fantastic to visit @kingsmathschool yesterday and meet with these bright students and their teachers. 

We’re making an extra £300 million available for research into advanced mathematics, and will introduce a new fast track visa system to welcome more scientists to the UK. https://t.co/uLF6dRmwlQ",2015-04-01T20:15:49.000Z,Prime Minister of the United Kingdom and @Conservatives leader. Member of Parliament for Uxbridge and South Ruislip.,3131144855,Boris Johnson,4481059,459,10421,5833,BorisJohnson,True
24,3131144855,author_id: 3131144855,conv_id: 1221897818400534528,1221897818400534528,2020-01-27T20:48:36.000Z,"[{'start': 3, 'end': 19, 'username': '10DowningStreet', 'id': '14224719'}, {'start': 24, 'end': 37, 'username': 'BorisJohnson', 'id': '3131144855'}, {'start': 122, 'end': 137, 'username': 'SirBenHelfgott', 'id': '1007620810641637380'}]",1221897818400534528,id: 1221897818400534528,0,0,0,284,"[{'type': 'retweeted', 'id': '1221897771902558208'}]","RT @10DowningStreet: PM @BorisJohnson met survivors at the UK Commemorative Ceremony for #HolocaustMemorialDay, including @SirBenHelfgott.…",2015-04-01T20:15:49.000Z,Prime Minister of the United Kingdom and @Conservatives leader. Member of Parliament for Uxbridge and South Ruislip.,3131144855,Boris Johnson,4481059,459,10421,5833,BorisJohnson,True
25,3131144855,author_id: 3131144855,conv_id: 1221777112664891393,1221777112664891393,2020-01-27T12:48:57.000Z,,1221777112664891393,id: 1221777112664891393,17603,666,3226,2794,,"As long as I am Prime Minister, I will never allow this country to forget what happened 75 years ago. I will do all I can to see that we continue to learn the lessons of the past. 

#HolocaustRemembranceDay 

https://t.co/wp7t49CPfr",2015-04-01T20:15:49.000Z,Prime Minister of the United Kingdom and @Conservatives leader. Member of Parliament for Uxbridge and South Ruislip.,3131144855,Boris Johnson,4481059,459,10421,5833,BorisJohnson,True
26,3131144855,author_id: 3131144855,conv_id: 1221766062917681152,1221766062917681152,2020-01-27T12:05:03.000Z,,1221766062917681152,id: 1221766062917681152,3539,49,210,761,,"I was truly honoured to meet Mala Tribich MBE and hear her story of surviving the horrors of the Holocaust. 

We should all listen to her message, remember and commit ourselves to ensuring that this never happens again.

#HolocaustMemorialDay #WeRemember https://t.co/wGdmJZR42J",2015-04-01T20:15:49.000Z,Prime Minister of the United Kingdom and @Conservatives leader. Member of Parliament for Uxbridge and South Ruislip.,3131144855,Boris Johnson,4481059,459,10421,5833,BorisJohnson,True
27,3131144855,author_id: 3131144855,conv_id: 1221214176477097985,1221214176477097985,2020-01-25T23:32:03.000Z,,1221214176477097985,id: 1221214176477097985,15093,160,736,1944,,"This Australia Day, I want all our Aussie friends to know that we Brits are thinking of you. Your resilience &amp; positive spirit has been an inspiration to us all. 
 
Our two nations share a very special friendship that I hope will continue to strengthen. Happy Australia Day.",2015-04-01T20:15:49.000Z,Prime Minister of the United Kingdom and @Conservatives leader. Member of Parliament for Uxbridge and South Ruislip.,3131144855,Boris Johnson,4481059,459,10421,5833,BorisJohnson,True
28,3131144855,author_id: 3131144855,conv_id: 1221088373496012802,1221088373496012802,2020-01-25T15:12:09.000Z,"[{'start': 3, 'end': 19, 'username': '10DowningStreet', 'id': '14224719'}, {'start': 55, 'end': 68, 'username': 'BorisJohnson', 'id': '3131144855'}]",1221088373496012802,id: 1221088373496012802,0,0,0,370,"[{'type': 'retweeted', 'id': '1220772352138543106'}]","RT @10DowningStreet: To celebrate Chinese New Year, PM @BorisJohnson dotted the eye of the lion and tried his hand at Chinese calligraphy w…",2015-04-01T20:15:49.000Z,Prime Minister of the United Kingdom and @Conservatives leader. Member of Parliament for Uxbridge and South Ruislip.,3131144855,Boris Johnson,4481059,459,10421,5833,BorisJohnson,True
29,3131144855,author_id: 3131144855,conv_id: 1221088290935316487,1221088290935316487,2020-01-25T15:11:49.000Z,"[{'start': 3, 'end': 19, 'username': '10DowningStreet', 'id': '14224719'}]",1221088290935316487,id: 1221088290935316487,0,0,0,475,"[{'type': 'retweeted', 'id': '1221085307094929409'}]",RT @10DowningStreet: A very happy #BurnsNight from Downing Street🏴󠁧󠁢󠁳󠁣󠁴󠁿 https://t.co/Q29SaOQIC4,2015-04-01T20:15:49.000Z,Prime Minister of the United Kingdom and @Conservatives leader. Member of Parliament for Uxbridge and South Ruislip.,3131144855,Boris Johnson,4481059,459,10421,5833,BorisJohnson,True
30,3131144855,author_id: 3131144855,conv_id: 1220789046059982849,1220789046059982849,2020-01-24T19:22:44.000Z,,1220789046059982849,id: 1220789046059982849,1424,12,89,168,,"Seamus Mallon made an extraordinary contribution to democracy and peace in Northern Ireland. I want to express my sincere condolences to his daughter Orla, to his family and friends and to the SDLP.",2015-04-01T20:15:49.000Z,Prime Minister of the United Kingdom and @Conservatives leader. Member of Parliament for Uxbridge and South Ruislip.,3131144855,Boris Johnson,4481059,459,10421,5833,BorisJohnson,True
31,3131144855,author_id: 3131144855,conv_id: 1220759425868275712,1220759425868275712,2020-01-24T17:25:02.000Z,,1220759425868275712,id: 1220759425868275712,41774,2594,7886,7744,,"Today I have signed the Withdrawal Agreement for the UK to leave the EU on January 31st, honouring the democratic mandate of the British people. 
 
This signature heralds a new chapter in our nation’s history. https://t.co/IaGTeeL2is",2015-04-01T20:15:49.000Z,Prime Minister of the United Kingdom and @Conservatives leader. Member of Parliament for Uxbridge and South Ruislip.,3131144855,Boris Johnson,4481059,459,10421,5833,BorisJohnson,True
32,3131144855,author_id: 3131144855,conv_id: 1220438324952825856,1220438324952825856,2020-01-23T20:09:05.000Z,"[{'start': 3, 'end': 19, 'username': '10DowningStreet', 'id': '14224719'}, {'start': 63, 'end': 76, 'username': 'BorisJohnson', 'id': '3131144855'}]",1220438324952825856,id: 1220438324952825856,0,0,0,254,"[{'type': 'retweeted', 'id': '1220311201223192576'}]","RT @10DowningStreet: ""I believe in keeping numbers high."" – PM @BorisJohnson answers Tyrone's question on recruiting more police officers i…",2015-04-01T20:15:49.000Z,Prime Minister of the United Kingdom and @Conservatives leader. Member of Parliament for Uxbridge and South Ruislip.,3131144855,Boris Johnson,4481059,459,10421,5833,BorisJohnson,True
33,3131144855,author_id: 3131144855,conv_id: 1220415200383381506,1220415200383381506,2020-01-23T18:37:12.000Z,,1220415200383381506,id: 1220415200383381506,73487,3276,6765,15535,,The Withdrawal Agreement has received Royal Assent and is now law. We will leave the EU on January 31st 🇬🇧,2015-04-01T20:15:49.000Z,Prime Minister of the United Kingdom and @Conservatives leader. Member of Parliament for Uxbridge and South Ruislip.,3131144855,Boris Johnson,4481059,459,10421,5833,BorisJohnson,True
34,3131144855,author_id: 3131144855,conv_id: 1220339001007190016,1220339001007190016,2020-01-23T13:34:25.000Z,,1220339001007190016,id: 1220339001007190016,6196,243,1124,998,,"We’re recruiting 20,000 more police and giving them the powers they need to tackle crime. #PeoplesPMQs https://t.co/EgPqR0wtup",2015-04-01T20:15:49.000Z,Prime Minister of the United Kingdom and @Conservatives leader. Member of Parliament for Uxbridge and South Ruislip.,3131144855,Boris Johnson,4481059,459,10421,5833,BorisJohnson,True
35,3131144855,author_id: 3131144855,conv_id: 1220335871725051904,1220335871725051904,2020-01-23T13:21:59.000Z,"[{'start': 3, 'end': 19, 'username': '10DowningStreet', 'id': '14224719'}, {'start': 53, 'end': 66, 'username': 'BorisJohnson', 'id': '3131144855'}]",1220335871725051904,id: 1220335871725051904,0,0,0,1131,"[{'type': 'retweeted', 'id': '1220086793434996736'}]","RT @10DowningStreet: ""What shampoo do you use?"" - PM @BorisJohnson answers your questions for #PeoplesPMQs https://t.co/Szy7PpN58h",2015-04-01T20:15:49.000Z,Prime Minister of the United Kingdom and @Conservatives leader. Member of Parliament for Uxbridge and South Ruislip.,3131144855,Boris Johnson,4481059,459,10421,5833,BorisJohnson,True
36,3131144855,author_id: 3131144855,conv_id: 1220052859858886656,1220052859858886656,2020-01-22T18:37:23.000Z,,1220052859858886656,id: 1220052859858886656,2229,43,401,255,,Thank you for your questions. See you again next week #PeoplesPMQs https://t.co/wc1uZhkaTg,2015-04-01T20:15:49.000Z,Prime Minister of the United Kingdom and @Conservatives leader. Member of Parliament for Uxbridge and South Ruislip.,3131144855,Boris Johnson,4481059,459,10421,5833,BorisJohnson,True
37,3131144855,author_id: 3131144855,conv_id: 1220029136552579073,1220029136552579073,2020-01-22T17:03:07.000Z,,1220029136552579073,id: 1220029136552579073,3225,206,1648,800,,LIVE: I'm answering your questions from Downing Street https://t.co/WoBwpJgjiV,2015-04-01T20:15:49.000Z,Prime Minister of the United Kingdom and @Conservatives leader. Member of Parliament for Uxbridge and South Ruislip.,3131144855,Boris Johnson,4481059,459,10421,5833,BorisJohnson,True
38,3131144855,author_id: 3131144855,conv_id: 1220001476203941888,1220001476203941888,2020-01-22T15:13:13.000Z,"[{'start': 3, 'end': 17, 'username': 'Conservatives', 'id': '14281853'}, {'start': 21, 'end': 34, 'username': 'BorisJohnson', 'id': '3131144855'}]",1220001476203941888,id: 1220001476203941888,0,0,0,548,"[{'type': 'retweeted', 'id': '1219999630190096390'}]","RT @Conservatives: 🗣 @BorisJohnson at #PMQs: ""He should pay tribute to all the people who by their hard work found fantastic jobs over the…",2015-04-01T20:15:49.000Z,Prime Minister of the United Kingdom and @Conservatives leader. Member of Parliament for Uxbridge and South Ruislip.,3131144855,Boris Johnson,4481059,459,10421,5833,BorisJohnson,True
39,3131144855,author_id: 3131144855,conv_id: 1219970119893471234,1219970119893471234,2020-01-22T13:08:37.000Z,,1219970119893471234,id: 1219970119893471234,1579,78,705,352,,"🎙 Get ready for another #PeoplesPMQs at 5pm today!

💬 Send me your questions here: https://t.co/4gBIkrPJHh https://t.co/1KpndoISUV",2015-04-01T20:15:49.000Z,Prime Minister of the United Kingdom and @Conservatives leader. Member of Parliament for Uxbridge and South Ruislip.,3131144855,Boris Johnson,4481059,459,10421,5833,BorisJohnson,True
40,3131144855,author_id: 3131144855,conv_id: 1219937602373148672,1219937602373148672,2020-01-22T10:59:24.000Z,"[{'start': 3, 'end': 13, 'username': 'DefenceHQ', 'id': '16133530'}]",1219937602373148672,id: 1219937602373148672,0,0,0,403,"[{'type': 'retweeted', 'id': '1219883658053607424'}]",RT @DefenceHQ: A new veterans' railcard will help hundreds of thousands of former personnel save on rail fares. The money-saving card will…,2015-04-01T20:15:49.000Z,Prime Minister of the United Kingdom and @Conservatives leader. Member of Parliament for Uxbridge and South Ruislip.,3131144855,Boris Johnson,4481059,459,10421,5833,BorisJohnson,True
