,author_id,author_id_new,conv_id_new,conversation_id,created_at,entities.mentions,id,id_new,public_metrics.like_count,public_metrics.quote_count,public_metrics.reply_count,public_metrics.retweet_count,referenced_tweets,text,users.created_at,users.description,users.id,users.name,users.public_metrics.followers_count,users.public_metrics.following_count,users.public_metrics.listed_count,users.public_metrics.tweet_count,users.username,users.verified
407,3131144855,author_id: 3131144855,conv_id: 1200084685675585536,1200084685675585536,2019-11-28T16:11:00.000Z,,1200084685675585536,id: 1200084685675585536,8885,201,1621,1187,,Back me to get Brexit done - vote Conservative on December 12th!,2015-04-01T20:15:49.000Z,Prime Minister of the United Kingdom and @Conservatives leader. Member of Parliament for Uxbridge and South Ruislip.,3131144855,Boris Johnson,4481059,459,10421,5833,BorisJohnson,True
408,3131144855,author_id: 3131144855,conv_id: 1200078605486841857,1200078605486841857,2019-11-28T15:46:50.000Z,"[{'start': 3, 'end': 12, 'username': 'trussliz', 'id': '65357102'}, {'start': 47, 'end': 60, 'username': 'BorisJohnson', 'id': '3131144855'}, {'start': 79, 'end': 95, 'username': 'PlymouthRebecca', 'id': '316349960'}]",1200078605486841857,id: 1200078605486841857,0,0,0,161,"[{'type': 'retweeted', 'id': '1200078385046806529'}]","RT @trussliz: Brilliant to be in Plymouth with @BorisJohnson, Vicky Atkins and @PlymouthRebecca for the unveiling of Nancy Astor statue, ce…",2015-04-01T20:15:49.000Z,Prime Minister of the United Kingdom and @Conservatives leader. Member of Parliament for Uxbridge and South Ruislip.,3131144855,Boris Johnson,4481059,459,10421,5833,BorisJohnson,True
409,3131144855,author_id: 3131144855,conv_id: 1200078142939029504,1200078142939029504,2019-11-28T15:45:00.000Z,,1200078142939029504,id: 1200078142939029504,1253,30,271,247,,We want you to keep more of your hard earned money. https://t.co/1LVCcMZzB2,2015-04-01T20:15:49.000Z,Prime Minister of the United Kingdom and @Conservatives leader. Member of Parliament for Uxbridge and South Ruislip.,3131144855,Boris Johnson,4481059,459,10421,5833,BorisJohnson,True
410,3131144855,author_id: 3131144855,conv_id: 1200069624823517185,1200069624823517185,2019-11-28T15:11:09.000Z,"[{'start': 3, 'end': 17, 'username': 'Conservatives', 'id': '14281853'}]",1200069624823517185,id: 1200069624823517185,0,0,0,128,"[{'type': 'retweeted', 'id': '1200068210273509381'}]","RT @Conservatives: 🔴 REC. 
📺 You won’t want to miss this. https://t.co/IXXUEpQJ5Q",2015-04-01T20:15:49.000Z,Prime Minister of the United Kingdom and @Conservatives leader. Member of Parliament for Uxbridge and South Ruislip.,3131144855,Boris Johnson,4481059,459,10421,5833,BorisJohnson,True
411,3131144855,author_id: 3131144855,conv_id: 1200037626008363008,1200037626008363008,2019-11-28T13:04:00.000Z,,1200037626008363008,id: 1200037626008363008,4232,132,887,998,,"Our NHS will never be on the table for any trade negotiations. We’re investing more than ever before - and when we leave the EU, we will introduce an Australian style, points-based immigration system so the NHS can plan for the future. https://t.co/6mJfaLoFyu",2015-04-01T20:15:49.000Z,Prime Minister of the United Kingdom and @Conservatives leader. Member of Parliament for Uxbridge and South Ruislip.,3131144855,Boris Johnson,4481059,459,10421,5833,BorisJohnson,True
412,3131144855,author_id: 3131144855,conv_id: 1200010194908000256,1200010194908000256,2019-11-28T11:15:00.000Z,,1200010194908000256,id: 1200010194908000256,6898,236,1684,1003,,"The British people deserve a Parliament that gets Brexit done, so we can move forward and focus on priorities like the NHS, schools and police.",2015-04-01T20:15:49.000Z,Prime Minister of the United Kingdom and @Conservatives leader. Member of Parliament for Uxbridge and South Ruislip.,3131144855,Boris Johnson,4481059,459,10421,5833,BorisJohnson,True
413,3131144855,author_id: 3131144855,conv_id: 1200001638460796928,1200001638460796928,2019-11-28T10:41:00.000Z,,1200001638460796928,id: 1200001638460796928,2224,74,486,553,,The referendum result must be respected 🇬🇧 https://t.co/XfpJ2UaJ0o,2015-04-01T20:15:49.000Z,Prime Minister of the United Kingdom and @Conservatives leader. Member of Parliament for Uxbridge and South Ruislip.,3131144855,Boris Johnson,4481059,459,10421,5833,BorisJohnson,True
414,3131144855,author_id: 3131144855,conv_id: 1199991449028354048,1199991449028354048,2019-11-28T10:00:30.000Z,"[{'start': 3, 'end': 19, 'username': 'DavidDeutschOxf', 'id': '841709695'}]",1199991449028354048,id: 1199991449028354048,0,0,0,132,"[{'type': 'retweeted', 'id': '1199832268820402176'}]","RT @DavidDeutschOxf: He says the Conservative manifesto includes: ""a new high-risk high-payoff research agency, modelled on ARPA and funded…",2015-04-01T20:15:49.000Z,Prime Minister of the United Kingdom and @Conservatives leader. Member of Parliament for Uxbridge and South Ruislip.,3131144855,Boris Johnson,4481059,459,10421,5833,BorisJohnson,True
415,3131144855,author_id: 3131144855,conv_id: 1199986683040731136,1199986683040731136,2019-11-28T09:41:34.000Z,"[{'start': 3, 'end': 17, 'username': 'Conservatives', 'id': '14281853'}, {'start': 22, 'end': 35, 'username': 'BorisJohnson', 'id': '3131144855'}]",1199986683040731136,id: 1199986683040731136,0,0,0,291,"[{'type': 'retweeted', 'id': '1199984345446047744'}]","RT @Conservatives: 🇬🇧 @BorisJohnson: ""Let us seize the opportunity now to get Brexit done and move this country forward.""

#VoteConservativ…",2015-04-01T20:15:49.000Z,Prime Minister of the United Kingdom and @Conservatives leader. Member of Parliament for Uxbridge and South Ruislip.,3131144855,Boris Johnson,4481059,459,10421,5833,BorisJohnson,True
416,3131144855,author_id: 3131144855,conv_id: 1199986658113970176,1199986658113970176,2019-11-28T09:41:28.000Z,,1199986658113970176,id: 1199986658113970176,3973,99,722,743,,"Not long to go. Let's get it done, folks. https://t.co/TDu95dHJFI",2015-04-01T20:15:49.000Z,Prime Minister of the United Kingdom and @Conservatives leader. Member of Parliament for Uxbridge and South Ruislip.,3131144855,Boris Johnson,4481059,459,10421,5833,BorisJohnson,True
417,3131144855,author_id: 3131144855,conv_id: 1199976472821346304,1199976472821346304,2019-11-28T09:01:00.000Z,,1199976472821346304,id: 1199976472821346304,3643,113,708,671,,"We’re going to keep taxes low, raise the national living wage and cut business rates for pubs, shops and cinemas. https://t.co/N7lw6pdqUn",2015-04-01T20:15:49.000Z,Prime Minister of the United Kingdom and @Conservatives leader. Member of Parliament for Uxbridge and South Ruislip.,3131144855,Boris Johnson,4481059,459,10421,5833,BorisJohnson,True
418,3131144855,author_id: 3131144855,conv_id: 1199752245228650496,1199752245228650496,2019-11-27T18:10:00.000Z,,1199752245228650496,id: 1199752245228650496,2612,84,800,480,,We’ll get there folks. https://t.co/ywgraiOwaC,2015-04-01T20:15:49.000Z,Prime Minister of the United Kingdom and @Conservatives leader. Member of Parliament for Uxbridge and South Ruislip.,3131144855,Boris Johnson,4481059,459,10421,5833,BorisJohnson,True
419,3131144855,author_id: 3131144855,conv_id: 1199739945948254213,1199739945948254213,2019-11-27T17:21:07.000Z,,1199739945948254213,id: 1199739945948254213,3390,82,728,637,,When we leave the EU we can take back control of our borders. https://t.co/3z3HrmNFcQ,2015-04-01T20:15:49.000Z,Prime Minister of the United Kingdom and @Conservatives leader. Member of Parliament for Uxbridge and South Ruislip.,3131144855,Boris Johnson,4481059,459,10421,5833,BorisJohnson,True
420,3131144855,author_id: 3131144855,conv_id: 1199704264630788096,1199704264630788096,2019-11-27T14:59:20.000Z,"[{'start': 3, 'end': 17, 'username': 'Conservatives', 'id': '14281853'}]",1199704264630788096,id: 1199704264630788096,0,0,0,1344,"[{'type': 'retweeted', 'id': '1199689252126244865'}]",RT @Conservatives: Ruth tells it like it is: Sturgeon and Corbyn = 2 more Referendums https://t.co/M0appnz3pp,2015-04-01T20:15:49.000Z,Prime Minister of the United Kingdom and @Conservatives leader. Member of Parliament for Uxbridge and South Ruislip.,3131144855,Boris Johnson,4481059,459,10421,5833,BorisJohnson,True
421,3131144855,author_id: 3131144855,conv_id: 1199661145109549056,1199661145109549056,2019-11-27T12:08:00.000Z,,1199661145109549056,id: 1199661145109549056,1928,39,591,353,,The only way we can move on as a country is if we respect the result of the referendum result and get Brexit done. https://t.co/GkmpuTYHk9,2015-04-01T20:15:49.000Z,Prime Minister of the United Kingdom and @Conservatives leader. Member of Parliament for Uxbridge and South Ruislip.,3131144855,Boris Johnson,4481059,459,10421,5833,BorisJohnson,True
422,3131144855,author_id: 3131144855,conv_id: 1199651141962870786,1199651141962870786,2019-11-27T11:28:15.000Z,,1199651141962870786,id: 1199651141962870786,6882,182,994,1531,,"If you work hard to provide for your family and pay your taxes, you should be able to keep a bit more of what you earn.
 
A Conservative government will keep your taxes low - not take more away.

https://t.co/bs3d17yGT5",2015-04-01T20:15:49.000Z,Prime Minister of the United Kingdom and @Conservatives leader. Member of Parliament for Uxbridge and South Ruislip.,3131144855,Boris Johnson,4481059,459,10421,5833,BorisJohnson,True
423,3131144855,author_id: 3131144855,conv_id: 1199651062598250496,1199651062598250496,2019-11-27T11:27:56.000Z,,1199651062598250496,id: 1199651062598250496,1031,12,207,177,,Yesterday I met some brilliant students at the International Aviation Academy. They taught me a thing or two! https://t.co/dEfn9GfExC,2015-04-01T20:15:49.000Z,Prime Minister of the United Kingdom and @Conservatives leader. Member of Parliament for Uxbridge and South Ruislip.,3131144855,Boris Johnson,4481059,459,10421,5833,BorisJohnson,True
424,3131144855,author_id: 3131144855,conv_id: 1199646800413630464,1199646800413630464,2019-11-27T11:11:00.000Z,,1199646800413630464,id: 1199646800413630464,1365,46,435,296,,The Conservatives stand firmly behind the businesses and entrepreneurs who make our country great. https://t.co/jit94LB0Vi,2015-04-01T20:15:49.000Z,Prime Minister of the United Kingdom and @Conservatives leader. Member of Parliament for Uxbridge and South Ruislip.,3131144855,Boris Johnson,4481059,459,10421,5833,BorisJohnson,True
425,3131144855,author_id: 3131144855,conv_id: 1199642351691542528,1199642351691542528,2019-11-27T10:53:19.000Z,,1199642351691542528,id: 1199642351691542528,1955,41,323,334,,The only way we can move on as a country is if we respect the result of the referendum result and get Brexit done. https://t.co/aCLQFlY0bN,2015-04-01T20:15:49.000Z,Prime Minister of the United Kingdom and @Conservatives leader. Member of Parliament for Uxbridge and South Ruislip.,3131144855,Boris Johnson,4481059,459,10421,5833,BorisJohnson,True
426,3131144855,author_id: 3131144855,conv_id: 1199629687795920896,1199629687795920896,2019-11-27T10:03:00.000Z,,1199629687795920896,id: 1199629687795920896,13814,670,2785,2327,,"When people get up at the crack of dawn to prepare their family business, when people take out a mortgage to fund a new venture or risk everything on a new product or try to find a new market - we don’t sneer at them. We cheer for them and ask how we can help.",2015-04-01T20:15:49.000Z,Prime Minister of the United Kingdom and @Conservatives leader. Member of Parliament for Uxbridge and South Ruislip.,3131144855,Boris Johnson,4481059,459,10421,5833,BorisJohnson,True
427,3131144855,author_id: 3131144855,conv_id: 1199617104632336384,1199617104632336384,2019-11-27T09:13:00.000Z,,1199617104632336384,id: 1199617104632336384,3815,684,2640,1040,,"Our NHS will not be on the table for any trade negotiations. 

We’re protecting and strengthening our NHS with more investment and an Australian style, points-based immigration system. https://t.co/E9zu62zjfr",2015-04-01T20:15:49.000Z,Prime Minister of the United Kingdom and @Conservatives leader. Member of Parliament for Uxbridge and South Ruislip.,3131144855,Boris Johnson,4481059,459,10421,5833,BorisJohnson,True
428,3131144855,author_id: 3131144855,conv_id: 1199380208303968257,1199380208303968257,2019-11-26T17:31:39.000Z,,1199380208303968257,id: 1199380208303968257,6977,229,1748,950,,"I want us to get Brexit done so that we can get on with making this the best country in the world to live. 

The greatest place to start a business, to have a family, to get an education - to have a life.",2015-04-01T20:15:49.000Z,Prime Minister of the United Kingdom and @Conservatives leader. Member of Parliament for Uxbridge and South Ruislip.,3131144855,Boris Johnson,4481059,459,10421,5833,BorisJohnson,True
429,3131144855,author_id: 3131144855,conv_id: 1199357896989007873,1199357896989007873,2019-11-26T16:03:00.000Z,,1199357896989007873,id: 1199357896989007873,2541,50,496,463,,Let us seize the opportunity now to get Brexit done and move this country forward. https://t.co/4D1wwQd2cf,2015-04-01T20:15:49.000Z,Prime Minister of the United Kingdom and @Conservatives leader. Member of Parliament for Uxbridge and South Ruislip.,3131144855,Boris Johnson,4481059,459,10421,5833,BorisJohnson,True
430,3131144855,author_id: 3131144855,conv_id: 1199344810533904384,1199344810533904384,2019-11-26T15:11:00.000Z,,1199344810533904384,id: 1199344810533904384,3058,124,756,512,,"An early Christmas present to the country will be to bring the Brexit bill back before the festive break, and get it done! https://t.co/iMajwvuedb",2015-04-01T20:15:49.000Z,Prime Minister of the United Kingdom and @Conservatives leader. Member of Parliament for Uxbridge and South Ruislip.,3131144855,Boris Johnson,4481059,459,10421,5833,BorisJohnson,True
431,3131144855,author_id: 3131144855,conv_id: 1199323167900065792,1199323167900065792,2019-11-26T13:45:00.000Z,,1199323167900065792,id: 1199323167900065792,2422,50,311,435,,"Thank you to everyone who stopped to talk at the Royal Welsh Winter Fair. We’ve got the optimism, energy and drive to get Brexit done and seize the opportunities ahead for our farmers. https://t.co/o7sUrutRUt",2015-04-01T20:15:49.000Z,Prime Minister of the United Kingdom and @Conservatives leader. Member of Parliament for Uxbridge and South Ruislip.,3131144855,Boris Johnson,4481059,459,10421,5833,BorisJohnson,True
432,3131144855,author_id: 3131144855,conv_id: 1199311335785451524,1199311335785451524,2019-11-26T12:57:59.000Z,,1199311335785451524,id: 1199311335785451524,1604,56,466,306,,🇬🇧 https://t.co/OZEc3DcYpE,2015-04-01T20:15:49.000Z,Prime Minister of the United Kingdom and @Conservatives leader. Member of Parliament for Uxbridge and South Ruislip.,3131144855,Boris Johnson,4481059,459,10421,5833,BorisJohnson,True
433,3131144855,author_id: 3131144855,conv_id: 1199298253877129217,1199298253877129217,2019-11-26T12:06:00.000Z,,1199298253877129217,id: 1199298253877129217,2473,40,279,360,,Thank you so much for all your support so far. 16 days to go! https://t.co/qgo0fOYyrI,2015-04-01T20:15:49.000Z,Prime Minister of the United Kingdom and @Conservatives leader. Member of Parliament for Uxbridge and South Ruislip.,3131144855,Boris Johnson,4481059,459,10421,5833,BorisJohnson,True
434,3131144855,author_id: 3131144855,conv_id: 1199283657518788609,1199283657518788609,2019-11-26T11:08:00.000Z,,1199283657518788609,id: 1199283657518788609,1758,75,512,338,,"We’re on your side. We’ll get Parliament working again for you, invest in our NHS and schools, make the streets safer, and keep your taxes low. https://t.co/UkwgzIxYYn",2015-04-01T20:15:49.000Z,Prime Minister of the United Kingdom and @Conservatives leader. Member of Parliament for Uxbridge and South Ruislip.,3131144855,Boris Johnson,4481059,459,10421,5833,BorisJohnson,True
435,3131144855,author_id: 3131144855,conv_id: 1199268809682632704,1199268809682632704,2019-11-26T10:09:00.000Z,,1199268809682632704,id: 1199268809682632704,2793,59,483,553,,It’s time for us to get Brexit done so we can get on with the priorities of the British people. https://t.co/L6ssbwnnIW,2015-04-01T20:15:49.000Z,Prime Minister of the United Kingdom and @Conservatives leader. Member of Parliament for Uxbridge and South Ruislip.,3131144855,Boris Johnson,4481059,459,10421,5833,BorisJohnson,True
436,3131144855,author_id: 3131144855,conv_id: 1199253961775165440,1199253961775165440,2019-11-26T09:10:00.000Z,,1199253961775165440,id: 1199253961775165440,1532,43,370,315,,"The only way to move this country forward is with a majority Conservative government. 

We will pass the Brexit deal and get Parliament working for you again. https://t.co/0wMEtPvBtG",2015-04-01T20:15:49.000Z,Prime Minister of the United Kingdom and @Conservatives leader. Member of Parliament for Uxbridge and South Ruislip.,3131144855,Boris Johnson,4481059,459,10421,5833,BorisJohnson,True
437,3131144855,author_id: 3131144855,conv_id: 1199247873365479425,1199247873365479425,2019-11-26T08:45:48.000Z,"[{'start': 3, 'end': 17, 'username': 'Conservatives', 'id': '14281853'}]",1199247873365479425,id: 1199247873365479425,0,0,0,242,"[{'type': 'retweeted', 'id': '1199239617213554688'}]","RT @Conservatives: ""If there is a majority of Conservative MPs on December 13th, I guarantee I will get our new deal through Parliament. We…",2015-04-01T20:15:49.000Z,Prime Minister of the United Kingdom and @Conservatives leader. Member of Parliament for Uxbridge and South Ruislip.,3131144855,Boris Johnson,4481059,459,10421,5833,BorisJohnson,True
438,3131144855,author_id: 3131144855,conv_id: 1199240120685088770,1199240120685088770,2019-11-26T08:15:00.000Z,,1199240120685088770,id: 1199240120685088770,1953,153,791,352,,"We will deliver: 

✅ Extra funding for the NHS

✅ 50,000 more nurses

✅ 50 million more GP surgery appointments a year https://t.co/5jW7WbKjZI",2015-04-01T20:15:49.000Z,Prime Minister of the United Kingdom and @Conservatives leader. Member of Parliament for Uxbridge and South Ruislip.,3131144855,Boris Johnson,4481059,459,10421,5833,BorisJohnson,True
439,3131144855,author_id: 3131144855,conv_id: 1199087112785715202,1199087112785715202,2019-11-25T22:07:00.000Z,,1199087112785715202,id: 1199087112785715202,14194,728,4148,1981,,"Imagine the relief the whole nation will feel if we get Brexit done. Uncertainty ended, investment unlocked, a nation moving forward once again. This is only possible with the Conservatives.",2015-04-01T20:15:49.000Z,Prime Minister of the United Kingdom and @Conservatives leader. Member of Parliament for Uxbridge and South Ruislip.,3131144855,Boris Johnson,4481059,459,10421,5833,BorisJohnson,True
440,3131144855,author_id: 3131144855,conv_id: 1199072264517386240,1199072264517386240,2019-11-25T21:08:00.000Z,,1199072264517386240,id: 1199072264517386240,2967,79,527,494,,"Let's unleash Britain's potential and make this the greatest country in the world to live. 

https://t.co/RhpM0SRL7o",2015-04-01T20:15:49.000Z,Prime Minister of the United Kingdom and @Conservatives leader. Member of Parliament for Uxbridge and South Ruislip.,3131144855,Boris Johnson,4481059,459,10421,5833,BorisJohnson,True
441,3131144855,author_id: 3131144855,conv_id: 1199060263095488513,1199060263095488513,2019-11-25T20:20:18.000Z,"[{'start': 3, 'end': 16, 'username': 'BorisJohnson', 'id': '3131144855'}]",1199060263095488513,id: 1199060263095488513,0,0,0,708,"[{'type': 'retweeted', 'id': '1198958533351497728'}]","RT @BorisJohnson: In Wales for the Royal Welsh Winter Fair, meeting farmers who want to get Brexit done👍 https://t.co/1p3QeG805k",2015-04-01T20:15:49.000Z,Prime Minister of the United Kingdom and @Conservatives leader. Member of Parliament for Uxbridge and South Ruislip.,3131144855,Boris Johnson,4481059,459,10421,5833,BorisJohnson,True
442,3131144855,author_id: 3131144855,conv_id: 1199017404203974664,1199017404203974664,2019-11-25T17:30:00.000Z,,1199017404203974664,id: 1199017404203974664,1871,48,538,364,,It’s time to unleash Britain’s potential https://t.co/KsVMEDTWyF,2015-04-01T20:15:49.000Z,Prime Minister of the United Kingdom and @Conservatives leader. Member of Parliament for Uxbridge and South Ruislip.,3131144855,Boris Johnson,4481059,459,10421,5833,BorisJohnson,True
443,3131144855,author_id: 3131144855,conv_id: 1199009525480787968,1199009525480787968,2019-11-25T16:58:42.000Z,"[{'start': 3, 'end': 17, 'username': 'Conservatives', 'id': '14281853'}]",1199009525480787968,id: 1199009525480787968,0,0,0,214,"[{'type': 'retweeted', 'id': '1199009399903260672'}]","RT @Conservatives: The 2019 #ConservativeManifesto📘 focuses on the people's priorities. 

🗳👉 #VoteConservative to get Brexit done, invest i…",2015-04-01T20:15:49.000Z,Prime Minister of the United Kingdom and @Conservatives leader. Member of Parliament for Uxbridge and South Ruislip.,3131144855,Boris Johnson,4481059,459,10421,5833,BorisJohnson,True
444,3131144855,author_id: 3131144855,conv_id: 1198981164469325824,1198981164469325824,2019-11-25T15:06:00.000Z,,1198981164469325824,id: 1198981164469325824,2519,140,709,527,,We’re providing financial security for those in retirement. https://t.co/zdFRVHAfQ0,2015-04-01T20:15:49.000Z,Prime Minister of the United Kingdom and @Conservatives leader. Member of Parliament for Uxbridge and South Ruislip.,3131144855,Boris Johnson,4481059,459,10421,5833,BorisJohnson,True
445,3131144855,author_id: 3131144855,conv_id: 1198966859950940160,1198966859950940160,2019-11-25T14:09:09.000Z,,1198966859950940160,id: 1198966859950940160,1529,35,226,294,,Had a great time at the Royal Welsh Winter show today. We're going to look after farmers across the country as we embrace the opportunities of Brexit. https://t.co/Nl62RiibfY,2015-04-01T20:15:49.000Z,Prime Minister of the United Kingdom and @Conservatives leader. Member of Parliament for Uxbridge and South Ruislip.,3131144855,Boris Johnson,4481059,459,10421,5833,BorisJohnson,True
446,3131144855,author_id: 3131144855,conv_id: 1198958533351497728,1198958533351497728,2019-11-25T13:36:04.000Z,,1198958533351497728,id: 1198958533351497728,4256,122,678,708,,"In Wales for the Royal Welsh Winter Fair, meeting farmers who want to get Brexit done👍 https://t.co/1p3QeG805k",2015-04-01T20:15:49.000Z,Prime Minister of the United Kingdom and @Conservatives leader. Member of Parliament for Uxbridge and South Ruislip.,3131144855,Boris Johnson,4481059,459,10421,5833,BorisJohnson,True
447,3131144855,author_id: 3131144855,conv_id: 1198952223872389123,1198952223872389123,2019-11-25T13:11:00.000Z,,1198952223872389123,id: 1198952223872389123,1484,31,344,242,,"Let’s get Brexit done and focus on the issues that matter to you and your family - making your streets safer, investing in our NHS, and helping you with the cost of living. https://t.co/30FyVZldcA",2015-04-01T20:15:49.000Z,Prime Minister of the United Kingdom and @Conservatives leader. Member of Parliament for Uxbridge and South Ruislip.,3131144855,Boris Johnson,4481059,459,10421,5833,BorisJohnson,True
448,3131144855,author_id: 3131144855,conv_id: 1198938130797252609,1198938130797252609,2019-11-25T12:15:00.000Z,,1198938130797252609,id: 1198938130797252609,3856,92,718,530,,"We will get the job done. 

https://t.co/DxR97HnU7n",2015-04-01T20:15:49.000Z,Prime Minister of the United Kingdom and @Conservatives leader. Member of Parliament for Uxbridge and South Ruislip.,3131144855,Boris Johnson,4481059,459,10421,5833,BorisJohnson,True
449,3131144855,author_id: 3131144855,conv_id: 1198921017994989568,1198921017994989568,2019-11-25T11:07:00.000Z,,1198921017994989568,id: 1198921017994989568,1383,42,365,296,,A majority Conservative government will cut taxes for you and your family. https://t.co/8DCFyo5ZpP,2015-04-01T20:15:49.000Z,Prime Minister of the United Kingdom and @Conservatives leader. Member of Parliament for Uxbridge and South Ruislip.,3131144855,Boris Johnson,4481059,459,10421,5833,BorisJohnson,True
450,3131144855,author_id: 3131144855,conv_id: 1198905666905100289,1198905666905100289,2019-11-25T10:06:00.000Z,,1198905666905100289,id: 1198905666905100289,3689,110,561,665,,We need a fair and controlled Australian style points-based immigration system. https://t.co/9KIQ3exRiy,2015-04-01T20:15:49.000Z,Prime Minister of the United Kingdom and @Conservatives leader. Member of Parliament for Uxbridge and South Ruislip.,3131144855,Boris Johnson,4481059,459,10421,5833,BorisJohnson,True
451,3131144855,author_id: 3131144855,conv_id: 1198890567310008326,1198890567310008326,2019-11-25T09:06:00.000Z,,1198890567310008326,id: 1198890567310008326,2814,134,854,589,,My pledge to you. https://t.co/x8jbLb3ymo,2015-04-01T20:15:49.000Z,Prime Minister of the United Kingdom and @Conservatives leader. Member of Parliament for Uxbridge and South Ruislip.,3131144855,Boris Johnson,4481059,459,10421,5833,BorisJohnson,True
452,3131144855,author_id: 3131144855,conv_id: 1198711491714834437,1198711491714834437,2019-11-24T21:14:25.000Z,"[{'start': 3, 'end': 17, 'username': 'Conservatives', 'id': '14281853'}]",1198711491714834437,id: 1198711491714834437,0,0,0,581,"[{'type': 'retweeted', 'id': '1198677048828579842'}]","RT @Conservatives: Delivering for our NHS:

✅ 50,000 more nurses

✅ 6,000 more GPs

✅ 6,000 more primary care professionals

✅ 50,000,000 m…",2015-04-01T20:15:49.000Z,Prime Minister of the United Kingdom and @Conservatives leader. Member of Parliament for Uxbridge and South Ruislip.,3131144855,Boris Johnson,4481059,459,10421,5833,BorisJohnson,True
