,author_id,author_id_new,conv_id_new,conversation_id,created_at,entities.mentions,id,id_new,public_metrics.like_count,public_metrics.quote_count,public_metrics.reply_count,public_metrics.retweet_count,referenced_tweets,text,users.created_at,users.description,users.id,users.name,users.public_metrics.followers_count,users.public_metrics.following_count,users.public_metrics.listed_count,users.public_metrics.tweet_count,users.username,users.verified
86,2797521996,author_id: 2797521996,conv_id: 735768135689601024,735768135689601024,2016-05-26T09:42:48.000Z,,735768135689601024,id: 735768135689601024,21,2,1,28,,The share of our exports going to the EU has dropped from over 60% to about 42%; this is set to fall further in the future,2014-09-08T09:11:39.000Z,Conservative Member of Parliament for Haltemprice and Howden.,2797521996,David Davis,188753,38,1375,1899,DavidDavisMP,True
87,2797521996,author_id: 2797521996,conv_id: 735767853379420160,735767853379420160,2016-05-26T09:41:40.000Z,,735767853379420160,id: 735767853379420160,109,1,18,148,,(3/3) But now after 40 years in Europe we are no better off than when we started https://t.co/EvQ0Jm5Esq,2014-09-08T09:11:39.000Z,Conservative Member of Parliament for Haltemprice and Howden.,2797521996,David Davis,188753,38,1375,1899,DavidDavisMP,True
88,2797521996,author_id: 2797521996,conv_id: 735767699440074752,735767699440074752,2016-05-26T09:41:04.000Z,,735767699440074752,id: 735767699440074752,30,1,1,49,,"(2/3) In 1973 we were a tottering industrial economy, and the EEC was a modern, go ahead, trade bloc",2014-09-08T09:11:39.000Z,Conservative Member of Parliament for Haltemprice and Howden.,2797521996,David Davis,188753,38,1375,1899,DavidDavisMP,True
89,2797521996,author_id: 2797521996,conv_id: 735767523719680000,735767523719680000,2016-05-26T09:40:22.000Z,,735767523719680000,id: 735767523719680000,20,1,1,19,,"The Treasury forecast is not an economic forecast. It is a political forecast, with a political purpose",2014-09-08T09:11:39.000Z,Conservative Member of Parliament for Haltemprice and Howden.,2797521996,David Davis,188753,38,1375,1899,DavidDavisMP,True
90,2797521996,author_id: 2797521996,conv_id: 735767052045029376,735767052045029376,2016-05-26T09:38:29.000Z,,735767052045029376,id: 735767052045029376,17,0,1,26,,(2/2) The Treasury cannot accurately forecast 6 months. Why should we believe they can forecast 15 years?,2014-09-08T09:11:39.000Z,Conservative Member of Parliament for Haltemprice and Howden.,2797521996,David Davis,188753,38,1375,1899,DavidDavisMP,True
91,2797521996,author_id: 2797521996,conv_id: 735766943941042176,735766943941042176,2016-05-26T09:38:03.000Z,,735766943941042176,id: 735766943941042176,14,1,1,25,,"(1/2) Last year the Treasury found £27bn down the back of the sofa, only to be strapped for cash by Spring",2014-09-08T09:11:39.000Z,Conservative Member of Parliament for Haltemprice and Howden.,2797521996,David Davis,188753,38,1375,1899,DavidDavisMP,True
92,2797521996,author_id: 2797521996,conv_id: 735766875901038592,735766875901038592,2016-05-26T09:37:47.000Z,,735766875901038592,id: 735766875901038592,74,4,14,89,,The Treasury and the IMF claim #Brexit will cost economic growth but neither have a good track record on forecasting,2014-09-08T09:11:39.000Z,Conservative Member of Parliament for Haltemprice and Howden.,2797521996,David Davis,188753,38,1375,1899,DavidDavisMP,True
93,2797521996,author_id: 2797521996,conv_id: 735766748473872388,735766748473872388,2016-05-26T09:37:17.000Z,,735766748473872388,id: 735766748473872388,78,14,26,88,,"(3/3) Time after time the elite have got it wrong, and the ordinary people, whose wisdom was derided, have paid the price",2014-09-08T09:11:39.000Z,Conservative Member of Parliament for Haltemprice and Howden.,2797521996,David Davis,188753,38,1375,1899,DavidDavisMP,True
94,2797521996,author_id: 2797521996,conv_id: 735766707399102465,735766707399102465,2016-05-26T09:37:07.000Z,,735766707399102465,id: 735766707399102465,10,1,0,22,,"(2/3)The Gold Standard. Appeasement. The ERM. On the continent, the Euro. Globally, the 2008 Crash. And we haven’t heard from Chilcot yet...",2014-09-08T09:11:39.000Z,Conservative Member of Parliament for Haltemprice and Howden.,2797521996,David Davis,188753,38,1375,1899,DavidDavisMP,True
95,2797521996,author_id: 2797521996,conv_id: 735766494227746819,735766494227746819,2016-05-26T09:36:16.000Z,,735766494227746819,id: 735766494227746819,36,1,0,51,,(1/3) The British and international establishment do not have a great track record when it comes to the great questions of their era,2014-09-08T09:11:39.000Z,Conservative Member of Parliament for Haltemprice and Howden.,2797521996,David Davis,188753,38,1375,1899,DavidDavisMP,True
96,2797521996,author_id: 2797521996,conv_id: 735766376388825088,735766376388825088,2016-05-26T09:35:48.000Z,,735766376388825088,id: 735766376388825088,31,2,9,34,,Today I want to unpick some of Remain’s arguments and expose them to factual analysis,2014-09-08T09:11:39.000Z,Conservative Member of Parliament for Haltemprice and Howden.,2797521996,David Davis,188753,38,1375,1899,DavidDavisMP,True
97,2797521996,author_id: 2797521996,conv_id: 735766146582876164,735766146582876164,2016-05-26T09:34:53.000Z,"[{'start': 48, 'end': 61, 'username': 'BorisJohnson', 'id': '3131144855'}]",735766146582876164,id: 735766146582876164,8,1,4,7,,"The entire Remain case has been, if I may mimic @BorisJohnson, one big ‘argumentum ad verecundiam’",2014-09-08T09:11:39.000Z,Conservative Member of Parliament for Haltemprice and Howden.,2797521996,David Davis,188753,38,1375,1899,DavidDavisMP,True
98,2797521996,author_id: 2797521996,conv_id: 735765795653832705,735765795653832705,2016-05-26T09:33:30.000Z,,735765795653832705,id: 735765795653832705,17,6,10,16,,"Remain have bombarded us with scare tactics, myths of the miracles the EU brings and the disasters that will allegedly rain down if we leave",2014-09-08T09:11:39.000Z,Conservative Member of Parliament for Haltemprice and Howden.,2797521996,David Davis,188753,38,1375,1899,DavidDavisMP,True
99,2797521996,author_id: 2797521996,conv_id: 735765720030552064,735765720030552064,2016-05-26T09:33:12.000Z,,735765720030552064,id: 735765720030552064,65,0,7,73,,"In 4 weeks the British people will make the most momentous decision of modern times, remain in an increasingly dysfunctional EU, or #Brexit",2014-09-08T09:11:39.000Z,Conservative Member of Parliament for Haltemprice and Howden.,2797521996,David Davis,188753,38,1375,1899,DavidDavisMP,True
100,2797521996,author_id: 2797521996,conv_id: 735750503309529089,735750503309529089,2016-05-26T08:32:44.000Z,,735750503309529089,id: 735750503309529089,21,0,4,18,,Later this morning I will give a speech on #Brexit setting out the economic arguments for leaving. My account will live tweet from 10:30am,2014-09-08T09:11:39.000Z,Conservative Member of Parliament for Haltemprice and Howden.,2797521996,David Davis,188753,38,1375,1899,DavidDavisMP,True
101,2797521996,author_id: 2797521996,conv_id: 725278477050470400,725278477050470400,2016-04-27T11:00:38.000Z,"[{'start': 100, 'end': 108, 'username': 'ConHome', 'id': '159992511'}]",725278477050470400,id: 725278477050470400,10,0,6,12,,"(5/5) You can read the full article, and my suggestions for how we deal with the Syrian conflict on @ConHome at: https://t.co/taTU2gpv4L",2014-09-08T09:11:39.000Z,Conservative Member of Parliament for Haltemprice and Howden.,2797521996,David Davis,188753,38,1375,1899,DavidDavisMP,True
102,2797521996,author_id: 2797521996,conv_id: 725278298159386624,725278298159386624,2016-04-27T10:59:55.000Z,,725278298159386624,id: 725278298159386624,15,1,3,8,,(4/5) The best way of stopping the influx of jihadists and refugees into Europe from Syria is by bringing the war to an end.,2014-09-08T09:11:39.000Z,Conservative Member of Parliament for Haltemprice and Howden.,2797521996,David Davis,188753,38,1375,1899,DavidDavisMP,True
103,2797521996,author_id: 2797521996,conv_id: 725278205091930112,725278205091930112,2016-04-27T10:59:33.000Z,,725278205091930112,id: 725278205091930112,6,0,0,5,,"(3/5) A consequence of this failure is 1,000 jihadists a year coming to Europe.",2014-09-08T09:11:39.000Z,Conservative Member of Parliament for Haltemprice and Howden.,2797521996,David Davis,188753,38,1375,1899,DavidDavisMP,True
104,2797521996,author_id: 2797521996,conv_id: 725278028809510912,725278028809510912,2016-04-27T10:58:51.000Z,,725278028809510912,id: 725278028809510912,6,0,0,4,,(2/5) I also travelled because of my increasing concern over the failure of Western foreign and security policy in the region.,2014-09-08T09:11:39.000Z,Conservative Member of Parliament for Haltemprice and Howden.,2797521996,David Davis,188753,38,1375,1899,DavidDavisMP,True
105,2797521996,author_id: 2797521996,conv_id: 725277956587794432,725277956587794432,2016-04-27T10:58:34.000Z,,725277956587794432,id: 725277956587794432,8,0,1,4,,"(1/5) Earlier this month I travelled to Syria, to witness first-hand the devastation caused by the civil war in the country.",2014-09-08T09:11:39.000Z,Conservative Member of Parliament for Haltemprice and Howden.,2797521996,David Davis,188753,38,1375,1899,DavidDavisMP,True
106,2797521996,author_id: 2797521996,conv_id: 722468753234112512,722468753234112512,2016-04-19T16:55:48.000Z,,722468753234112512,id: 722468753234112512,3,1,5,3,,(3/3) You can watch me discuss my recent trip to Syria at: https://t.co/qDxHuclkCA,2014-09-08T09:11:39.000Z,Conservative Member of Parliament for Haltemprice and Howden.,2797521996,David Davis,188753,38,1375,1899,DavidDavisMP,True
107,2797521996,author_id: 2797521996,conv_id: 722468547314728960,722468547314728960,2016-04-19T16:54:59.000Z,,722468547314728960,id: 722468547314728960,14,2,12,12,,"(2/3) Over 1,000 jihadists, plus many more refugees, come from Syria to Europe every year. We need to find a way of stopping this.",2014-09-08T09:11:39.000Z,Conservative Member of Parliament for Haltemprice and Howden.,2797521996,David Davis,188753,38,1375,1899,DavidDavisMP,True
108,2797521996,author_id: 2797521996,conv_id: 722468383988543488,722468383988543488,2016-04-19T16:54:20.000Z,"[{'start': 34, 'end': 43, 'username': 'MarrShow', 'id': '317173156'}]",722468383988543488,id: 722468383988543488,7,0,2,4,,(1/3) On Sunday I appeared on the @MarrShow to discuss my recent visit to Syria.,2014-09-08T09:11:39.000Z,Conservative Member of Parliament for Haltemprice and Howden.,2797521996,David Davis,188753,38,1375,1899,DavidDavisMP,True
109,2797521996,author_id: 2797521996,conv_id: 720611937508306944,720611937508306944,2016-04-14T13:57:28.000Z,,720611937508306944,id: 720611937508306944,12,0,11,14,,(2/2) The debate puts pressure on the Iraq Inquiry to publish the report as soon as possible. Watch my contribution: https://t.co/RVbKRLi4zN,2014-09-08T09:11:39.000Z,Conservative Member of Parliament for Haltemprice and Howden.,2797521996,David Davis,188753,38,1375,1899,DavidDavisMP,True
110,2797521996,author_id: 2797521996,conv_id: 720611700551114752,720611700551114752,2016-04-14T13:56:32.000Z,,720611700551114752,id: 720611700551114752,11,1,3,8,,"(1/2) Excellent debate on the Chilcot Report earlier today, strong contributions made by Members from across the House.",2014-09-08T09:11:39.000Z,Conservative Member of Parliament for Haltemprice and Howden.,2797521996,David Davis,188753,38,1375,1899,DavidDavisMP,True
111,2797521996,author_id: 2797521996,conv_id: 720552130428448769,720552130428448769,2016-04-14T09:59:49.000Z,,720552130428448769,id: 720552130428448769,43,0,13,29,,In 30 minutes I will lead a debate calling on Government to publish the Chilcot Report as soon as possible.Follow at https://t.co/7OvsKkeBzx,2014-09-08T09:11:39.000Z,Conservative Member of Parliament for Haltemprice and Howden.,2797521996,David Davis,188753,38,1375,1899,DavidDavisMP,True
112,2797521996,author_id: 2797521996,conv_id: 712616500373417985,712616500373417985,2016-03-23T12:26:28.000Z,"[{'start': 26, 'end': 42, 'username': 'taxinparliament', 'id': '4179433551'}]",712616500373417985,id: 712616500373417985,7,0,1,2,,"Following the evidence to @taxinparliament, seems there may be a possible answer on international taxation that the Government has not found",2014-09-08T09:11:39.000Z,Conservative Member of Parliament for Haltemprice and Howden.,2797521996,David Davis,188753,38,1375,1899,DavidDavisMP,True
113,2797521996,author_id: 2797521996,conv_id: 712616258005544961,712616258005544961,2016-03-23T12:25:30.000Z,"[{'start': 29, 'end': 43, 'username': 'TaxJusticeNet', 'id': '78990577'}, {'start': 48, 'end': 60, 'username': 'ActionAidUK', 'id': '14382779'}, {'start': 79, 'end': 95, 'username': 'taxinparliament', 'id': '4179433551'}]",712616258005544961,id: 712616258005544961,6,0,1,4,,Very good presentations from @TaxJusticeNet and @ActionAidUK at this morning’s @taxinparliament evidence session,2014-09-08T09:11:39.000Z,Conservative Member of Parliament for Haltemprice and Howden.,2797521996,David Davis,188753,38,1375,1899,DavidDavisMP,True
114,2797521996,author_id: 2797521996,conv_id: 712609223461453824,712609223461453824,2016-03-23T11:57:33.000Z,"[{'start': 15, 'end': 31, 'username': 'taxinparliament', 'id': '4179433551'}]",712609223461453824,id: 712609223461453824,5,0,3,4,,Currently with @taxinparliament taking evidence on how international tax should change to respond to global corporations and digital economy,2014-09-08T09:11:39.000Z,Conservative Member of Parliament for Haltemprice and Howden.,2797521996,David Davis,188753,38,1375,1899,DavidDavisMP,True
115,2797521996,author_id: 2797521996,conv_id: 712330564444020737,712330564444020737,2016-03-22T17:30:15.000Z,,712330564444020737,id: 712330564444020737,18,0,12,23,,650 million people still do not have clean water. Help raise awareness of #WorldWaterDay https://t.co/bGvZSqBRYQ,2014-09-08T09:11:39.000Z,Conservative Member of Parliament for Haltemprice and Howden.,2797521996,David Davis,188753,38,1375,1899,DavidDavisMP,True
116,2797521996,author_id: 2797521996,conv_id: 710094659306045440,710094659306045440,2016-03-16T16:35:59.000Z,"[{'start': 1, 'end': 15, 'username': 'patrickseurre', 'id': '214527020'}]",710142579061473282,id: 710142579061473282,27,0,7,14,"[{'type': 'replied_to', 'id': '710142478435876864'}]",".@patrickseurre If we do not get the major amendments the #IPBill requires, I will vote against it at third reading.",2014-09-08T09:11:39.000Z,Conservative Member of Parliament for Haltemprice and Howden.,2797521996,David Davis,188753,38,1375,1899,DavidDavisMP,True
117,2797521996,author_id: 2797521996,conv_id: 710094659306045440,710094659306045440,2016-03-16T16:35:35.000Z,"[{'start': 1, 'end': 15, 'username': 'patrickseurre', 'id': '214527020'}]",710142478435876864,id: 710142478435876864,7,0,4,5,"[{'type': 'replied_to', 'id': '710094659306045440'}]",".@patrickseurre no, an #IPBill is needed, hence my abstention. However, Bill as it stands is flawed, lacks safeguards and needs amendments",2014-09-08T09:11:39.000Z,Conservative Member of Parliament for Haltemprice and Howden.,2797521996,David Davis,188753,38,1375,1899,DavidDavisMP,True
118,2797521996,author_id: 2797521996,conv_id: 710087787312259072,710087787312259072,2016-03-16T16:34:45.000Z,"[{'start': 1, 'end': 17, 'username': 'davidallengreen', 'id': '33315010'}]",710142271396642816,id: 710142271396642816,2,0,5,7,"[{'type': 'replied_to', 'id': '710088315526094848'}]",".@DavidAllenGreen no doubt an #IPBill is needed. That is why I abstained yesterday. However, Bill as it stands has flaws and needs amending.",2014-09-08T09:11:39.000Z,Conservative Member of Parliament for Haltemprice and Howden.,2797521996,David Davis,188753,38,1375,1899,DavidDavisMP,True
119,2797521996,author_id: 2797521996,conv_id: 709796763067146240,709796763067146240,2016-03-15T17:41:50.000Z,,709796763067146240,id: 709796763067146240,11,0,5,12,,To watch my full contribution to today’s #IPBill debate please see: https://t.co/14rwQ4NJcu,2014-09-08T09:11:39.000Z,Conservative Member of Parliament for Haltemprice and Howden.,2797521996,David Davis,188753,38,1375,1899,DavidDavisMP,True
120,2797521996,author_id: 2797521996,conv_id: 709782824002396160,709782824002396160,2016-03-15T16:46:27.000Z,,709782824002396160,id: 709782824002396160,20,0,2,50,,"(2/2) Parliament must now make amendments that will put in place a law which is the safest, and highest quality framework in the world.",2014-09-08T09:11:39.000Z,Conservative Member of Parliament for Haltemprice and Howden.,2797521996,David Davis,188753,38,1375,1899,DavidDavisMP,True
121,2797521996,author_id: 2797521996,conv_id: 709782700375277568,709782700375277568,2016-03-15T16:45:57.000Z,,709782700375277568,id: 709782700375277568,45,0,9,125,,"(1/2) The #IPBill as it stands grants our intelligence agencies sweeping powers, with flawed safeguards and little consideration for privacy",2014-09-08T09:11:39.000Z,Conservative Member of Parliament for Haltemprice and Howden.,2797521996,David Davis,188753,38,1375,1899,DavidDavisMP,True
122,2797521996,author_id: 2797521996,conv_id: 709782597619023872,709782597619023872,2016-03-15T16:45:33.000Z,,709782597619023872,id: 709782597619023872,17,0,2,55,,"On bulk capabilities in the #IPBill, we should be under no misapprehension as to how broad, and how potent, these powers are.",2014-09-08T09:11:39.000Z,Conservative Member of Parliament for Haltemprice and Howden.,2797521996,David Davis,188753,38,1375,1899,DavidDavisMP,True
123,2797521996,author_id: 2797521996,conv_id: 709782451049070593,709782451049070593,2016-03-15T16:44:58.000Z,,709782451049070593,id: 709782451049070593,7,0,2,11,,(2/2) Inserting ‘privacy’ into a title is not a ‘strengthening’ of safeguards or a privacy ‘backbone’ as the ISC recommended.,2014-09-08T09:11:39.000Z,Conservative Member of Parliament for Haltemprice and Howden.,2797521996,David Davis,188753,38,1375,1899,DavidDavisMP,True
124,2797521996,author_id: 2797521996,conv_id: 709782258102702080,709782258102702080,2016-03-15T16:44:12.000Z,,709782258102702080,id: 709782258102702080,4,0,0,12,,"(1/2) For example, the ISC called for privacy protections. The Government response? ‘General Protections’ now ‘General Privacy Protections’",2014-09-08T09:11:39.000Z,Conservative Member of Parliament for Haltemprice and Howden.,2797521996,David Davis,188753,38,1375,1899,DavidDavisMP,True
125,2797521996,author_id: 2797521996,conv_id: 709782045703151616,709782045703151616,2016-03-15T16:43:21.000Z,,709782045703151616,id: 709782045703151616,6,0,2,13,,"However, there are significant flaws with the #IPBill as it stands.",2014-09-08T09:11:39.000Z,Conservative Member of Parliament for Haltemprice and Howden.,2797521996,David Davis,188753,38,1375,1899,DavidDavisMP,True
126,2797521996,author_id: 2797521996,conv_id: 709781938391937025,709781938391937025,2016-03-15T16:42:55.000Z,"[{'start': 46, 'end': 61, 'username': 'terrorwatchdog', 'id': '836830619405545472'}]",709781938391937025,id: 709781938391937025,0,0,1,8,,"There is no doubt an #IPBill is necessary; as @terrorwatchdog said current law is, “incomprehensible to all but a tiny band of initiates”.",2014-09-08T09:11:39.000Z,Conservative Member of Parliament for Haltemprice and Howden.,2797521996,David Davis,188753,38,1375,1899,DavidDavisMP,True
127,2797521996,author_id: 2797521996,conv_id: 709781674452783105,709781674452783105,2016-03-15T16:41:52.000Z,,709781674452783105,id: 709781674452783105,3,0,6,5,,With the #IPBill we all want to ensure that the intelligence agencies and our police forces have effective powers that will keep us safe.,2014-09-08T09:11:39.000Z,Conservative Member of Parliament for Haltemprice and Howden.,2797521996,David Davis,188753,38,1375,1899,DavidDavisMP,True
128,2797521996,author_id: 2797521996,conv_id: 709432824382750720,709432824382750720,2016-03-15T12:24:51.000Z,"[{'start': 18, 'end': 29, 'username': 'chhcalling', 'id': '80943076'}]",709716990592737280,id: 709716990592737280,4,0,2,6,"[{'type': 'replied_to', 'id': '709433322229907456'}]",".@SteephenHaarper @chhcalling I do, and will later today be raising my concerns on the #IPBill as it stands.",2014-09-08T09:11:39.000Z,Conservative Member of Parliament for Haltemprice and Howden.,2797521996,David Davis,188753,38,1375,1899,DavidDavisMP,True
129,2797521996,author_id: 2797521996,conv_id: 709714469564375040,709714469564375040,2016-03-15T12:14:50.000Z,,709714469564375040,id: 709714469564375040,22,0,4,24,,The #IPBill will have its second reading today. Parliament must use this debate to raise concerns on the Bill as it stands.,2014-09-08T09:11:39.000Z,Conservative Member of Parliament for Haltemprice and Howden.,2797521996,David Davis,188753,38,1375,1899,DavidDavisMP,True
130,2797521996,author_id: 2797521996,conv_id: 709432983388884992,709432983388884992,2016-03-14T17:36:18.000Z,,709432983388884992,id: 709432983388884992,3,0,0,0,,(2/2) The Minister has now confirmed that the Government are looking into the issues raised and will report back shortly.,2014-09-08T09:11:39.000Z,Conservative Member of Parliament for Haltemprice and Howden.,2797521996,David Davis,188753,38,1375,1899,DavidDavisMP,True
131,2797521996,author_id: 2797521996,conv_id: 709432824382750720,709432824382750720,2016-03-14T17:35:40.000Z,"[{'start': 6, 'end': 17, 'username': 'chhcalling', 'id': '80943076'}]",709432824382750720,id: 709432824382750720,9,0,6,8,,(1/2) @chhcalling and I made important amendments to today’s #EnergyBill regarding noise nuisance from wind turbines.,2014-09-08T09:11:39.000Z,Conservative Member of Parliament for Haltemprice and Howden.,2797521996,David Davis,188753,38,1375,1899,DavidDavisMP,True
132,2797521996,author_id: 2797521996,conv_id: 709328119493206016,709328119493206016,2016-03-14T10:39:37.000Z,,709328119493206016,id: 709328119493206016,4,0,0,2,,(3/3) Vote for Andrew Smith to win the Britain's Best Volunteer Award at: https://t.co/MiK8Pkan4O,2014-09-08T09:11:39.000Z,Conservative Member of Parliament for Haltemprice and Howden.,2797521996,David Davis,188753,38,1375,1899,DavidDavisMP,True
133,2797521996,author_id: 2797521996,conv_id: 709327955021979648,709327955021979648,2016-03-14T10:38:57.000Z,,709327955021979648,id: 709327955021979648,4,0,0,4,,(2/3) Andrew and the group have also invested in a pop-up kitchen in the city centre which provides hot food and drink to those in need,2014-09-08T09:11:39.000Z,Conservative Member of Parliament for Haltemprice and Howden.,2797521996,David Davis,188753,38,1375,1899,DavidDavisMP,True
134,2797521996,author_id: 2797521996,conv_id: 709327823803162624,709327823803162624,2016-03-14T10:38:26.000Z,"[{'start': 20, 'end': 34, 'username': 'hull_homeless', 'id': '4381112597'}]",709327823803162624,id: 709327823803162624,7,0,1,4,,"(1/3) Great work by @hull_homeless founder Andrew Smith, who spends weekends handing out hot drinks and warm clothes to the homeless in Hull",2014-09-08T09:11:39.000Z,Conservative Member of Parliament for Haltemprice and Howden.,2797521996,David Davis,188753,38,1375,1899,DavidDavisMP,True
135,2797521996,author_id: 2797521996,conv_id: 705013152921034753,705013152921034753,2016-03-02T14:19:19.000Z,"[{'start': 1, 'end': 13, 'username': 'JohnRentoul', 'id': '14085096'}, {'start': 32, 'end': 40, 'username': 'ConHome', 'id': '159992511'}]",705034755922894848,id: 705034755922894848,18,0,10,31,"[{'type': 'replied_to', 'id': '705013152921034753'}]",.@JohnRentoul see my article on @ConHome about the discrepancy between immigration and NI numbers: https://t.co/RgAmW5IISH,2014-09-08T09:11:39.000Z,Conservative Member of Parliament for Haltemprice and Howden.,2797521996,David Davis,188753,38,1375,1899,DavidDavisMP,True
136,2797521996,author_id: 2797521996,conv_id: 705005005275795456,705005005275795456,2016-03-02T14:18:25.000Z,"[{'start': 1, 'end': 11, 'username': 'JGForsyth', 'id': '498986721'}, {'start': 30, 'end': 38, 'username': 'ConHome', 'id': '159992511'}]",705034529812189184,id: 705034529812189184,11,0,1,20,"[{'type': 'replied_to', 'id': '705005005275795456'}]",.@JGForsyth see my article on @ConHome about the discrepancy between immigration and NI numbers: https://t.co/RgAmW5IISH,2014-09-08T09:11:39.000Z,Conservative Member of Parliament for Haltemprice and Howden.,2797521996,David Davis,188753,38,1375,1899,DavidDavisMP,True
137,2797521996,author_id: 2797521996,conv_id: 705021016389582848,705021016389582848,2016-03-02T13:24:43.000Z,"[{'start': 68, 'end': 76, 'username': 'ConHome', 'id': '159992511'}]",705021016389582848,id: 705021016389582848,23,0,4,32,,You can also read my further thoughts on the immigration figures on @ConHome at: https://t.co/RgAmW5IISH,2014-09-08T09:11:39.000Z,Conservative Member of Parliament for Haltemprice and Howden.,2797521996,David Davis,188753,38,1375,1899,DavidDavisMP,True
138,2797521996,author_id: 2797521996,conv_id: 705020685551333376,705020685551333376,2016-03-02T13:23:24.000Z,,705020685551333376,id: 705020685551333376,45,6,11,76,,"(2/2) If Gov fail to publish the data, people will draw the conclusion there is something to hide. The Gov should publish it immediately.",2014-09-08T09:11:39.000Z,Conservative Member of Parliament for Haltemprice and Howden.,2797521996,David Davis,188753,38,1375,1899,DavidDavisMP,True
139,2797521996,author_id: 2797521996,conv_id: 705020550163333120,705020550163333120,2016-03-02T13:22:52.000Z,,705020550163333120,id: 705020550163333120,31,0,7,58,,(1/2) I asked the Prime Minister about the discrepancy between immigration figures and National Insurance figures: https://t.co/oeZRvkkpri,2014-09-08T09:11:39.000Z,Conservative Member of Parliament for Haltemprice and Howden.,2797521996,David Davis,188753,38,1375,1899,DavidDavisMP,True
