,author_id,author_id_new,conv_id_new,conversation_id,created_at,entities.mentions,id,id_new,public_metrics.like_count,public_metrics.quote_count,public_metrics.reply_count,public_metrics.retweet_count,referenced_tweets,text,users.created_at,users.description,users.id,users.name,users.public_metrics.followers_count,users.public_metrics.following_count,users.public_metrics.listed_count,users.public_metrics.tweet_count,users.username,users.verified
181,2797521996,author_id: 2797521996,conv_id: 1169289274002485252,1169289274002485252,2019-09-04T16:41:01.000Z,,1169289274002485252,id: 1169289274002485252,416,29,76,234,"[{'type': 'quoted', 'id': '1169213782826070017'}]",Today I spoke at the Loan Charge demonstration outside of Parliament. It is time this unjust policy is cancelled. https://t.co/gM5XVLJIzI,2014-09-08T09:11:39.000Z,Conservative Member of Parliament for Haltemprice and Howden.,2797521996,David Davis,188753,38,1375,1899,DavidDavisMP,True
182,2797521996,author_id: 2797521996,conv_id: 1169283623134085120,1169283623134085120,2019-09-04T16:18:34.000Z,"[{'start': 205, 'end': 216, 'username': 'Humberbeat', 'id': '135502751'}]",1169283623134085120,id: 1169283623134085120,251,5,59,43,,The Chancellor has today confirmed an extra £750 million will be made available to recruit additional police officers across the UK. This means safer communities throughout Yorkshire and more officers for @Humberbeat,2014-09-08T09:11:39.000Z,Conservative Member of Parliament for Haltemprice and Howden.,2797521996,David Davis,188753,38,1375,1899,DavidDavisMP,True
183,2797521996,author_id: 2797521996,conv_id: 1169279604747636737,1169279604747636737,2019-09-04T16:02:36.000Z,,1169279604747636737,id: 1169279604747636737,81,3,14,16,"[{'type': 'quoted', 'id': '1169225441393160197'}]","Today's confirmation that primary schools will receive guaranteed funding of £3,750 per pupil in 2020-21 is an excellent first step. https://t.co/leb2Iiot15",2014-09-08T09:11:39.000Z,Conservative Member of Parliament for Haltemprice and Howden.,2797521996,David Davis,188753,38,1375,1899,DavidDavisMP,True
184,2797521996,author_id: 2797521996,conv_id: 1168826711443693568,1168826711443693568,2019-09-03T10:02:58.000Z,,1168826711443693568,id: 1168826711443693568,683,20,80,200,,I suspect this will not be the last time we see headlines about HS2 being further delayed and billions overbudget. The recently announced review into the project must scrap this white elephant. https://t.co/QuP62epPZB,2014-09-08T09:11:39.000Z,Conservative Member of Parliament for Haltemprice and Howden.,2797521996,David Davis,188753,38,1375,1899,DavidDavisMP,True
185,2797521996,author_id: 2797521996,conv_id: 1168595471801167873,1168595471801167873,2019-09-02T18:44:06.000Z,,1168595471801167873,id: 1168595471801167873,93,5,18,17,,"This is the right decision but it is only the start of a wider debate on the use of facial recognition technology and the implications for civil liberties.

https://t.co/CG8O85pvdp",2014-09-08T09:11:39.000Z,Conservative Member of Parliament for Haltemprice and Howden.,2797521996,David Davis,188753,38,1375,1899,DavidDavisMP,True
186,2797521996,author_id: 2797521996,conv_id: 1168479733174218753,1168479733174218753,2019-09-02T11:04:12.000Z,,1168479733174218753,id: 1168479733174218753,5070,280,1635,1116,,I have consistently argued that a Brexit deal will not be sealed until the final few weeks leading up to 31 October. Attempts to block no deal only serve to weaken the UK's negotiating hand at this critical time and reduce the likelihood of a deal. https://t.co/PP6inkOwrP,2014-09-08T09:11:39.000Z,Conservative Member of Parliament for Haltemprice and Howden.,2797521996,David Davis,188753,38,1375,1899,DavidDavisMP,True
187,2797521996,author_id: 2797521996,conv_id: 1167103190057308160,1167103190057308160,2019-08-29T15:54:19.000Z,,1167103191885828098,id: 1167103191885828098,174,107,402,45,"[{'type': 'replied_to', 'id': '1167103190057308160'}]","If we do not get a handle on antibiotic resistance, and if this gets out of control, even going to hospital could be potentially life-threatening. AMR has the potential to make the great flu epidemic look like a mere cold.",2014-09-08T09:11:39.000Z,Conservative Member of Parliament for Haltemprice and Howden.,2797521996,David Davis,188753,38,1375,1899,DavidDavisMP,True
188,2797521996,author_id: 2797521996,conv_id: 1167103190057308160,1167103190057308160,2019-08-29T15:54:18.000Z,,1167103190057308160,id: 1167103190057308160,246,65,160,85,"[{'type': 'quoted', 'id': '1167095546198274048'}]","Dame Sally Davies is absolutely right - AMR is the most immediate threat to humankind. We should not forget that this year is the 100th anniversary of the 1918 Influenza epidemic, which in one year killed at least three times as many people as WW1 did in total. https://t.co/JHoHiiUnZf",2014-09-08T09:11:39.000Z,Conservative Member of Parliament for Haltemprice and Howden.,2797521996,David Davis,188753,38,1375,1899,DavidDavisMP,True
189,2797521996,author_id: 2797521996,conv_id: 1164550659544367104,1164550659544367104,2019-08-22T14:51:28.000Z,"[{'start': 32, 'end': 43, 'username': 'BBCr4today', 'id': '8170292'}]",1164550662086111232,id: 1164550662086111232,50,2,26,9,"[{'type': 'replied_to', 'id': '1164550659544367104'}]",The rest of my interview on the @BBCR4Today programme can be heard here: https://t.co/iImAwuJGQn,2014-09-08T09:11:39.000Z,Conservative Member of Parliament for Haltemprice and Howden.,2797521996,David Davis,188753,38,1375,1899,DavidDavisMP,True
190,2797521996,author_id: 2797521996,conv_id: 1164550659544367104,1164550659544367104,2019-08-22T14:51:28.000Z,"[{'start': 14, 'end': 25, 'username': 'BBCr4today', 'id': '8170292'}]",1164550659544367104,id: 1164550659544367104,831,36,349,185,,Good to visit @BBCR4Today this morning to talk about no deal preparation. We must remember that Yellowhammer is a worst-case scenario drafted by those predisposed to pessimism. https://t.co/0fUxlMmIzG,2014-09-08T09:11:39.000Z,Conservative Member of Parliament for Haltemprice and Howden.,2797521996,David Davis,188753,38,1375,1899,DavidDavisMP,True
191,2797521996,author_id: 2797521996,conv_id: 1164473767021678592,1164473767021678592,2019-08-22T09:45:55.000Z,,1164473767021678592,id: 1164473767021678592,1489,40,212,410,,"My recommendation to the independent review of HS2 is to scrap this colossal waste of money. Here's why:

https://t.co/VAfBRm9WbA",2014-09-08T09:11:39.000Z,Conservative Member of Parliament for Haltemprice and Howden.,2797521996,David Davis,188753,38,1375,1899,DavidDavisMP,True
192,2797521996,author_id: 2797521996,conv_id: 1164116811849371650,1164116811849371650,2019-08-21T10:07:30.000Z,,1164116811849371650,id: 1164116811849371650,4938,258,1150,1032,,"Fantastic to hear that there will be an independent review into whether to proceed with HS2. It's time to cancel this white elephant and spend money where it will have the most impact across the country.
https://t.co/ZiXFG8rR1e",2014-09-08T09:11:39.000Z,Conservative Member of Parliament for Haltemprice and Howden.,2797521996,David Davis,188753,38,1375,1899,DavidDavisMP,True
193,2797521996,author_id: 2797521996,conv_id: 1161304103148036096,1161304103148036096,2019-08-13T15:50:49.000Z,"[{'start': 11, 'end': 24, 'username': 'ukhomeoffice', 'id': '138037459'}]",1161304104548876289,id: 1161304104548876289,112,0,17,32,"[{'type': 'replied_to', 'id': '1161304103148036096'}]","It is time @ukhomeoffice brought proposals to Parliament to regulate this technology and set proper standards of use, both for the private sector and police forces up and down the country.",2014-09-08T09:11:39.000Z,Conservative Member of Parliament for Haltemprice and Howden.,2797521996,David Davis,188753,38,1375,1899,DavidDavisMP,True
194,2797521996,author_id: 2797521996,conv_id: 1161304103148036096,1161304103148036096,2019-08-13T15:50:48.000Z,,1161304103148036096,id: 1161304103148036096,236,5,28,77,,"This is yet another demonstration of the pressing need to regulate facial recognition tech. The use of this by private companies, with no clear oversight or accountability, is a serious intrusion on the privacy of citizens going about their everyday lives. https://t.co/oL2LBac4Jd",2014-09-08T09:11:39.000Z,Conservative Member of Parliament for Haltemprice and Howden.,2797521996,David Davis,188753,38,1375,1899,DavidDavisMP,True
195,2797521996,author_id: 2797521996,conv_id: 1159167165825802240,1159167165825802240,2019-08-07T18:19:23.000Z,,1159167165825802240,id: 1159167165825802240,604,27,127,223,,The roll out of handheld facial recognition devices is completely unacceptable whilst the technology is subject to an ongoing legal challenge. It’s time for a moratorium on the use of such cameras so we can better understand the risks and limitations. https://t.co/dScUtdh9Vz,2014-09-08T09:11:39.000Z,Conservative Member of Parliament for Haltemprice and Howden.,2797521996,David Davis,188753,38,1375,1899,DavidDavisMP,True
196,2797521996,author_id: 2797521996,conv_id: 1159116467276779520,1159116467276779520,2019-08-07T14:57:55.000Z,"[{'start': 3, 'end': 13, 'username': 'libertyhq', 'id': '19397439'}]",1159116467276779520,id: 1159116467276779520,0,0,0,13,"[{'type': 'retweeted', 'id': '1159027499680108544'}]","RT @libertyhq: ""#FacialRecognition is very different to CCTV because it takes your biometric data and makes a map of your face that can be…",2014-09-08T09:11:39.000Z,Conservative Member of Parliament for Haltemprice and Howden.,2797521996,David Davis,188753,38,1375,1899,DavidDavisMP,True
197,2797521996,author_id: 2797521996,conv_id: 1159115565354684419,1159115565354684419,2019-08-07T14:54:20.000Z,"[{'start': 66, 'end': 80, 'username': 'FieldsInTrust', 'id': '98654017'}]",1159115565354684419,id: 1159115565354684419,14,0,8,0,,The Ashes Trust Playing Field in Howden is in the running for the @FieldsinTrust Best Park 2019 award. Cast your vote here to nominate this fantastic green space at the heart of the local community https://t.co/5g3apu3rtr. #LoveYourLocalPark,2014-09-08T09:11:39.000Z,Conservative Member of Parliament for Haltemprice and Howden.,2797521996,David Davis,188753,38,1375,1899,DavidDavisMP,True
198,2797521996,author_id: 2797521996,conv_id: 1156939074785222656,1156939074785222656,2019-08-01T14:45:44.000Z,"[{'start': 25, 'end': 38, 'username': 'BorisJohnson', 'id': '3131144855'}, {'start': 51, 'end': 62, 'username': 'sajidjavid', 'id': '20052899'}]",1156939074785222656,id: 1156939074785222656,1182,103,188,541,"[{'type': 'quoted', 'id': '1154744157665189890'}]",It's time for the new PM @BorisJohnson to instruct @sajidjavid to scrap the unfair Loan Charge - a retrospective tax which is thought to have led to suicides. https://t.co/M6kNOSoYWb,2014-09-08T09:11:39.000Z,Conservative Member of Parliament for Haltemprice and Howden.,2797521996,David Davis,188753,38,1375,1899,DavidDavisMP,True
199,2797521996,author_id: 2797521996,conv_id: 1155435695642750977,1155435695642750977,2019-07-28T11:11:51.000Z,,1155435695642750977,id: 1155435695642750977,1755,98,697,561,,"422,000 European jobs are at risk from a ""no deal"" scenario. It's still likely that the Commission will return to the negotiating table - though this may happen shortly after Brexit, as they still hope Parliament will stop ""no deal."" https://t.co/l8VK7OLWzJ",2014-09-08T09:11:39.000Z,Conservative Member of Parliament for Haltemprice and Howden.,2797521996,David Davis,188753,38,1375,1899,DavidDavisMP,True
200,2797521996,author_id: 2797521996,conv_id: 1154055974468182016,1154055974468182016,2019-07-24T15:49:20.000Z,"[{'start': 23, 'end': 37, 'username': 'PennyMordaunt', 'id': '462856853'}]",1154055974468182016,id: 1154055974468182016,291,13,62,40,,What a pity to hear of @PennyMordaunt's resignation. She would've been a fantastic Secretary of State.,2014-09-08T09:11:39.000Z,Conservative Member of Parliament for Haltemprice and Howden.,2797521996,David Davis,188753,38,1375,1899,DavidDavisMP,True
201,2797521996,author_id: 2797521996,conv_id: 1152887318375743488,1152887318375743488,2019-07-21T10:25:30.000Z,,1152887318375743488,id: 1152887318375743488,978,33,189,332,,"The allegation that the police have used intrusive surveillance techniques on journalists is worrying. We urgently need a new Official Secrets Act, and we need an explicit statutory protection for journalists acting in the public interest.
https://t.co/joNzAaZjna",2014-09-08T09:11:39.000Z,Conservative Member of Parliament for Haltemprice and Howden.,2797521996,David Davis,188753,38,1375,1899,DavidDavisMP,True
202,2797521996,author_id: 2797521996,conv_id: 1151878058992963584,1151878058992963584,2019-07-18T15:35:04.000Z,,1151878058992963584,id: 1151878058992963584,204,11,37,85,,"Today, the Government announced it will not establish an independent judge-led inquiry into the UK's complicity in torture overseas. The Government is asking us to allow it to mark its own homework. This is not good enough and it will be challenged in the courts. https://t.co/3pc8MBowFv",2014-09-08T09:11:39.000Z,Conservative Member of Parliament for Haltemprice and Howden.,2797521996,David Davis,188753,38,1375,1899,DavidDavisMP,True
203,2797521996,author_id: 2797521996,conv_id: 1151860390306992129,1151860390306992129,2019-07-18T14:24:52.000Z,"[{'start': 10, 'end': 21, 'username': 'CommonsSTC', 'id': '988974846'}]",1151860390306992129,id: 1151860390306992129,23,0,5,13,"[{'type': 'quoted', 'id': '1151766130006081537'}]",Today the @CommonsSTC launched their report on the forensic &amp; biometric strategy. This is a good report and I wholeheartedly agree with their call for a moratorium on the use of live facial recognition technology until a proper regulatory framework is established. https://t.co/buwVIhglFZ,2014-09-08T09:11:39.000Z,Conservative Member of Parliament for Haltemprice and Howden.,2797521996,David Davis,188753,38,1375,1899,DavidDavisMP,True
204,2797521996,author_id: 2797521996,conv_id: 1151513035669942272,1151513035669942272,2019-07-17T15:24:36.000Z,"[{'start': 31, 'end': 43, 'username': 'metpoliceuk', 'id': '66967746'}, {'start': 159, 'end': 170, 'username': 'NickHurdUK', 'id': '144929619'}]",1151513035669942272,id: 1151513035669942272,229,9,62,88,,There have been reports of the @metpoliceuk using intrusive surveillance techniques on journalists to track down the source of diplomatic leaks. Today I asked @NickHurdUK to reassure the House this is not the case. The Government must do all it can to protect press freedom. https://t.co/h0jOthImur,2014-09-08T09:11:39.000Z,Conservative Member of Parliament for Haltemprice and Howden.,2797521996,David Davis,188753,38,1375,1899,DavidDavisMP,True
205,2797521996,author_id: 2797521996,conv_id: 1151089848704479232,1151089848704479232,2019-07-16T11:23:00.000Z,"[{'start': 29, 'end': 39, 'username': 'BBCRadio2', 'id': '798277'}]",1151089848704479232,id: 1151089848704479232,45,4,15,6,,"I'll shortly be appearing on @BBCRadio2 discussing my granddaughter, and our family's fight with the rare genetic condition, Syngap1. https://t.co/3YcVI4r8JD",2014-09-08T09:11:39.000Z,Conservative Member of Parliament for Haltemprice and Howden.,2797521996,David Davis,188753,38,1375,1899,DavidDavisMP,True
206,2797521996,author_id: 2797521996,conv_id: 1150810690879393792,1150810690879393792,2019-07-15T16:53:44.000Z,"[{'start': 13, 'end': 24, 'username': 'DLidington', 'id': '496278040'}]",1150810690879393792,id: 1150810690879393792,177,5,37,81,,"Today I gave @DLidington notice that if the Government does not establish an independent judge-led inquiry into the UK's complicity in rendition and torture, I will seek legal advice on whether it is in breach of human rights law. https://t.co/MnQVBJJn8q",2014-09-08T09:11:39.000Z,Conservative Member of Parliament for Haltemprice and Howden.,2797521996,David Davis,188753,38,1375,1899,DavidDavisMP,True
207,2797521996,author_id: 2797521996,conv_id: 1150798202154749952,1150798202154749952,2019-07-15T16:04:07.000Z,,1150798203182301190,id: 1150798203182301190,77,0,10,15,"[{'type': 'replied_to', 'id': '1150798202154749952'}]","Additional work is secured for the site, so there will be no compulsory redundancies in 2019. BAE are also retraining employees for design &amp; engineering roles created at the site. The Government and BAE must continue doing all they can to secure the long-term future of BAE Brough",2014-09-08T09:11:39.000Z,Conservative Member of Parliament for Haltemprice and Howden.,2797521996,David Davis,188753,38,1375,1899,DavidDavisMP,True
208,2797521996,author_id: 2797521996,conv_id: 1150798202154749952,1150798202154749952,2019-07-15T16:04:06.000Z,"[{'start': 40, 'end': 53, 'username': 'StuartAndrew', 'id': '20424362'}, {'start': 158, 'end': 172, 'username': 'BAESystemsplc', 'id': '153386946'}]",1150798202154749952,id: 1150798202154749952,50,2,14,12,,Today I had a constructive meeting with @StuartAndrew to discuss the Kuwaiti Government's disappointing decision to end interest in buying Hawk aircraft from @BAESystemsplc in Brough. The Minister has committed to doing everything possible to help BAE.,2014-09-08T09:11:39.000Z,Conservative Member of Parliament for Haltemprice and Howden.,2797521996,David Davis,188753,38,1375,1899,DavidDavisMP,True
209,2797521996,author_id: 2797521996,conv_id: 1150709050935578624,1150709050935578624,2019-07-15T10:09:51.000Z,,1150709052218970112,id: 1150709052218970112,61,1,4,31,"[{'type': 'replied_to', 'id': '1150709050935578624'}]","If you would like to support the Patrick Wild Centre's research into SYNGAP1, like that which afflicts my granddaughter, please click below.

https://t.co/gnQ9fATcdt",2014-09-08T09:11:39.000Z,Conservative Member of Parliament for Haltemprice and Howden.,2797521996,David Davis,188753,38,1375,1899,DavidDavisMP,True
210,2797521996,author_id: 2797521996,conv_id: 1150709050935578624,1150709050935578624,2019-07-15T10:09:51.000Z,"[{'start': 20, 'end': 32, 'username': 'DailyMailUK', 'id': '111556423'}]",1150709050935578624,id: 1150709050935578624,284,8,23,66,,"I sat down with The @DailyMailUK last week to talk about my granddaughter, and our family's fight with a rare genetic condition.

https://t.co/njUijBrrnr",2014-09-08T09:11:39.000Z,Conservative Member of Parliament for Haltemprice and Howden.,2797521996,David Davis,188753,38,1375,1899,DavidDavisMP,True
211,2797521996,author_id: 2797521996,conv_id: 1147224746364481536,1147224746364481536,2019-07-05T19:24:28.000Z,"[{'start': 3, 'end': 18, 'username': 'rowlsmanthorpe', 'id': '14881700'}, {'start': 52, 'end': 65, 'username': 'DavidDavisMP', 'id': '2797521996'}]",1147224746364481536,id: 1147224746364481536,0,0,0,17,"[{'type': 'retweeted', 'id': '1147211320376385536'}]","RT @rowlsmanthorpe: The MP who's leading on this is @DavidDavisMP. This was what he said in response to those comments

You shouldn't belie…",2014-09-08T09:11:39.000Z,Conservative Member of Parliament for Haltemprice and Howden.,2797521996,David Davis,188753,38,1375,1899,DavidDavisMP,True
212,2797521996,author_id: 2797521996,conv_id: 1147224705574813696,1147224705574813696,2019-07-05T19:24:18.000Z,"[{'start': 3, 'end': 18, 'username': 'rowlsmanthorpe', 'id': '14881700'}]",1147224705574813696,id: 1147224705574813696,0,0,0,99,"[{'type': 'retweeted', 'id': '1147206003743584256'}]","RT @rowlsmanthorpe: NEW (and I promise this really happened)

The head of the Metropolitan Police Federation said China’s facial recognitio…",2014-09-08T09:11:39.000Z,Conservative Member of Parliament for Haltemprice and Howden.,2797521996,David Davis,188753,38,1375,1899,DavidDavisMP,True
213,2797521996,author_id: 2797521996,conv_id: 1146511218817077248,1146511218817077248,2019-07-03T20:09:10.000Z,,1146511218817077248,id: 1146511218817077248,123,7,39,49,,"This is a damning evaluation of live facial recognition cameras. These trials must be suspended until parliament has had the chance to properly debate the issues and establish a clear regulatory framework.
https://t.co/IIPQW5JvwI",2014-09-08T09:11:39.000Z,Conservative Member of Parliament for Haltemprice and Howden.,2797521996,David Davis,188753,38,1375,1899,DavidDavisMP,True
214,2797521996,author_id: 2797521996,conv_id: 1146511028932501509,1146511028932501509,2019-07-03T20:08:25.000Z,"[{'start': 3, 'end': 15, 'username': 'SkyNewsTech', 'id': '1124816718'}]",1146511028932501509,id: 1146511028932501509,0,0,0,30,"[{'type': 'retweeted', 'id': '1146500882432974848'}]","RT @SkyNewsTech: Conservative MP David Davis says the decision to use facial recognition should not be down to the police.

A study by the…",2014-09-08T09:11:39.000Z,Conservative Member of Parliament for Haltemprice and Howden.,2797521996,David Davis,188753,38,1375,1899,DavidDavisMP,True
215,2797521996,author_id: 2797521996,conv_id: 1146510957444763653,1146510957444763653,2019-07-03T20:08:08.000Z,"[{'start': 3, 'end': 15, 'username': 'SkyNewsTech', 'id': '1124816718'}]",1146510957444763653,id: 1146510957444763653,0,0,0,25,"[{'type': 'retweeted', 'id': '1146501970997448704'}]","RT @SkyNewsTech: David Davis MP says that he believes that Boris Johnson would ""understand the risk"" of police facial recognition technolog…",2014-09-08T09:11:39.000Z,Conservative Member of Parliament for Haltemprice and Howden.,2797521996,David Davis,188753,38,1375,1899,DavidDavisMP,True
216,2797521996,author_id: 2797521996,conv_id: 1146069242984443904,1146069242984443904,2019-07-02T14:52:55.000Z,"[{'start': 14, 'end': 27, 'username': 'Jesse_Norman', 'id': '78702900'}, {'start': 40, 'end': 51, 'username': 'hmtreasury', 'id': '18904582'}]",1146069242984443904,id: 1146069242984443904,472,46,116,274,,Today I asked @Jesse_Norman what impact @hmtreasury believes the Loan Charge is having on people's mental health. It's time the Treasury takes seriously the impact this policy is having on those ordinary citizens affected and scrap the retrospective Loan Charge altogether. https://t.co/m6pTHUJWOH,2014-09-08T09:11:39.000Z,Conservative Member of Parliament for Haltemprice and Howden.,2797521996,David Davis,188753,38,1375,1899,DavidDavisMP,True
217,2797521996,author_id: 2797521996,conv_id: 1145653710363738112,1145653710363738112,2019-07-01T11:21:44.000Z,"[{'start': 13, 'end': 26, 'username': 'BorisJohnson', 'id': '3131144855'}]",1145653710363738112,id: 1145653710363738112,3426,142,942,808,,"I am backing @BorisJohnson because he will deliver Brexit, unite our Party and then defeat Jeremy Corbyn. It’s as straightforward as that.

https://t.co/txd6vxCze0",2014-09-08T09:11:39.000Z,Conservative Member of Parliament for Haltemprice and Howden.,2797521996,David Davis,188753,38,1375,1899,DavidDavisMP,True
218,2797521996,author_id: 2797521996,conv_id: 1144624545850109954,1144624545850109954,2019-06-28T15:12:12.000Z,"[{'start': 39, 'end': 52, 'username': 'CambridgeHOK', 'id': '372475970'}, {'start': 89, 'end': 97, 'username': 'LSEGplc', 'id': '214455056'}]",1144624545850109954,id: 1144624545850109954,15,1,6,5,,"Delighted to congratulate J Rotherham, @cambridgehok and Yorkare Homes on making it into @LSEGplc ‘1000 companies to inspire Britain’. Together, they have created almost 250 new jobs in Haltemprice and Howden. The economy is thriving in Yorkshire and the Humber. https://t.co/0eR7qEf41M",2014-09-08T09:11:39.000Z,Conservative Member of Parliament for Haltemprice and Howden.,2797521996,David Davis,188753,38,1375,1899,DavidDavisMP,True
219,2797521996,author_id: 2797521996,conv_id: 1144577759781576704,1144577759781576704,2019-06-28T12:06:17.000Z,"[{'start': 17, 'end': 32, 'username': 'ChtyCommission', 'id': '82370383'}, {'start': 80, 'end': 90, 'username': 'iealondon', 'id': '57602189'}]",1144577759781576704,id: 1144577759781576704,206,11,78,67,,"Glad to hear the @ChtyCommission has withdrawn the official warning against the @iealondon. It was a wholly inappropriate case against them and would have resulted in a chilling effect on the entire thinktank sector, hindering bold thinking and the creation of new ideas.",2014-09-08T09:11:39.000Z,Conservative Member of Parliament for Haltemprice and Howden.,2797521996,David Davis,188753,38,1375,1899,DavidDavisMP,True
220,2797521996,author_id: 2797521996,conv_id: 1144572652566319105,1144572652566319105,2019-06-28T11:46:00.000Z,"[{'start': 27, 'end': 42, 'username': 'loanchargeAPPG', 'id': '1088148455606890496'}, {'start': 52, 'end': 65, 'username': 'BorisJohnson', 'id': '3131144855'}, {'start': 70, 'end': 82, 'username': 'Jeremy_Hunt', 'id': '112398730'}]",1144572652566319105,id: 1144572652566319105,477,57,91,243,,"I, and colleagues from the @loanchargeAPPG, call on @BorisJohnson and @Jeremy_Hunt to sign the pledge to suspend the Loan Charge and order a proper review. https://t.co/Xvb3h1t3mu",2014-09-08T09:11:39.000Z,Conservative Member of Parliament for Haltemprice and Howden.,2797521996,David Davis,188753,38,1375,1899,DavidDavisMP,True
221,2797521996,author_id: 2797521996,conv_id: 1144340839956647938,1144340839956647938,2019-06-27T20:24:52.000Z,,1144340843349905409,id: 1144340843349905409,55,1,13,17,"[{'type': 'replied_to', 'id': '1144340841646972928'}]",Last week I wrote for The Telegraph on the risk live facial recognition technology poses to civil liberties in the UK. https://t.co/pt2c1CEGZM,2014-09-08T09:11:39.000Z,Conservative Member of Parliament for Haltemprice and Howden.,2797521996,David Davis,188753,38,1375,1899,DavidDavisMP,True
222,2797521996,author_id: 2797521996,conv_id: 1144340839956647938,1144340839956647938,2019-06-27T20:24:52.000Z,,1144340841646972928,id: 1144340841646972928,40,0,4,4,"[{'type': 'replied_to', 'id': '1144340839956647938'}]",I agree with him that a clear and specific legal framework must be put in place to govern the use of such technology. https://t.co/BZkhshRq2b,2014-09-08T09:11:39.000Z,Conservative Member of Parliament for Haltemprice and Howden.,2797521996,David Davis,188753,38,1375,1899,DavidDavisMP,True
