,author_id,author_id_new,conv_id_new,conversation_id,created_at,entities.mentions,id,id_new,public_metrics.like_count,public_metrics.quote_count,public_metrics.reply_count,public_metrics.retweet_count,referenced_tweets,text,users.created_at,users.description,users.id,users.name,users.public_metrics.followers_count,users.public_metrics.following_count,users.public_metrics.listed_count,users.public_metrics.tweet_count,users.username,users.verified
223,2797521996,author_id: 2797521996,conv_id: 1144340839956647938,1144340839956647938,2019-06-27T20:24:51.000Z,,1144340839956647938,id: 1144340839956647938,46,2,8,9,,Important report today from the Biometrics Commissioner. He is right to highlight the risks to privacy that live facial recognition technology poses.,2014-09-08T09:11:39.000Z,Conservative Member of Parliament for Haltemprice and Howden.,2797521996,David Davis,188742,38,1374,1898,DavidDavisMP,True
224,2797521996,author_id: 2797521996,conv_id: 1144204971933650944,1144204971933650944,2019-06-27T11:24:58.000Z,"[{'start': 37, 'end': 48, 'username': 'NickHurdUK', 'id': '144929619'}]",1144204971933650944,id: 1144204971933650944,115,7,42,23,,"Yesterday I had a great meeting with @NickHurdUK on the use of live facial recognition technology. The Minister is seized of the need to get this right by properly protecting us from criminals and terrorists, whilst also ensuring the privacy of ordinary citizens is safeguarded.",2014-09-08T09:11:39.000Z,Conservative Member of Parliament for Haltemprice and Howden.,2797521996,David Davis,188742,38,1374,1898,DavidDavisMP,True
225,2797521996,author_id: 2797521996,conv_id: 1143550520134684674,1143550520134684674,2019-06-25T16:04:24.000Z,"[{'start': 139, 'end': 155, 'username': 'YouthSportTrust', 'id': '53894955'}]",1143550520134684674,id: 1143550520134684674,13,0,2,3,,"This week is National School Sport Week, which is focusing on five ways to wellbeing. To read more see here: https://t.co/GD2l6So7iD #NSSW @YouthSportTrust https://t.co/FsUwRyhKLA",2014-09-08T09:11:39.000Z,Conservative Member of Parliament for Haltemprice and Howden.,2797521996,David Davis,188742,38,1374,1898,DavidDavisMP,True
226,2797521996,author_id: 2797521996,conv_id: 1143114375118630912,1143114375118630912,2019-06-24T11:11:19.000Z,"[{'start': 7, 'end': 20, 'username': 'johnprescott', 'id': '19335378'}]",1143114375118630912,id: 1143114375118630912,410,6,12,30,,I hope @johnprescott recovers completely from this stroke. My thoughts are with him and his family.,2014-09-08T09:11:39.000Z,Conservative Member of Parliament for Haltemprice and Howden.,2797521996,David Davis,188742,38,1374,1898,DavidDavisMP,True
227,2797521996,author_id: 2797521996,conv_id: 1142065979196882944,1142065979196882944,2019-06-21T13:45:22.000Z,"[{'start': 3, 'end': 19, 'username': 'DetentionAction', 'id': '188723073'}, {'start': 54, 'end': 67, 'username': 'DavidDavisMP', 'id': '2797521996'}]",1142065979196882944,id: 1142065979196882944,0,0,0,26,"[{'type': 'retweeted', 'id': '1142062241199611906'}]","RT @DetentionAction: In a busy week full of politics, @DavidDavisMP talked to us about why he thinks indefinite immigration detention is a…",2014-09-08T09:11:39.000Z,Conservative Member of Parliament for Haltemprice and Howden.,2797521996,David Davis,188742,38,1374,1898,DavidDavisMP,True
228,2797521996,author_id: 2797521996,conv_id: 1141647394528006144,1141647394528006144,2019-06-20T10:02:04.000Z,,1141647394528006144,id: 1141647394528006144,746,45,162,290,,"Live facial recognition cameras have the potential to erode civil liberties in the UK for little gain and some risk. It is time for a moratorium on the use of the cameras so that we can better understand the risks and limitations of such technology. 
https://t.co/pt2c1CEGZM",2014-09-08T09:11:39.000Z,Conservative Member of Parliament for Haltemprice and Howden.,2797521996,David Davis,188742,38,1374,1898,DavidDavisMP,True
229,2797521996,author_id: 2797521996,conv_id: 1141352920564346880,1141352920564346880,2019-06-19T14:31:56.000Z,,1141352920564346880,id: 1141352920564346880,60,1,16,16,,"Good to see Guernsey, Jersey and Isle of Man acknowledge the need for public registers of beneficial ownership. This means greater transparency &amp; less tax evasion. However, concerns remain - particularly on timing. These must be addressed before we can endorse their proposals.",2014-09-08T09:11:39.000Z,Conservative Member of Parliament for Haltemprice and Howden.,2797521996,David Davis,188742,38,1374,1898,DavidDavisMP,True
230,2797521996,author_id: 2797521996,conv_id: 1140335132857044994,1140335132857044994,2019-06-16T19:07:37.000Z,"[{'start': 128, 'end': 140, 'username': 'DominicRaab', 'id': '4764882552'}]",1140335135109406720,id: 1140335135109406720,797,100,497,158,"[{'type': 'replied_to', 'id': '1140335132857044994'}]",He is the clear winner of this debate. He has set out an impressive and optimistic vision for both Brexit and Britain’s future. @DominicRaab is the man to deliver it. #C4Debate,2014-09-08T09:11:39.000Z,Conservative Member of Parliament for Haltemprice and Howden.,2797521996,David Davis,188742,38,1374,1898,DavidDavisMP,True
231,2797521996,author_id: 2797521996,conv_id: 1140335132857044994,1140335132857044994,2019-06-16T19:07:36.000Z,"[{'start': 1, 'end': 13, 'username': 'DominicRaab', 'id': '4764882552'}]",1140335132857044994,id: 1140335132857044994,1895,117,555,399,,".@DominicRaab is the only candidate who has committed to leaving in October, no matter what. He is the only one with first-hand experience of negotiating with the European Union. #C4Debate",2014-09-08T09:11:39.000Z,Conservative Member of Parliament for Haltemprice and Howden.,2797521996,David Davis,188742,38,1374,1898,DavidDavisMP,True
232,2797521996,author_id: 2797521996,conv_id: 1140323855183032320,1140323855183032320,2019-06-16T18:22:47.000Z,"[{'start': 181, 'end': 193, 'username': 'DominicRaab', 'id': '4764882552'}]",1140323855183032320,id: 1140323855183032320,754,17,86,175,,Cutting taxes for the lowest income amongst us; boosting apprenticeships; building homes and ensuring people have a stake in our society. This is a great vision for our future from @DominicRaab.,2014-09-08T09:11:39.000Z,Conservative Member of Parliament for Haltemprice and Howden.,2797521996,David Davis,188742,38,1374,1898,DavidDavisMP,True
233,2797521996,author_id: 2797521996,conv_id: 1140320163847389184,1140320163847389184,2019-06-16T18:08:07.000Z,"[{'start': 16, 'end': 28, 'username': 'DominicRaab', 'id': '4764882552'}]",1140320163847389184,id: 1140320163847389184,3127,153,1100,659,,"It’s clear that @DominicRaab is the only one who is determined to do what is necessary to leave in October, as the majority of the people want. #C4Debate",2014-09-08T09:11:39.000Z,Conservative Member of Parliament for Haltemprice and Howden.,2797521996,David Davis,188742,38,1374,1898,DavidDavisMP,True
234,2797521996,author_id: 2797521996,conv_id: 1140316818768302080,1140316818768302080,2019-06-16T17:54:50.000Z,"[{'start': 1, 'end': 13, 'username': 'DominicRaab', 'id': '4764882552'}]",1140316818768302080,id: 1140316818768302080,1917,26,206,367,,.@DominicRaab is entirely right; all options must be kept on the table to secure the best possible deal come October. #C4Debate,2014-09-08T09:11:39.000Z,Conservative Member of Parliament for Haltemprice and Howden.,2797521996,David Davis,188742,38,1374,1898,DavidDavisMP,True
235,2797521996,author_id: 2797521996,conv_id: 1139209988189118464,1139209988189118464,2019-06-13T16:36:41.000Z,"[{'start': 1, 'end': 13, 'username': 'DominicRaab', 'id': '4764882552'}]",1139209988189118464,id: 1139209988189118464,501,69,319,155,"[{'type': 'quoted', 'id': '1139103539970678784'}]",.@DominicRaab is absolutely the right man to make a success of Brexit - that is why I am supporting him for leader of the Conservative Party. https://t.co/FYeNaIMLhS,2014-09-08T09:11:39.000Z,Conservative Member of Parliament for Haltemprice and Howden.,2797521996,David Davis,188742,38,1374,1898,DavidDavisMP,True
236,2797521996,author_id: 2797521996,conv_id: 1139155457476583424,1139155457476583424,2019-06-13T13:00:00.000Z,"[{'start': 161, 'end': 174, 'username': 'Channel4News', 'id': '14569869'}, {'start': 217, 'end': 225, 'username': 'BBCNews', 'id': '612473'}]",1139155457476583424,id: 1139155457476583424,43,3,33,8,,"The new leader's mandate will only be as strong as the clarity of his message and so it is very important that everyone takes part in the debates, starting with @Channel4News this Sunday before the next vote and then @BBCNews next Tuesday.",2014-09-08T09:11:39.000Z,Conservative Member of Parliament for Haltemprice and Howden.,2797521996,David Davis,188742,38,1374,1898,DavidDavisMP,True
237,2797521996,author_id: 2797521996,conv_id: 1139154613070942208,1139154613070942208,2019-06-13T12:56:38.000Z,"[{'start': 12, 'end': 24, 'username': 'DominicRaab', 'id': '4764882552'}]",1139154613070942208,id: 1139154613070942208,582,38,209,160,,I'm backing @DominicRaab for leader of the Conservative Party and our Prime Minister. He is the man to deliver on the opportunities Brexit presents and lead the party to electoral success. https://t.co/g7kIAlBGUZ,2014-09-08T09:11:39.000Z,Conservative Member of Parliament for Haltemprice and Howden.,2797521996,David Davis,188742,38,1374,1898,DavidDavisMP,True
238,2797521996,author_id: 2797521996,conv_id: 1138833391992877057,1138833391992877057,2019-06-12T15:40:13.000Z,"[{'start': 17, 'end': 30, 'username': 'StuartAndrew', 'id': '20424362'}]",1138833391992877057,id: 1138833391992877057,42,2,8,7,,Today I met with @StuartAndrew to ensure the need to secure future orders for the BAE Hawk aircraft remains at the top of the Government's agenda. He assured me every effort is being made to create new orders as soon as possible. https://t.co/ZTs41pmUSf,2014-09-08T09:11:39.000Z,Conservative Member of Parliament for Haltemprice and Howden.,2797521996,David Davis,188742,38,1374,1898,DavidDavisMP,True
239,2797521996,author_id: 2797521996,conv_id: 1138494514081992704,1138494514081992704,2019-06-11T17:13:39.000Z,"[{'start': 58, 'end': 72, 'username': 'britishmuseum', 'id': '19066345'}]",1138494514081992704,id: 1138494514081992704,20,0,10,5,"[{'type': 'quoted', 'id': '1131487671413596162'}]",Last week I went to the fantastic #MangaExhibition at the @britishmuseum. It is incredibly interesting and everyone should go. https://t.co/pT7ViBOBuC,2014-09-08T09:11:39.000Z,Conservative Member of Parliament for Haltemprice and Howden.,2797521996,David Davis,188742,38,1374,1898,DavidDavisMP,True
240,2797521996,author_id: 2797521996,conv_id: 1138476263830675456,1138476263830675456,2019-06-11T16:01:08.000Z,"[{'start': 14, 'end': 18, 'username': 'BBC', 'id': '19701628'}]",1138476265122533376,id: 1138476265122533376,483,12,46,103,"[{'type': 'replied_to', 'id': '1138476263830675456'}]","I suspect the @BBC's decision will face a legal challenge in due course. They will likely lose this, thereby wasting more taxpayers' money.",2014-09-08T09:11:39.000Z,Conservative Member of Parliament for Haltemprice and Howden.,2797521996,David Davis,188742,38,1374,1898,DavidDavisMP,True
241,2797521996,author_id: 2797521996,conv_id: 1138476263830675456,1138476263830675456,2019-06-11T16:01:07.000Z,"[{'start': 26, 'end': 30, 'username': 'BBC', 'id': '19701628'}]",1138476263830675456,id: 1138476263830675456,2192,39,235,445,,Very poor practice by the @BBC to withdraw free TV licences for over-75s. In 2015 they agreed to take responsibility for this from 2020. They should now honour that commitment.,2014-09-08T09:11:39.000Z,Conservative Member of Parliament for Haltemprice and Howden.,2797521996,David Davis,188742,38,1374,1898,DavidDavisMP,True
242,2797521996,author_id: 2797521996,conv_id: 1138125257225768961,1138125257225768961,2019-06-10T16:46:21.000Z,"[{'start': 138, 'end': 149, 'username': 'NickHurdUK', 'id': '144929619'}]",1138125257225768961,id: 1138125257225768961,200,10,30,58,,The Met's deployment of facial recognition technology resulted in a misidentification rate of over 90%.  I am glad that Policing Minister @NickHurdUK has committed to carrying out urgent work to review how this technology is used. https://t.co/u4vDJeEUWK,2014-09-08T09:11:39.000Z,Conservative Member of Parliament for Haltemprice and Howden.,2797521996,David Davis,188742,38,1374,1898,DavidDavisMP,True
243,2797521996,author_id: 2797521996,conv_id: 1136224403061125120,1136224403061125120,2019-06-05T10:53:02.000Z,"[{'start': 64, 'end': 77, 'username': 'trevorbirney', 'id': '29420649'}]",1136224403061125120,id: 1136224403061125120,25,1,17,7,,The decision to drop the case against Loughinisland journalists @trevorbirney and Barry McCaffrey was a momentous day for press freedom. The PSNI must now deliver justice for the Loughinisland victims and their families. https://t.co/nv0NJ1637A,2014-09-08T09:11:39.000Z,Conservative Member of Parliament for Haltemprice and Howden.,2797521996,David Davis,188742,38,1374,1898,DavidDavisMP,True
244,2797521996,author_id: 2797521996,conv_id: 1136214078999945217,1136214078999945217,2019-06-05T10:12:00.000Z,"[{'start': 21, 'end': 31, 'username': 'Telegraph', 'id': '16343974'}]",1136214078999945217,id: 1136214078999945217,150,4,12,28,,"In March I wrote for @Telegraph on how S.60 stop and search powers are precisely the targeted powers necessary to cope with an epidemic of knife violence. https://t.co/nenOQYlyES 

Pleased to see the increase used of these powers is now having an effect.
https://t.co/pBn1XXs89o",2014-09-08T09:11:39.000Z,Conservative Member of Parliament for Haltemprice and Howden.,2797521996,David Davis,188742,38,1374,1898,DavidDavisMP,True
245,2797521996,author_id: 2797521996,conv_id: 1135669309471150080,1135669309471150080,2019-06-03T22:07:17.000Z,"[{'start': 39, 'end': 52, 'username': 'trevorbirney', 'id': '29420649'}]",1135669309471150080,id: 1135669309471150080,354,14,26,91,,PSNI have now dropped the case against @trevorbirney and Barry McCaffrey. An outstanding victory for Press Freedom. My congratulations to two brave journalists and their fantastic team. Now for justice for Loughinisland.,2014-09-08T09:11:39.000Z,Conservative Member of Parliament for Haltemprice and Howden.,2797521996,David Davis,188742,38,1374,1898,DavidDavisMP,True
246,2797521996,author_id: 2797521996,conv_id: 1135179588244561922,1135179588244561922,2019-06-02T13:41:19.000Z,,1135179588244561922,id: 1135179588244561922,286,3,30,67,,"Everyone should condemn in the strongest terms the cowardly &amp; irresponsible attack on the PSNI officer. The people of Northern Ireland want no return to the cruelty and violence of the past, and simply want to live their lives in peace. https://t.co/zlR0lhDL74",2014-09-08T09:11:39.000Z,Conservative Member of Parliament for Haltemprice and Howden.,2797521996,David Davis,188742,38,1374,1898,DavidDavisMP,True
247,2797521996,author_id: 2797521996,conv_id: 1134455157662633984,1134455157662633984,2019-05-31T13:42:41.000Z,"[{'start': 89, 'end': 102, 'username': 'trevorbirney', 'id': '29420649'}]",1134455157662633984,id: 1134455157662633984,81,4,23,25,,"For the second time this week I'm in Belfast, supporting journalists Barry McCaffrey and @trevorbirney in their fight against attempts to undermine the freedom of the press. https://t.co/tgk3TW4fee",2014-09-08T09:11:39.000Z,Conservative Member of Parliament for Haltemprice and Howden.,2797521996,David Davis,188742,38,1374,1898,DavidDavisMP,True
248,2797521996,author_id: 2797521996,conv_id: 1134394632517881858,1134394632517881858,2019-05-31T09:42:11.000Z,,1134394632517881858,id: 1134394632517881858,39,2,34,7,,"Philip Augar's review on student fees is a good start, but it needs to be the beginning of a radical overhaul of the Higher Education system. 

https://t.co/zUCjWEULyU",2014-09-08T09:11:39.000Z,Conservative Member of Parliament for Haltemprice and Howden.,2797521996,David Davis,188742,38,1374,1898,DavidDavisMP,True
249,2797521996,author_id: 2797521996,conv_id: 1130517694619496450,1130517694619496450,2019-05-20T16:56:38.000Z,,1130517702248939524,id: 1130517702248939524,81,3,37,19,"[{'type': 'replied_to', 'id': '1130517694619496450'}]","I also wrote about the use of torture in today's Times. Torture is wrong both in principle and in law, it endangers serving soldiers, and it simply does not work. https://t.co/mNKhTxGvr0",2014-09-08T09:11:39.000Z,Conservative Member of Parliament for Haltemprice and Howden.,2797521996,David Davis,188742,38,1374,1898,DavidDavisMP,True
250,2797521996,author_id: 2797521996,conv_id: 1130517694619496450,1130517694619496450,2019-05-20T16:56:37.000Z,"[{'start': 182, 'end': 196, 'username': 'PennyMordaunt', 'id': '462856853'}]",1130517694619496450,id: 1130517694619496450,89,5,21,20,,"Following troubling news today that Government policy could allow cooperation with torture if ""the potential benefits justify accepting the risk and the legal consequences"", I asked @PennyMordaunt to make a statement. https://t.co/SY8Crhl9vD",2014-09-08T09:11:39.000Z,Conservative Member of Parliament for Haltemprice and Howden.,2797521996,David Davis,188742,38,1374,1898,DavidDavisMP,True
251,2797521996,author_id: 2797521996,conv_id: 1128967560689520640,1128967560689520640,2019-05-16T10:16:56.000Z,,1128967561842966528,id: 1128967561842966528,422,17,58,88,"[{'type': 'replied_to', 'id': '1128967560689520640'}]","If the Government wants to help the North, it has to build railways in the North.",2014-09-08T09:11:39.000Z,Conservative Member of Parliament for Haltemprice and Howden.,2797521996,David Davis,188742,38,1374,1898,DavidDavisMP,True
252,2797521996,author_id: 2797521996,conv_id: 1128967560689520640,1128967560689520640,2019-05-16T10:16:56.000Z,,1128967560689520640,id: 1128967560689520640,491,15,70,159,,"Good report on HS2 by the House of Lords Economic Affairs Committee. As they say, too much emphasis has been put on cutting journey times and not enough on the economic benefits for the regions. https://t.co/OyRacRKSJk",2014-09-08T09:11:39.000Z,Conservative Member of Parliament for Haltemprice and Howden.,2797521996,David Davis,188742,38,1374,1898,DavidDavisMP,True
253,2797521996,author_id: 2797521996,conv_id: 1128634113706070016,1128634113706070016,2019-05-15T12:11:56.000Z,,1128634113706070016,id: 1128634113706070016,520,78,151,296,,"Very important the Government listens to personal stories like this. The retrospective Loan Charge is causing a huge amount of stress to tens of thousands of people. It needs to be scrapped now. 
https://t.co/ASt8pswAZE",2014-09-08T09:11:39.000Z,Conservative Member of Parliament for Haltemprice and Howden.,2797521996,David Davis,188742,38,1374,1898,DavidDavisMP,True
254,2797521996,author_id: 2797521996,conv_id: 1128616282444705793,1128616282444705793,2019-05-15T11:01:05.000Z,,1128616282444705793,id: 1128616282444705793,1420,41,139,422,,HS2 will not deliver on its stated aims. Now is the time to scrap this vanity project and focus on infrastructure that will benefit all areas of the UK. https://t.co/amJ7rO1OkC,2014-09-08T09:11:39.000Z,Conservative Member of Parliament for Haltemprice and Howden.,2797521996,David Davis,188742,38,1374,1898,DavidDavisMP,True
255,2797521996,author_id: 2797521996,conv_id: 1128369593351909377,1128369593351909377,2019-05-14T18:40:49.000Z,"[{'start': 3, 'end': 13, 'username': 'GregHands', 'id': '125270251'}]",1128369593351909377,id: 1128369593351909377,0,0,0,531,"[{'type': 'retweeted', 'id': '1128169418817789952'}]",RT @GregHands: 13 ex-Cabinet &amp; Sir Graham Brady letter to the PM: “A Customs Union Brexit deal with Labour is both bad policy and bad polit…,2014-09-08T09:11:39.000Z,Conservative Member of Parliament for Haltemprice and Howden.,2797521996,David Davis,188742,38,1374,1898,DavidDavisMP,True
256,2797521996,author_id: 2797521996,conv_id: 1128314139951104000,1128314139951104000,2019-05-14T15:00:28.000Z,"[{'start': 48, 'end': 56, 'username': 'the_tpa', 'id': '107029948'}]",1128314139951104000,id: 1128314139951104000,820,35,108,310,,It was a pleasure to launch a report today from @the_tpa proposing 28 great alternatives to HS2. It's time the Government scrapped HS2 and focused on investments that will genuinely boost regional growth and improve connectivity. https://t.co/uAh8cGoPvL,2014-09-08T09:11:39.000Z,Conservative Member of Parliament for Haltemprice and Howden.,2797521996,David Davis,188742,38,1374,1898,DavidDavisMP,True
257,2797521996,author_id: 2797521996,conv_id: 1127965892279619585,1127965892279619585,2019-05-13T15:56:39.000Z,,1127965892279619585,id: 1127965892279619585,136,8,29,48,,"The Disability Living Allowance appeal process is broken. It is causing deprivation and distress to young lives, including that of my eight-year-old constituent Jessica. I asked the Secretary of State for Work &amp; Pensions to address this as quickly as possible. https://t.co/ZjkXZEqSnP",2014-09-08T09:11:39.000Z,Conservative Member of Parliament for Haltemprice and Howden.,2797521996,David Davis,188742,38,1374,1898,DavidDavisMP,True
258,2797521996,author_id: 2797521996,conv_id: 1127510380740214784,1127510380740214784,2019-05-12T09:46:37.000Z,,1127510380740214784,id: 1127510380740214784,1881,66,204,572,,"The next PM must recognise HS2 for the wasteful vanity project it really is. The money could be better spent on regional infrastructure, fibre-optic broadband, fixing the housing crisis, or funding any number of more worthwhile infrastructure projects. 

https://t.co/wk0Y667UYO",2014-09-08T09:11:39.000Z,Conservative Member of Parliament for Haltemprice and Howden.,2797521996,David Davis,188742,38,1374,1898,DavidDavisMP,True
259,2797521996,author_id: 2797521996,conv_id: 1126404376120242176,1126404376120242176,2019-05-09T08:31:45.000Z,"[{'start': 89, 'end': 100, 'username': 'DavidGauke', 'id': '2230539338'}, {'start': 237, 'end': 246, 'username': 'ukonward', 'id': '913018418839900160'}]",1126404376120242176,id: 1126404376120242176,158,4,66,35,,"Insightful speech this morning on the rise of populism by my erstwhile Cabinet colleague @DavidGauke. However, we must face up to the fact that we - in the establishment - got it wrong in 2008... and now we are reaping the consequences. @ukonward #GaukePopulism",2014-09-08T09:11:39.000Z,Conservative Member of Parliament for Haltemprice and Howden.,2797521996,David Davis,188742,38,1374,1898,DavidDavisMP,True
260,2797521996,author_id: 2797521996,conv_id: 1126094862967873537,1126094862967873537,2019-05-08T12:01:51.000Z,,1126094862967873537,id: 1126094862967873537,141,17,88,49,,"Indefinite detention of migrants is an important issue from a civil liberties standpoint. But this report shows it also costs as much as £35m a year. This Government must change course on this when the Immigration Bill comes back to Parliament. 
https://t.co/8kQprDhWus",2014-09-08T09:11:39.000Z,Conservative Member of Parliament for Haltemprice and Howden.,2797521996,David Davis,188742,38,1374,1898,DavidDavisMP,True
261,2797521996,author_id: 2797521996,conv_id: 1125786234436161536,1125786234436161536,2019-05-07T15:35:29.000Z,,1125786234436161536,id: 1125786234436161536,180,0,24,49,,Delays to the granting of probate are absolutely unacceptable. The government is causing undue stress to grieving families. This needs to be sorted quickly. https://t.co/rt4TXOSkWU,2014-09-08T09:11:39.000Z,Conservative Member of Parliament for Haltemprice and Howden.,2797521996,David Davis,188742,38,1374,1898,DavidDavisMP,True
262,2797521996,author_id: 2797521996,conv_id: 1125057203214389250,1125057203214389250,2019-05-05T15:18:34.000Z,,1125057203214389250,id: 1125057203214389250,4913,687,3512,1483,,"The local election results show the public are fed up with politicians failing to deliver Brexit. The way forward is to go back to the EU and give it one last chance - renegotiate an acceptable deal, or leave calmly and speedily without a deal. https://t.co/aM0tMKJuUB",2014-09-08T09:11:39.000Z,Conservative Member of Parliament for Haltemprice and Howden.,2797521996,David Davis,188742,38,1374,1898,DavidDavisMP,True
263,2797521996,author_id: 2797521996,conv_id: 1124639240934043650,1124639240934043650,2019-05-04T11:37:44.000Z,"[{'start': 18, 'end': 30, 'username': 'DominicRaab', 'id': '4764882552'}]",1124639240934043650,id: 1124639240934043650,3458,919,3414,881,,"I will be backing @DominicRaab in the forthcoming Conservative leadership contest. His unique combination of intellect, determination, decisiveness and courage means he is the best placed candidate to deliver on the opportunities Brexit presents. 

https://t.co/sliPObxqfK",2014-09-08T09:11:39.000Z,Conservative Member of Parliament for Haltemprice and Howden.,2797521996,David Davis,188742,38,1374,1898,DavidDavisMP,True
264,2797521996,author_id: 2797521996,conv_id: 1123529695184740360,1123529695184740360,2019-05-01T10:08:48.000Z,,1123529696296284163,id: 1123529696296284163,49,2,16,7,"[{'type': 'replied_to', 'id': '1123529695184740360'}]","A few months ago I wrote about this, and related issues, in The Times.
https://t.co/AkIrRnqoft",2014-09-08T09:11:39.000Z,Conservative Member of Parliament for Haltemprice and Howden.,2797521996,David Davis,188742,38,1374,1898,DavidDavisMP,True
265,2797521996,author_id: 2797521996,conv_id: 1123529695184740360,1123529695184740360,2019-05-01T10:08:48.000Z,,1123529695184740360,id: 1123529695184740360,51,2,21,12,"[{'type': 'quoted', 'id': '1123497678132973569'}]","This is a move in the right direction on what must be done to protect consumers buying smart home technology. However, it is only the first step, much will need to be done on this issue. https://t.co/738MR8mIqe",2014-09-08T09:11:39.000Z,Conservative Member of Parliament for Haltemprice and Howden.,2797521996,David Davis,188742,38,1374,1898,DavidDavisMP,True
