,author_id,author_id_new,conv_id_new,conversation_id,created_at,entities.mentions,id,id_new,public_metrics.like_count,public_metrics.quote_count,public_metrics.reply_count,public_metrics.retweet_count,referenced_tweets,text,users.created_at,users.description,users.id,users.name,users.public_metrics.followers_count,users.public_metrics.following_count,users.public_metrics.listed_count,users.public_metrics.tweet_count,users.username,users.verified
354,2797521996,author_id: 2797521996,conv_id: 1073281723641810945,1073281723641810945,2018-12-13T18:21:18.000Z,"[{'start': 84, 'end': 95, 'username': 'Humberbeat', 'id': '135502751'}]",1073281723641810945,id: 1073281723641810945,194,19,79,30,,Next year's Police Funding Settlement will see an additional £1.9m provided to help @Humberbeat with the cost of increased pension contributions. An extra £2.4m will also be available to spend on local policing priorities. An excellent outcome for residents across Humberside.,2014-09-08T09:11:39.000Z,Conservative Member of Parliament for Haltemprice and Howden.,2797521996,David Davis,188753,38,1375,1899,DavidDavisMP,True
355,2797521996,author_id: 2797521996,conv_id: 1073261779831152641,1073261779831152641,2018-12-13T17:02:03.000Z,"[{'start': 3, 'end': 19, 'username': 'bbcquestiontime', 'id': '20699709'}, {'start': 37, 'end': 50, 'username': 'DavidDavisMP', 'id': '2797521996'}]",1073261779831152641,id: 1073261779831152641,0,0,0,39,"[{'type': 'retweeted', 'id': '1073164162065412096'}]",RT @bbcquestiontime: Conservative MP @DavidDavisMP is on the #bbcqt panel https://t.co/WuMc9eyAlY,2014-09-08T09:11:39.000Z,Conservative Member of Parliament for Haltemprice and Howden.,2797521996,David Davis,188753,38,1375,1899,DavidDavisMP,True
356,2797521996,author_id: 2797521996,conv_id: 1072900071962890246,1072900071962890246,2018-12-12T17:04:45.000Z,,1072900071962890246,id: 1072900071962890246,3445,259,1137,1069,,Now is the moment to seize control and deliver our own destiny. Continually kicking the can down the road is not a valid strategy. We must not shirk from the tough decisions. https://t.co/02zA7zC8YD,2014-09-08T09:11:39.000Z,Conservative Member of Parliament for Haltemprice and Howden.,2797521996,David Davis,188753,38,1375,1899,DavidDavisMP,True
357,2797521996,author_id: 2797521996,conv_id: 1072885343853129728,1072885343853129728,2018-12-12T16:06:13.000Z,"[{'start': 45, 'end': 55, 'username': 'DUPleader', 'id': '1397977138280681472'}]",1072885343853129728,id: 1072885343853129728,2316,104,405,695,,"It was an absolute pleasure to catch up with @DUPleader, Arlene Foster, this morning. We shared a platform for the release of ""A Better Deal"" - a plan for an improved Withdrawal Agreement. It's vital that we push for a real alternative to the Government's proposal.",2014-09-08T09:11:39.000Z,Conservative Member of Parliament for Haltemprice and Howden.,2797521996,David Davis,188753,38,1375,1899,DavidDavisMP,True
358,2797521996,author_id: 2797521996,conv_id: 1072244721836322818,1072244721836322818,2018-12-10T21:40:38.000Z,,1072244723350495233,id: 1072244723350495233,218,12,64,67,"[{'type': 'replied_to', 'id': '1072244721836322818'}]",You can read a full copy of my speech here: https://t.co/yeiQJtII7N,2014-09-08T09:11:39.000Z,Conservative Member of Parliament for Haltemprice and Howden.,2797521996,David Davis,188753,38,1375,1899,DavidDavisMP,True
359,2797521996,author_id: 2797521996,conv_id: 1072244721836322818,1072244721836322818,2018-12-10T21:40:37.000Z,"[{'start': 209, 'end': 223, 'username': 'Conservatives', 'id': '14281853'}]",1072244721836322818,id: 1072244721836322818,1277,57,231,361,,"Tonight I gave the 5th Margaret Thatcher Lecture. I spoke of the lessons we can learn from her today. How would she tackle the issues of the day - social mobility, policing, housing, tuition fees and welfare? @Conservatives must rediscover our ambition for meritocracy.",2014-09-08T09:11:39.000Z,Conservative Member of Parliament for Haltemprice and Howden.,2797521996,David Davis,188753,38,1375,1899,DavidDavisMP,True
360,2797521996,author_id: 2797521996,conv_id: 1072198399406063617,1072198399406063617,2018-12-10T18:36:33.000Z,,1072198399406063617,id: 1072198399406063617,1617,104,560,489,,"I have urged the Prime Minister to go to Brussels and push for a time-limited Northern Ireland backstop. As it stands, the Withdrawal Agreement hands all the negotiating power to the EU. It fails to take back control of our laws, our borders or our money.https://t.co/25ALfGYL4E",2014-09-08T09:11:39.000Z,Conservative Member of Parliament for Haltemprice and Howden.,2797521996,David Davis,188753,38,1375,1899,DavidDavisMP,True
361,2797521996,author_id: 2797521996,conv_id: 1071790839653912578,1071790839653912578,2018-12-09T15:37:03.000Z,,1071790839653912578,id: 1071790839653912578,2918,92,414,1094,,"We need a new strategy of hope, vision and imagination. Next Tuesday is make or break; it’s time to defeat this wretched deal and get on with the future. https://t.co/IvCLNhBlmn",2014-09-08T09:11:39.000Z,Conservative Member of Parliament for Haltemprice and Howden.,2797521996,David Davis,188753,38,1375,1899,DavidDavisMP,True
362,2797521996,author_id: 2797521996,conv_id: 1071441931480244224,1071441931480244224,2018-12-08T16:30:38.000Z,,1071441934449819649,id: 1071441934449819649,915,26,148,254,"[{'type': 'replied_to', 'id': '1071441933493506050'}]",The Conservative Party has a key role in this. That role is not to attempt to bully MPs into support for a failed strategy. Our role is to come together to find a joint approach that supports the decision of the referendum and promotes the national interest.,2014-09-08T09:11:39.000Z,Conservative Member of Parliament for Haltemprice and Howden.,2797521996,David Davis,188753,38,1375,1899,DavidDavisMP,True
363,2797521996,author_id: 2797521996,conv_id: 1071441931480244224,1071441931480244224,2018-12-08T16:30:38.000Z,,1071441933493506050,id: 1071441933493506050,894,10,38,245,"[{'type': 'replied_to', 'id': '1071441932478570496'}]","To do this, we need to preserve our freedom of action on trade, on regulations, on migration, on fishing. We must not subordinate ourselves to partisan foreign institutions. Democracy demands no less.",2014-09-08T09:11:39.000Z,Conservative Member of Parliament for Haltemprice and Howden.,2797521996,David Davis,188753,38,1375,1899,DavidDavisMP,True
364,2797521996,author_id: 2797521996,conv_id: 1071441931480244224,1071441931480244224,2018-12-08T16:30:37.000Z,,1071441932478570496,id: 1071441932478570496,1046,31,71,395,"[{'type': 'replied_to', 'id': '1071441931480244224'}]","We will be judged in the future as to whether we flinched in the face of unfounded threats and panic, or stood up for our national interest and took our proper place in the world.",2014-09-08T09:11:39.000Z,Conservative Member of Parliament for Haltemprice and Howden.,2797521996,David Davis,188753,38,1375,1899,DavidDavisMP,True
365,2797521996,author_id: 2797521996,conv_id: 1071441931480244224,1071441931480244224,2018-12-08T16:30:37.000Z,,1071441931480244224,id: 1071441931480244224,1981,64,251,656,,"It is a common cliché of political speeches that we stand at a turning point in history. For once, however, it is true. The decisions taken in the next few months will dictate our nation's future for a generation.",2014-09-08T09:11:39.000Z,Conservative Member of Parliament for Haltemprice and Howden.,2797521996,David Davis,188753,38,1375,1899,DavidDavisMP,True
366,2797521996,author_id: 2797521996,conv_id: 1070735848176521216,1070735848176521216,2018-12-06T17:44:54.000Z,,1070735848176521216,id: 1070735848176521216,3488,165,664,1280,,"The Government's deal is not Brexit. Whilst no-deal should not be feared, we have within our grasp a Canada-style deal which delivers a true Brexit. This is what 17.4 million people voted for in June 2016. https://t.co/MMFYfsBD7o",2014-09-08T09:11:39.000Z,Conservative Member of Parliament for Haltemprice and Howden.,2797521996,David Davis,188753,38,1375,1899,DavidDavisMP,True
367,2797521996,author_id: 2797521996,conv_id: 1069548434066219008,1069548434066219008,2018-12-03T11:06:32.000Z,"[{'start': 3, 'end': 13, 'username': 'libertyhq', 'id': '19397439'}, {'start': 22, 'end': 34, 'username': 'TulipSiddiq', 'id': '113491007'}, {'start': 36, 'end': 49, 'username': 'DavidDavisMP', 'id': '2797521996'}]",1069548434066219008,id: 1069548434066219008,0,0,0,38,"[{'type': 'retweeted', 'id': '1068516238211436545'}]","RT @libertyhq: Thanks @TulipSiddiq, @DavidDavisMP, @spelmanc, Dominic Grieve and Andrew Mitchell for raising and supporting this important…",2014-09-08T09:11:39.000Z,Conservative Member of Parliament for Haltemprice and Howden.,2797521996,David Davis,188753,38,1375,1899,DavidDavisMP,True
368,2797521996,author_id: 2797521996,conv_id: 1069156000027066368,1069156000027066368,2018-12-02T09:07:09.000Z,,1069156000027066368,id: 1069156000027066368,3523,367,1426,1368,,"We need to put an end to dodgy dossiers and scare stories. As I say in today's Sunday Times, it's time to seize this opportunity and grasp the fabulous future that the United Kingdom is offered. https://t.co/kxI1M1NYKf",2014-09-08T09:11:39.000Z,Conservative Member of Parliament for Haltemprice and Howden.,2797521996,David Davis,188753,38,1375,1899,DavidDavisMP,True
369,2797521996,author_id: 2797521996,conv_id: 1067794520455155712,1067794520455155712,2018-11-28T14:57:08.000Z,,1067794528306909184,id: 1067794528306909184,904,22,126,396,"[{'type': 'replied_to', 'id': '1067794527220629506'}]",This proposal will keep Britain in orbit around the EU. We will be nothing more than a satellite state ruled from afar. It is our duty to reject that prospectus and genuinely take back control. https://t.co/d6aGDw7I78,2014-09-08T09:11:39.000Z,Conservative Member of Parliament for Haltemprice and Howden.,2797521996,David Davis,188753,38,1375,1899,DavidDavisMP,True
370,2797521996,author_id: 2797521996,conv_id: 1067794520455155712,1067794520455155712,2018-11-28T14:57:08.000Z,,1067794527220629506,id: 1067794527220629506,703,10,42,266,"[{'type': 'replied_to', 'id': '1067794526062952454'}]",Downing Street and the Treasury will argue they are delivering a clean Brexit. But the facts point in the opposite direction. The Withdrawal Agreement and the Political Declaration are a bogus prospectus.,2014-09-08T09:11:39.000Z,Conservative Member of Parliament for Haltemprice and Howden.,2797521996,David Davis,188753,38,1375,1899,DavidDavisMP,True
371,2797521996,author_id: 2797521996,conv_id: 1067794520455155712,1067794520455155712,2018-11-28T14:57:08.000Z,,1067794526062952454,id: 1067794526062952454,582,14,61,247,"[{'type': 'replied_to', 'id': '1067794524985012228'}]","The task facing the Conservative Party, the governing party, is to deliver the will of the people as set out in June 2016. That means Brexit – and it means a clean Brexit that ensures a decisive break from the influence of a foreign power.",2014-09-08T09:11:39.000Z,Conservative Member of Parliament for Haltemprice and Howden.,2797521996,David Davis,188753,38,1375,1899,DavidDavisMP,True
372,2797521996,author_id: 2797521996,conv_id: 1067794520455155712,1067794520455155712,2018-11-28T14:57:08.000Z,,1067794524985012228,id: 1067794524985012228,611,9,38,248,"[{'type': 'replied_to', 'id': '1067794523827433473'}]",At this point all the choking tentacles of the EU fall away. No customs union. No backstop. No single market. No denial of new trade deals. No money paid over. No threat to the integrity of the Union.,2014-09-08T09:11:39.000Z,Conservative Member of Parliament for Haltemprice and Howden.,2797521996,David Davis,188753,38,1375,1899,DavidDavisMP,True
373,2797521996,author_id: 2797521996,conv_id: 1067794520455155712,1067794520455155712,2018-11-28T14:57:07.000Z,,1067794523827433473,id: 1067794523827433473,590,13,54,251,"[{'type': 'replied_to', 'id': '1067794522808164354'}]","If intransigence from Brussels denies this, we should announce an exit on WTO terms and accelerate preparations for such an outcome. We should press for an exit on a Canada+++ free trade basis. If that is denied to us by Brussels intransigence, we'll have to leave on WTO terms.",2014-09-08T09:11:39.000Z,Conservative Member of Parliament for Haltemprice and Howden.,2797521996,David Davis,188753,38,1375,1899,DavidDavisMP,True
374,2797521996,author_id: 2797521996,conv_id: 1067794520455155712,1067794520455155712,2018-11-28T14:57:07.000Z,,1067794522808164354,id: 1067794522808164354,358,12,40,150,"[{'type': 'replied_to', 'id': '1067794521646395392'}]","If Parliament rejects the Government's current proposal, then the Government can press for a Canada+++ free trade deal backed by technical solutions on the Irish border.",2014-09-08T09:11:39.000Z,Conservative Member of Parliament for Haltemprice and Howden.,2797521996,David Davis,188753,38,1375,1899,DavidDavisMP,True
375,2797521996,author_id: 2797521996,conv_id: 1067794520455155712,1067794520455155712,2018-11-28T14:57:07.000Z,,1067794521646395392,id: 1067794521646395392,845,19,43,478,"[{'type': 'replied_to', 'id': '1067794520455155712'}]","They said that in the 18 months after the referendum the economy would contract by at best 0.1 per cent and at worst 2.1 per cent. Instead, it GREW by 2.8 per cent. This is an error of 4.9% - up to £100 billion.",2014-09-08T09:11:39.000Z,Conservative Member of Parliament for Haltemprice and Howden.,2797521996,David Davis,188753,38,1375,1899,DavidDavisMP,True
376,2797521996,author_id: 2797521996,conv_id: 1067794520455155712,1067794520455155712,2018-11-28T14:57:06.000Z,,1067794520455155712,id: 1067794520455155712,2039,62,234,731,,The Treasury’s forecasts in the past have almost never been right and have more often been dramatically wrong. Take their forecasts for the effects of a Leave vote made in May 2016.,2014-09-08T09:11:39.000Z,Conservative Member of Parliament for Haltemprice and Howden.,2797521996,David Davis,188753,38,1375,1899,DavidDavisMP,True
377,2797521996,author_id: 2797521996,conv_id: 1067108461190791168,1067108461190791168,2018-11-26T17:30:57.000Z,,1067108461190791168,id: 1067108461190791168,3311,157,621,1021,,"Earlier, I urged the PM to withhold part of the £39 billion divorce bill until we get a comprehensive free trade agreement. If the EU is serious about agreeing a good deal, they should be happy to oblige.

https://t.co/8v5vyi0SA4",2014-09-08T09:11:39.000Z,Conservative Member of Parliament for Haltemprice and Howden.,2797521996,David Davis,188753,38,1375,1899,DavidDavisMP,True
378,2797521996,author_id: 2797521996,conv_id: 1065716076435120128,1065716076435120128,2018-11-22T21:18:07.000Z,"[{'start': 3, 'end': 14, 'username': 'HuffPostUK', 'id': '271413771'}, {'start': 113, 'end': 126, 'username': 'DavidDavisMP', 'id': '2797521996'}]",1065716076435120128,id: 1065716076435120128,0,0,0,105,"[{'type': 'retweeted', 'id': '1065675805701914625'}]","RT @HuffPostUK: This Brexit deal is a capitulation - pass it and our party will sleepwalk into electoral defeat, @DavidDavisMP blogs https:…",2014-09-08T09:11:39.000Z,Conservative Member of Parliament for Haltemprice and Howden.,2797521996,David Davis,188753,38,1375,1899,DavidDavisMP,True
379,2797521996,author_id: 2797521996,conv_id: 1064907136726196226,1064907136726196226,2018-11-20T15:43:41.000Z,,1064907136726196226,id: 1064907136726196226,2637,151,556,1069,,"Earlier today we launched a report on the practical solutions to the Irish border and customs issues. We can avoid giving up our sovereignty, our constitutional integrity and our ambition for global trade. https://t.co/5m5a0z5eA7",2014-09-08T09:11:39.000Z,Conservative Member of Parliament for Haltemprice and Howden.,2797521996,David Davis,188753,38,1375,1899,DavidDavisMP,True
380,2797521996,author_id: 2797521996,conv_id: 1064479897891074048,1064479897891074048,2018-11-19T11:25:59.000Z,,1064479897891074048,id: 1064479897891074048,4117,485,1739,1591,,This deal is not what the people voted for. It will tie us to the Customs Union for years to come with no way out. But there is still time to negotiate a Canada+++ deal that delivers on the referendum. So let’s get on with it. https://t.co/vkztgWyC7W,2014-09-08T09:11:39.000Z,Conservative Member of Parliament for Haltemprice and Howden.,2797521996,David Davis,188753,38,1375,1899,DavidDavisMP,True
381,2797521996,author_id: 2797521996,conv_id: 1063524958779920384,1063524958779920384,2018-11-16T20:52:18.000Z,,1063535254818959360,id: 1063535254818959360,521,184,620,106,"[{'type': 'replied_to', 'id': '1063524964714852352'}]","Earlier I had useful discussions at the US Department of Agriculture. An amazing building, built in the Great Depression. It’s the 3rd largest government building, put up in a hurry on plans based on Leavenworth prison. Very long corridors, you can walk on a 2.3 mile round trip! https://t.co/8YXISZN7qR",2014-09-08T09:11:39.000Z,Conservative Member of Parliament for Haltemprice and Howden.,2797521996,David Davis,188753,38,1375,1899,DavidDavisMP,True
382,2797521996,author_id: 2797521996,conv_id: 1063524958779920384,1063524958779920384,2018-11-16T20:11:25.000Z,,1063524964714852352,id: 1063524964714852352,1564,94,404,522,"[{'type': 'replied_to', 'id': '1063524961753735170'}]",We have to have a Canada+++ deal to allow us to have a free trade deal with America,2014-09-08T09:11:39.000Z,Conservative Member of Parliament for Haltemprice and Howden.,2797521996,David Davis,188753,38,1375,1899,DavidDavisMP,True
383,2797521996,author_id: 2797521996,conv_id: 1063524958779920384,1063524958779920384,2018-11-16T20:11:24.000Z,,1063524961753735170,id: 1063524961753735170,1469,62,211,586,"[{'type': 'replied_to', 'id': '1063524958779920384'}]","This will not be possible if we accept the Government's proposed deal with Europe, which will block every avenue of negotiation with America.",2014-09-08T09:11:39.000Z,Conservative Member of Parliament for Haltemprice and Howden.,2797521996,David Davis,188753,38,1375,1899,DavidDavisMP,True
384,2797521996,author_id: 2797521996,conv_id: 1063524958779920384,1063524958779920384,2018-11-16T20:11:24.000Z,,1063524958779920384,id: 1063524958779920384,4875,1093,3134,1781,,I have spent the last few days in Washington talking to US Government Trade and Treasury officials encouraging a free trade deal with the UK. Excellent response. They have already started on the procedures to allow negotiations to start immediately once we leave the EU in March.,2014-09-08T09:11:39.000Z,Conservative Member of Parliament for Haltemprice and Howden.,2797521996,David Davis,188753,38,1375,1899,DavidDavisMP,True
385,2797521996,author_id: 2797521996,conv_id: 1063351518588518400,1063351518588518400,2018-11-16T08:42:12.000Z,"[{'start': 3, 'end': 18, 'username': 'StandUp4Brexit', 'id': '1022452334872457216'}]",1063351518588518400,id: 1063351518588518400,0,0,0,356,"[{'type': 'retweeted', 'id': '1063191164310953990'}]",RT @StandUp4Brexit: “There’s a big majority against this policy in the House of Commons. I’ve been putting up the alternative as persuasive…,2014-09-08T09:11:39.000Z,Conservative Member of Parliament for Haltemprice and Howden.,2797521996,David Davis,188753,38,1375,1899,DavidDavisMP,True
386,2797521996,author_id: 2797521996,conv_id: 1062775053597794311,1062775053597794311,2018-11-14T18:31:32.000Z,"[{'start': 112, 'end': 126, 'username': 'tracey_crouch', 'id': '62613162'}]",1062775053597794311,id: 1062775053597794311,291,2,46,47,"[{'type': 'quoted', 'id': '1062707071987138561'}]",Pleased the Government has changed its position on FOBTs. This is a wholly sensible decision and I congratulate @Tracey_Crouch for her principled stance. https://t.co/EjaDuXKuPp,2014-09-08T09:11:39.000Z,Conservative Member of Parliament for Haltemprice and Howden.,2797521996,David Davis,188753,38,1375,1899,DavidDavisMP,True
387,2797521996,author_id: 2797521996,conv_id: 1062711807800946698,1062711807800946698,2018-11-14T14:20:13.000Z,,1062711807800946698,id: 1062711807800946698,3558,134,507,1436,,Cabinet Ministers must recognise their responsibility and think very carefully about the decisions they make today. This deal would be a betrayal of the referendum result and have irreversible consequences for years to come. https://t.co/7nexZ8fELU,2014-09-08T09:11:39.000Z,Conservative Member of Parliament for Haltemprice and Howden.,2797521996,David Davis,188753,38,1375,1899,DavidDavisMP,True
388,2797521996,author_id: 2797521996,conv_id: 1062652018031017984,1062652018031017984,2018-11-14T10:22:38.000Z,"[{'start': 1, 'end': 15, 'username': 'tracey_crouch', 'id': '62613162'}]",1062652018031017984,id: 1062652018031017984,505,6,61,104,,.@Tracey_Crouch was right to take a stand over Fixed Odds Betting Terminals. The Government must not prevaricate any longer on reducing the maximum stake. That is why I am supporting amendments to make it happen sooner rather than later.,2014-09-08T09:11:39.000Z,Conservative Member of Parliament for Haltemprice and Howden.,2797521996,David Davis,188753,38,1375,1899,DavidDavisMP,True
389,2797521996,author_id: 2797521996,conv_id: 1062439219447107584,1062439219447107584,2018-11-13T20:17:03.000Z,,1062439219447107584,id: 1062439219447107584,10539,1120,2958,4207,,"This is the moment of truth. This is the fork in the road. Do we pursue a future as an independent nation or accept EU domination, imprisonment in the customs union and 2nd class status. Cabinet and all Conservative MPs should stand up, be counted and say no to this capitulation.",2014-09-08T09:11:39.000Z,Conservative Member of Parliament for Haltemprice and Howden.,2797521996,David Davis,188753,38,1375,1899,DavidDavisMP,True
390,2797521996,author_id: 2797521996,conv_id: 1062380531403370502,1062380531403370502,2018-11-13T16:23:51.000Z,,1062380531403370502,id: 1062380531403370502,1160,28,117,354,,"Pleased that the Government has made the sensible decision to agree to release the legal advice on the backstop. I called for this in The Sunday Times earlier this month. Done at the appropriate time, it will allow for a sensible decision without undermining the negotiations.",2014-09-08T09:11:39.000Z,Conservative Member of Parliament for Haltemprice and Howden.,2797521996,David Davis,188753,38,1375,1899,DavidDavisMP,True
391,2797521996,author_id: 2797521996,conv_id: 1061585424357965825,1061585424357965825,2018-11-11T11:44:23.000Z,,1061585424357965825,id: 1061585424357965825,522,3,22,119,,100 years ago today Canadian Forces liberated the city of Mons. It was great to see a strong Canadian representation at commemorative services held across the weekend. Today is a day to reflect on the immense sacrifices made for our freedom. #LestWeForget. https://t.co/wFE1z17Pjn,2014-09-08T09:11:39.000Z,Conservative Member of Parliament for Haltemprice and Howden.,2797521996,David Davis,188753,38,1375,1899,DavidDavisMP,True
392,2797521996,author_id: 2797521996,conv_id: 1061275748982505472,1061275748982505472,2018-11-11T09:57:02.000Z,,1061558408493576192,id: 1061558408493576192,97,0,2,10,"[{'type': 'replied_to', 'id': '1061275750605774848'}]","Yesterday I also met the granddaughter of George Ellison, the last British soldier to die in WW1. Lovely lady.",2014-09-08T09:11:39.000Z,Conservative Member of Parliament for Haltemprice and Howden.,2797521996,David Davis,188753,38,1375,1899,DavidDavisMP,True
393,2797521996,author_id: 2797521996,conv_id: 1061275748982505472,1061275748982505472,2018-11-10T15:13:51.000Z,,1061275750605774848,id: 1061275750605774848,97,0,13,8,"[{'type': 'replied_to', 'id': '1061275748982505472'}]","This followed a wonderful address by the Governor General of Canada, @GGJuliePayette.",2014-09-08T09:11:39.000Z,Conservative Member of Parliament for Haltemprice and Howden.,2797521996,David Davis,188753,38,1375,1899,DavidDavisMP,True
394,2797521996,author_id: 2797521996,conv_id: 1061275748982505472,1061275748982505472,2018-11-10T15:13:50.000Z,,1061275748982505472,id: 1061275748982505472,374,3,21,42,,"Today I am at Saint-Symphorien Cemetery in Belgium, after a Canadian/British/German Remembrance Service. #LestWeForget https://t.co/p1if9p9CJ6",2014-09-08T09:11:39.000Z,Conservative Member of Parliament for Haltemprice and Howden.,2797521996,David Davis,188753,38,1375,1899,DavidDavisMP,True
395,2797521996,author_id: 2797521996,conv_id: 1060944809421086720,1060944809421086720,2018-11-09T17:18:48.000Z,"[{'start': 32, 'end': 48, 'username': 'christopherhope', 'id': '22776133'}]",1060944809421086720,id: 1060944809421086720,242,0,41,62,"[{'type': 'quoted', 'id': '1060788448804720640'}]",It was a pleasure to speak with @christopherhope on this week's @brexitbroadcast. https://t.co/FiHfCGv8kn,2014-09-08T09:11:39.000Z,Conservative Member of Parliament for Haltemprice and Howden.,2797521996,David Davis,188753,38,1375,1899,DavidDavisMP,True
396,2797521996,author_id: 2797521996,conv_id: 1060932783839813632,1060932783839813632,2018-11-09T16:31:01.000Z,"[{'start': 13, 'end': 25, 'username': 'JoJohnsonUK', 'id': '237700394'}]",1060932783839813632,id: 1060932783839813632,3499,308,1579,1057,,"Sorry to see @JoJohnsonUK resign. He's right that the Government's current proposals are ""a travesty of Brexit"" and represent a huge democratic deficit - out of Europe but run by Europe. However, a 2nd referendum is not the way forward and is not supported by the public.",2014-09-08T09:11:39.000Z,Conservative Member of Parliament for Haltemprice and Howden.,2797521996,David Davis,188753,38,1375,1899,DavidDavisMP,True
