,author_id,author_id_new,conv_id_new,conversation_id,created_at,entities.mentions,id,id_new,public_metrics.like_count,public_metrics.quote_count,public_metrics.reply_count,public_metrics.retweet_count,referenced_tweets,text,users.created_at,users.description,users.id,users.name,users.public_metrics.followers_count,users.public_metrics.following_count,users.public_metrics.listed_count,users.public_metrics.tweet_count,users.username,users.verified
267,451586190,author_id: 451586190,conv_id: 598440625416069120,598440625416069120,2015-05-13T10:52:18.000Z,,598440625416069120,id: 598440625416069120,80,2,167,102,,UK poll explodes myth of social media power.  Great time for competitive free  press.,2011-12-31T18:29:24.000Z,,451586190,Rupert Murdoch,672794,125,6443,1714,rupertmurdoch,True
268,451586190,author_id: 451586190,conv_id: 596559202467721216,596559202467721216,2015-05-08T06:16:12.000Z,,596559202467721216,id: 596559202467721216,87,0,105,112,,"Despite universal condemnation and terrible campaign, UKIP held huge vote.  Cameron needs to remember.",2011-12-31T18:29:24.000Z,,451586190,Rupert Murdoch,672794,125,6443,1714,rupertmurdoch,True
269,451586190,author_id: 451586190,conv_id: 596557921497911298,596557921497911298,2015-05-08T06:11:06.000Z,,596557921497911298,id: 596557921497911298,180,0,163,217,,So all UK polls nonsense.  Also bloody nose for BBC.,2011-12-31T18:29:24.000Z,,451586190,Rupert Murdoch,672794,125,6443,1714,rupertmurdoch,True
270,451586190,author_id: 451586190,conv_id: 595427971332239361,595427971332239361,2015-05-05T03:21:05.000Z,,595427971332239361,id: 595427971332239361,31,0,120,53,,"UK Polls predict closest ever result, followed by  months of instability without unlikely last minute big swing to Cameron.",2011-12-31T18:29:24.000Z,,451586190,Rupert Murdoch,672794,125,6443,1714,rupertmurdoch,True
271,451586190,author_id: 451586190,conv_id: 594974361779576833,594974361779576833,2015-05-03T21:18:36.000Z,,594974361779576833,id: 594974361779576833,45,0,41,36,,"Real fight in Vegas last night after endless UK elections Partisan crowd, unlike judges, thought brave Pacquiao won.  Sat behind P's mother.",2011-12-31T18:29:24.000Z,,451586190,Rupert Murdoch,672794,125,6443,1714,rupertmurdoch,True
272,451586190,author_id: 451586190,conv_id: 592351810314207232,592351810314207232,2015-04-26T15:37:31.000Z,,592351810314207232,id: 592351810314207232,27,0,88,36,,"Tweet responses interesting.   Maybe I guessed 10 too many Cons, but either way Scots probably will hold the balance.",2011-12-31T18:29:24.000Z,,451586190,Rupert Murdoch,672794,125,6443,1714,rupertmurdoch,True
273,451586190,author_id: 451586190,conv_id: 592297202313211904,592297202313211904,2015-04-26T14:38:53.000Z,"[{'start': 0, 'end': 13, 'username': 'RevJFletcher', 'id': '400651035'}, {'start': 14, 'end': 21, 'username': 'jeremy', 'id': '16'}]",592337054832398336,id: 592337054832398336,5,0,15,3,"[{'type': 'replied_to', 'id': '592297202313211904'}]",@RevJFletcher @jeremy Clarkson today in ST more compassionate re immigrants.     My feelings too.,2011-12-31T18:29:24.000Z,,451586190,Rupert Murdoch,672794,125,6443,1714,rupertmurdoch,True
274,451586190,author_id: 451586190,conv_id: 592296213891948544,592296213891948544,2015-04-26T11:56:36.000Z,,592296213891948544,id: 592296213891948544,45,0,32,38,,"Remember business revolution from Internet  Some great disruptive coys create jobs, like Uber, others automating old jobs.",2011-12-31T18:29:24.000Z,,451586190,Rupert Murdoch,672794,125,6443,1714,rupertmurdoch,True
275,451586190,author_id: 451586190,conv_id: 592295220760412160,592295220760412160,2015-04-26T11:52:39.000Z,,592295220760412160,id: 592295220760412160,42,0,49,50,,"Asset inflation because ""advanced"" economies crippled by regulations and power crazed lawyers.",2011-12-31T18:29:24.000Z,,451586190,Rupert Murdoch,672794,125,6443,1714,rupertmurdoch,True
276,451586190,author_id: 451586190,conv_id: 592294586757832705,592294586757832705,2015-04-26T11:50:08.000Z,,592294586757832705,id: 592294586757832705,96,1,63,168,,"S. Times shows rich almost doubled over last few years.  Same in US.   Why?   Central bankers printing trillions, no real job creation.",2011-12-31T18:29:24.000Z,,451586190,Rupert Murdoch,672794,125,6443,1714,rupertmurdoch,True
277,451586190,author_id: 451586190,conv_id: 592293859780091904,592293859780091904,2015-04-26T11:47:15.000Z,,592293859780091904,id: 592293859780091904,114,0,77,240,,"Scots may be crazy or not wanting self rule, but who can deny right of self determination?    Feels inevitable over next few years.",2011-12-31T18:29:24.000Z,,451586190,Rupert Murdoch,672794,125,6443,1714,rupertmurdoch,True
278,451586190,author_id: 451586190,conv_id: 592292479350677505,592292479350677505,2015-04-26T11:41:45.000Z,,592292479350677505,id: 592292479350677505,75,0,140,244,,UK. Failure to win majority against either Brown in crisis or Miliband would mean chop for Cameron. Open talk today in party and press.,2011-12-31T18:29:24.000Z,,451586190,Rupert Murdoch,672794,125,6443,1714,rupertmurdoch,True
279,451586190,author_id: 451586190,conv_id: 592291184908890114,592291184908890114,2015-04-26T11:36:37.000Z,,592291184908890114,id: 592291184908890114,28,0,69,68,,"UK. Likely approximate outcome, far from certain - Con 294 seats, Lab 265, SNP 48, LD. 25, odds 18.  Everything still to tight for!",2011-12-31T18:29:24.000Z,,451586190,Rupert Murdoch,672794,125,6443,1714,rupertmurdoch,True
280,451586190,author_id: 451586190,conv_id: 592289812280901632,592289812280901632,2015-04-26T11:31:10.000Z,,592289812280901632,id: 592289812280901632,17,0,18,20,,"UK.  Many possible outcomes.  In spite of denials, SNP still see Cameron as perfect enemy. Cleverly hurting Miliband, hinting support",2011-12-31T18:29:24.000Z,,451586190,Rupert Murdoch,672794,125,6443,1714,rupertmurdoch,True
281,451586190,author_id: 451586190,conv_id: 592288511111356416,592288511111356416,2015-04-26T11:25:59.000Z,,592288511111356416,id: 592288511111356416,41,1,90,80,,"UK. Polls all indicate hung parliament, possible constitutional crisis. Doubt the crisis bit.     Deals, maybe dirty, will be done.",2011-12-31T18:29:24.000Z,,451586190,Rupert Murdoch,672794,125,6443,1714,rupertmurdoch,True
282,451586190,author_id: 451586190,conv_id: 592287675245297664,592287675245297664,2015-04-26T11:22:40.000Z,,592287675245297664,id: 592287675245297664,66,1,22,72,,"Forget Scotland, UK already seems 2 countries, London and the rest!   Take totally new wave of entrepreneurship to correct.",2011-12-31T18:29:24.000Z,,451586190,Rupert Murdoch,672794,125,6443,1714,rupertmurdoch,True
283,451586190,author_id: 451586190,conv_id: 592025838687821825,592025838687821825,2015-04-25T22:36:53.000Z,"[{'start': 0, 'end': 10, 'username': 'GJElvidge', 'id': '950484186'}]",592094957911056384,id: 592094957911056384,5,0,4,4,"[{'type': 'replied_to', 'id': '592091712715157504'}]",@GJElvidge Brit aristos won over third of globe for UK.  No!  That was mainly the Scots.,2011-12-31T18:29:24.000Z,,451586190,Rupert Murdoch,672794,125,6443,1714,rupertmurdoch,True
284,451586190,author_id: 451586190,conv_id: 592025838687821825,592025838687821825,2015-04-25T22:16:44.000Z,,592089889795080192,id: 592089889795080192,1,0,4,0,"[{'type': 'replied_to', 'id': '592077763747717120'}]","@rayne_ea some Brit arrogance going now,  Agree,, but the alternative?  Hold your nose and hope for Boris, or anyone!",2011-12-31T18:29:24.000Z,,451586190,Rupert Murdoch,672794,125,6443,1714,rupertmurdoch,True
285,451586190,author_id: 451586190,conv_id: 592025838687821825,592025838687821825,2015-04-25T18:10:26.000Z,"[{'start': 0, 'end': 9, 'username': 'trevzal1', 'id': '2663817440'}]",592027905376526336,id: 592027905376526336,2,0,3,1,"[{'type': 'replied_to', 'id': '592026831328550913'}]",@trevzal1 many Brits also killed.   True.,2011-12-31T18:29:24.000Z,,451586190,Rupert Murdoch,672794,125,6443,1714,rupertmurdoch,True
286,451586190,author_id: 451586190,conv_id: 592026811669839872,592026811669839872,2015-04-25T18:06:05.000Z,,592026811669839872,id: 592026811669839872,25,0,17,12,,"Congrats FOXTEL, especially Brian Walsh and brilliant collaborators on great Deadline Gallipoli series.",2011-12-31T18:29:24.000Z,,451586190,Rupert Murdoch,672794,125,6443,1714,rupertmurdoch,True
287,451586190,author_id: 451586190,conv_id: 592026092581593088,592026092581593088,2015-04-25T18:03:14.000Z,,592026092581593088,id: 592026092581593088,29,0,11,17,,Huge turnouts all over Australia for Gallipoli memorial services.,2011-12-31T18:29:24.000Z,,451586190,Rupert Murdoch,672794,125,6443,1714,rupertmurdoch,True
288,451586190,author_id: 451586190,conv_id: 592025838687821825,592025838687821825,2015-04-25T18:02:13.000Z,,592025838687821825,id: 592025838687821825,62,0,91,87,,"Today centenary of Gallipoli disaster.  Testament to Brit aristo arrogance, incompetence. Many thousands brave Anzac youths slaughtered.",2011-12-31T18:29:24.000Z,,451586190,Rupert Murdoch,672794,125,6443,1714,rupertmurdoch,True
289,451586190,author_id: 451586190,conv_id: 588832266106834944,588832266106834944,2015-04-16T22:32:06.000Z,,588832266106834944,id: 588832266106834944,26,0,64,44,,"Sturgeon won only in that she cemented already huge gains for SNP.
Knock-on effect good for Cameron who needs the help.",2011-12-31T18:29:24.000Z,,451586190,Rupert Murdoch,672794,125,6443,1714,rupertmurdoch,True
290,451586190,author_id: 451586190,conv_id: 588831042875891712,588831042875891712,2015-04-16T22:27:15.000Z,,588831042875891712,id: 588831042875891712,23,0,55,35,,When are we to get some real policies from Hillary?  Dangerous  if different from Bill's  successful ones.,2011-12-31T18:29:24.000Z,,451586190,Rupert Murdoch,672794,125,6443,1714,rupertmurdoch,True
291,451586190,author_id: 451586190,conv_id: 588828637161459712,588828637161459712,2015-04-16T22:17:41.000Z,,588828637161459712,id: 588828637161459712,63,0,148,105,,"No show Cameron only winner in UK debate as Scot Sturgeon 
clobbers  Miliband  and Farage stumbles.",2011-12-31T18:29:24.000Z,,451586190,Rupert Murdoch,672794,125,6443,1714,rupertmurdoch,True
292,451586190,author_id: 451586190,conv_id: 588106486141825024,588106486141825024,2015-04-14T22:28:07.000Z,,588106486141825024,id: 588106486141825024,30,0,90,85,,UK. Ed Milband asks who will be in Downing St when I call? Fear not! Never been there unless  invited and never in  last six years.,2011-12-31T18:29:24.000Z,,451586190,Rupert Murdoch,672794,125,6443,1714,rupertmurdoch,True
293,451586190,author_id: 451586190,conv_id: 586507259578032128,586507259578032128,2015-04-10T12:33:22.000Z,,586507259578032128,id: 586507259578032128,65,0,118,80,,"Guardian today suggests my dad's expose of Gallipoli fiasco led to my anti-establishment views.  Maybe, but confirmed by many later 
events.",2011-12-31T18:29:24.000Z,,451586190,Rupert Murdoch,672794,125,6443,1714,rupertmurdoch,True
294,451586190,author_id: 451586190,conv_id: 585944287394844672,585944287394844672,2015-04-08T23:16:19.000Z,,585944287394844672,id: 585944287394844672,67,0,65,84,,"Damning but respectful piece in today's Journal by H Kissinger and 
G Schultz on Iran ""deal"".    How can POTUS sign this? Awful legacy.",2011-12-31T18:29:24.000Z,,451586190,Rupert Murdoch,672794,125,6443,1714,rupertmurdoch,True
295,451586190,author_id: 451586190,conv_id: 585886202018062336,585886202018062336,2015-04-08T19:25:30.000Z,"[{'start': 0, 'end': 7, 'username': 'joanna', 'id': '12870'}, {'start': 70, 'end': 74, 'username': 'WSJ', 'id': '3108351'}]",585886202018062336,id: 585886202018062336,65,0,12,27,,@Joanna Stern. Can I please have the Apple watch now?  I want to read @WSJ on it.,2011-12-31T18:29:24.000Z,,451586190,Rupert Murdoch,672794,125,6443,1714,rupertmurdoch,True
296,451586190,author_id: 451586190,conv_id: 584473011673178113,584473011673178113,2015-04-04T21:49:59.000Z,,584473011673178113,id: 584473011673178113,29,0,117,33,,"No reason trust terror  supporting Iran but should we gamble young emboldened by Western contact, forcing change internally? Tough question.",2011-12-31T18:29:24.000Z,,451586190,Rupert Murdoch,672794,125,6443,1714,rupertmurdoch,True
297,451586190,author_id: 451586190,conv_id: 583770253940940801,583770253940940801,2015-04-02T23:17:29.000Z,,583770253940940801,id: 583770253940940801,57,0,92,98,,"UK debate.  Great performances by SNP Sturgeon and UKIP Farage, Cameron sort of ok, Milliband not, Clegg pathetic.  May not count in May.",2011-12-31T18:29:24.000Z,,451586190,Rupert Murdoch,672794,125,6443,1714,rupertmurdoch,True
298,451586190,author_id: 451586190,conv_id: 583768980411830272,583768980411830272,2015-04-02T23:12:25.000Z,,583768980411830272,id: 583768980411830272,129,0,83,160,,"All civil libertarians should worry about doubling, world wide, of murder rate of Christians and Jews.  Just today it was Kenya.",2011-12-31T18:29:24.000Z,,451586190,Rupert Murdoch,672794,125,6443,1714,rupertmurdoch,True
299,451586190,author_id: 451586190,conv_id: 583768418618384384,583768418618384384,2015-04-02T23:10:11.000Z,,583768418618384384,id: 583768418618384384,33,0,40,37,,"Both sides overreacting to new Indiana/Arkansas laws, but sad to see friend Tim Cook maligned.  Great businessman, decent human being.",2011-12-31T18:29:24.000Z,,451586190,Rupert Murdoch,672794,125,6443,1714,rupertmurdoch,True
300,451586190,author_id: 451586190,conv_id: 583286349643583488,583286349643583488,2015-04-01T15:14:37.000Z,"[{'start': 60, 'end': 69, 'username': 'mlevchin', 'id': '14541402'}]",583286349643583488,id: 583286349643583488,41,0,7,37,,"Great piece in Techcrunch by immigrant, PayPal founder, etc @mlevchin .  Absolutely right. http://t.co/ZSqaVFyMuA",2011-12-31T18:29:24.000Z,,451586190,Rupert Murdoch,672794,125,6443,1714,rupertmurdoch,True
301,451586190,author_id: 451586190,conv_id: 582703960437493760,582703960437493760,2015-03-31T00:40:24.000Z,,582703960437493760,id: 582703960437493760,35,0,32,49,,Iran deal.  Will there be enough Senate votes to override an Obama veto?   Very possible!,2011-12-31T18:29:24.000Z,,451586190,Rupert Murdoch,672794,125,6443,1714,rupertmurdoch,True
302,451586190,author_id: 451586190,conv_id: 582277610702508032,582277610702508032,2015-03-29T20:26:15.000Z,,582277610702508032,id: 582277610702508032,52,0,54,99,,Most elections are referenda on sitting governments. Cameron's mistake is insisting it is a referendum about Miliband.  No vision yet.,2011-12-31T18:29:24.000Z,,451586190,Rupert Murdoch,672794,125,6443,1714,rupertmurdoch,True
303,451586190,author_id: 451586190,conv_id: 581994698438369280,581994698438369280,2015-03-29T01:42:03.000Z,,581994698438369280,id: 581994698438369280,65,0,115,95,,"Whither US-Iran deal?  Meanwhile Iran backs terrorists in Gaza, Lebanon, Yemen, Eastern Iraq, rules Qatar, Syria, etc. Does WH understand?",2011-12-31T18:29:24.000Z,,451586190,Rupert Murdoch,672794,125,6443,1714,rupertmurdoch,True
304,451586190,author_id: 451586190,conv_id: 581962657940434944,581962657940434944,2015-03-28T23:34:44.000Z,,581962657940434944,id: 581962657940434944,114,1,67,49,,"Just visited the fabulous, massive Getty Museum in LA - only one mile from my beautiful vineyard!   What an amazing gift to this city.",2011-12-31T18:29:24.000Z,,451586190,Rupert Murdoch,672794,125,6443,1714,rupertmurdoch,True
305,451586190,author_id: 451586190,conv_id: 581666192676368384,581666192676368384,2015-03-28T03:56:41.000Z,,581666192676368384,id: 581666192676368384,55,0,57,105,,Why did Cameron agree to TV exchange?  He had everything to lose and Miliband everything to gain.  Now watch Tory panic.,2011-12-31T18:29:24.000Z,,451586190,Rupert Murdoch,672794,125,6443,1714,rupertmurdoch,True
306,451586190,author_id: 451586190,conv_id: 581662324496334850,581662324496334850,2015-03-28T03:41:19.000Z,,581662324496334850,id: 581662324496334850,19,0,19,16,,"Entertainment Weekly rates American Idol #1 on MUST LIST, calls 14th season ""pitch perfect, contestants controlling stage"".",2011-12-31T18:29:24.000Z,,451586190,Rupert Murdoch,672794,125,6443,1714,rupertmurdoch,True
307,451586190,author_id: 451586190,conv_id: 581453281890717698,581453281890717698,2015-03-27T13:50:39.000Z,,581453281890717698,id: 581453281890717698,29,0,17,22,,"Finally into Ron Chernow's great work on brilliant Alexander Hamilton.  Wonderful picture of US in 1780s  and 90s, esp war torn New York.",2011-12-31T18:29:24.000Z,,451586190,Rupert Murdoch,672794,125,6443,1714,rupertmurdoch,True
308,451586190,author_id: 451586190,conv_id: 581221050333073408,581221050333073408,2015-03-26T22:27:51.000Z,,581221050333073408,id: 581221050333073408,814,2,530,1885,,"Thanks for 2 mentions, Ed Miliband.  Only met once for all of 2 minutes when you embarrassed me with over the top flattery.",2011-12-31T18:29:24.000Z,,451586190,Rupert Murdoch,672794,125,6443,1714,rupertmurdoch,True
309,451586190,author_id: 451586190,conv_id: 580504630343372801,580504630343372801,2015-03-24T23:01:03.000Z,,580504630343372801,id: 580504630343372801,31,0,48,44,,"Read 2 bks by famous neurosurgeon Ben Carson, running for president. Wonderful character, up from Detroit ghetto, sadly seems political naif",2011-12-31T18:29:24.000Z,,451586190,Rupert Murdoch,672794,125,6443,1714,rupertmurdoch,True
310,451586190,author_id: 451586190,conv_id: 580502514442874880,580502514442874880,2015-03-24T22:52:39.000Z,,580502514442874880,id: 580502514442874880,824,8,949,1013,,How stupid can BBC be in firing Jeremy Clarkson?   Funny man with great expertise and huge following.,2011-12-31T18:29:24.000Z,,451586190,Rupert Murdoch,672794,125,6443,1714,rupertmurdoch,True
311,451586190,author_id: 451586190,conv_id: 580497430095011840,580497430095011840,2015-03-24T22:32:27.000Z,,580497430095011840,id: 580497430095011840,30,0,19,30,,"Rahm Emanuel pulling well ahead in Chicago mayoral race. Only hope for reform of awful schools, city's terrible finances. Good luck!",2011-12-31T18:29:24.000Z,,451586190,Rupert Murdoch,672794,125,6443,1714,rupertmurdoch,True
312,451586190,author_id: 451586190,conv_id: 580213977348591616,580213977348591616,2015-03-24T03:46:06.000Z,,580213977348591616,id: 580213977348591616,52,0,52,46,,"Just saw Rand Paul on Megan Kelly show.   Smart move ahead of Ted Cruz on Hannity..    Contest warming up early, danger folks get tired.",2011-12-31T18:29:24.000Z,,451586190,Rupert Murdoch,672794,125,6443,1714,rupertmurdoch,True
313,451586190,author_id: 451586190,conv_id: 580204267480313856,580204267480313856,2015-03-24T03:07:31.000Z,,580204267480313856,id: 580204267480313856,24,0,20,28,,"Boston Globe twice calls for Elizabeth Warren to run!  What gives?
Good idea to test Clinton.  Webb has fine message, but no traction.",2011-12-31T18:29:24.000Z,,451586190,Rupert Murdoch,672794,125,6443,1714,rupertmurdoch,True
314,451586190,author_id: 451586190,conv_id: 579783873778716672,579783873778716672,2015-03-22T23:17:02.000Z,,579783873778716672,id: 579783873778716672,106,0,30,108,,"Lee Kuan Yew died at 91, great uncompromising statesman, first met  50 years ago in Canberra.  Advice always wise.",2011-12-31T18:29:24.000Z,,451586190,Rupert Murdoch,672794,125,6443,1714,rupertmurdoch,True
315,451586190,author_id: 451586190,conv_id: 579096510962397184,579096510962397184,2015-03-21T01:45:41.000Z,,579096510962397184,id: 579096510962397184,60,0,69,87,,"Now Yemen, after Kenya, Tunisia, Afghanistan, in one week!  Are we really safer, John Kerry?",2011-12-31T18:29:24.000Z,,451586190,Rupert Murdoch,672794,125,6443,1714,rupertmurdoch,True
316,451586190,author_id: 451586190,conv_id: 578674671945523200,578674671945523200,2015-03-19T21:49:27.000Z,,578674671945523200,id: 578674671945523200,49,0,33,31,,Congrats to all at Fox.  Last night's spell binding Empire won huge audience.  Deservedly.   And tonight's Idol should be great viewing too.,2011-12-31T18:29:24.000Z,,451586190,Rupert Murdoch,672794,125,6443,1714,rupertmurdoch,True
317,451586190,author_id: 451586190,conv_id: 578673824360599553,578673824360599553,2015-03-19T21:46:05.000Z,,578673824360599553,id: 578673824360599553,21,1,42,19,,"Good point!  Compulsory voting seems anti-First Amendment. Australians have option to vote informal, which many do.",2011-12-31T18:29:24.000Z,,451586190,Rupert Murdoch,672794,125,6443,1714,rupertmurdoch,True
318,451586190,author_id: 451586190,conv_id: 578670672374722560,578670672374722560,2015-03-19T21:33:34.000Z,,578670672374722560,id: 578670672374722560,63,0,72,72,,"Agree with POTUS about compulsory voting.  Works well in Australia.
But will not necessarily have the effect O expects.",2011-12-31T18:29:24.000Z,,451586190,Rupert Murdoch,672794,125,6443,1714,rupertmurdoch,True
319,451586190,author_id: 451586190,conv_id: 578362805255958528,578362805255958528,2015-03-19T01:10:12.000Z,,578362805255958528,id: 578362805255958528,178,5,232,471,,Senior intelligence people say certain that Hillary's messages totally hacked by several foreign governments.,2011-12-31T18:29:24.000Z,,451586190,Rupert Murdoch,672794,125,6443,1714,rupertmurdoch,True
320,451586190,author_id: 451586190,conv_id: 577901202236530688,577901202236530688,2015-03-17T18:35:58.000Z,,577901202236530688,id: 577901202236530688,19,0,16,29,,"UK joins China in Asian Infrastructure Bank.  Australia should follow quickly, eventually US too.  Leads IMF, could have feet on both camps",2011-12-31T18:29:24.000Z,,451586190,Rupert Murdoch,672794,125,6443,1714,rupertmurdoch,True
321,451586190,author_id: 451586190,conv_id: 577900393188851712,577900393188851712,2015-03-17T18:32:45.000Z,,577900393188851712,id: 577900393188851712,46,0,73,63,,"Ridiculous claim - earth has reached its limits for hospitable life.
Still huge untapped farm capacity  in Africa and S America.",2011-12-31T18:29:24.000Z,,451586190,Rupert Murdoch,672794,125,6443,1714,rupertmurdoch,True
322,451586190,author_id: 451586190,conv_id: 577672494993158144,577672494993158144,2015-03-17T03:27:10.000Z,,577672494993158144,id: 577672494993158144,53,0,82,44,,Groupthink vs free speech.  Al Gore wants deniers (skeptics?) punished. Who next - whole faculties?,2011-12-31T18:29:24.000Z,,451586190,Rupert Murdoch,672794,125,6443,1714,rupertmurdoch,True
323,451586190,author_id: 451586190,conv_id: 577255494881931264,577255494881931264,2015-03-15T23:50:09.000Z,,577255494881931264,id: 577255494881931264,348,22,147,276,,Republicans talking immigration nonsense on strengthening the border while no net inflow from Mexico for long time.  Get real!,2011-12-31T18:29:24.000Z,,451586190,Rupert Murdoch,672794,125,6443,1714,rupertmurdoch,True
324,451586190,author_id: 451586190,conv_id: 577155517719527424,577155517719527424,2015-03-15T17:12:53.000Z,,577155517719527424,id: 577155517719527424,21,0,16,15,,Referring to Chelsea!,2011-12-31T18:29:24.000Z,,451586190,Rupert Murdoch,672794,125,6443,1714,rupertmurdoch,True
325,451586190,author_id: 451586190,conv_id: 577149702753271809,577149702753271809,2015-03-15T17:10:38.000Z,"[{'start': 0, 'end': 11, 'username': 'Tetburyboy', 'id': '162344077'}]",577154954181263360,id: 577154954181263360,13,0,4,2,"[{'type': 'replied_to', 'id': '577152156056309761'}]","@Tetburyboy Maybe next Clinton in a White House!  Maybe good idea in ten or twenty years. Best of both parents, self control and charisma.",2011-12-31T18:29:24.000Z,,451586190,Rupert Murdoch,672794,125,6443,1714,rupertmurdoch,True
326,451586190,author_id: 451586190,conv_id: 577153043633860608,577153043633860608,2015-03-15T17:03:03.000Z,,577153043633860608,id: 577153043633860608,30,1,89,73,,Aust!  Turnbull's plans to scrap certain rules suit buddies at Nine.  Can't oppose dumping all regs but not this. Nice to see how MT plays.,2011-12-31T18:29:24.000Z,,451586190,Rupert Murdoch,672794,125,6443,1714,rupertmurdoch,True
327,451586190,author_id: 451586190,conv_id: 577149702753271809,577149702753271809,2015-03-15T16:49:46.000Z,,577149702753271809,id: 577149702753271809,41,0,46,39,,"So Hillary's problems do go on and on.   Amazing vitriol from Maureen Dowd today. Almost makes one sorry for H, even ashamed for laughing!",2011-12-31T18:29:24.000Z,,451586190,Rupert Murdoch,672794,125,6443,1714,rupertmurdoch,True
328,451586190,author_id: 451586190,conv_id: 574778045568917504,574778045568917504,2015-03-09T03:45:39.000Z,,574778045568917504,id: 574778045568917504,57,0,150,87,,"Hillary's email problem won't just pass, but run and run. Regardless of any new shocks, this will go on for a long time.",2011-12-31T18:29:24.000Z,,451586190,Rupert Murdoch,672794,125,6443,1714,rupertmurdoch,True
329,451586190,author_id: 451586190,conv_id: 574278416524001280,574278416524001280,2015-03-07T18:40:18.000Z,,574278416524001280,id: 574278416524001280,89,0,61,41,,Lucky me!   Promised ticket for Floyd Mayweather vs Manny Pacquiao in Vegas May 2nd. Maybe biggest ever ppv event.,2011-12-31T18:29:24.000Z,,451586190,Rupert Murdoch,672794,125,6443,1714,rupertmurdoch,True
330,451586190,author_id: 451586190,conv_id: 574273399217852416,574273399217852416,2015-03-07T18:20:22.000Z,,574273399217852416,id: 574273399217852416,39,2,22,26,,"Fabulous show! Musical of Alexander Hamilton, great acting, dancing, singing. Historically accurate with lives of Washington Jefferson, etc.",2011-12-31T18:29:24.000Z,,451586190,Rupert Murdoch,672794,125,6443,1714,rupertmurdoch,True
331,451586190,author_id: 451586190,conv_id: 573661652631089154,573661652631089154,2015-03-06T01:57:03.000Z,"[{'start': 0, 'end': 15, 'username': 'ReadingWorkout', 'id': '323952339'}]",573663553321844736,id: 573663553321844736,14,0,10,11,"[{'type': 'replied_to', 'id': '573662045792563200'}]",@ReadingWorkout  how to fix public education?  Make all schools charter or choice with principal's job to hire and fire teachers.,2011-12-31T18:29:24.000Z,,451586190,Rupert Murdoch,672794,125,6443,1714,rupertmurdoch,True
