,author_id,author_id_new,conv_id_new,conversation_id,created_at,entities.mentions,id,id_new,public_metrics.like_count,public_metrics.quote_count,public_metrics.reply_count,public_metrics.retweet_count,referenced_tweets,text,users.created_at,users.description,users.id,users.name,users.public_metrics.followers_count,users.public_metrics.following_count,users.public_metrics.listed_count,users.public_metrics.tweet_count,users.username,users.verified
134,451586190,author_id: 451586190,conv_id: 644365001172516864,644365001172516864,2015-09-17T04:19:22.000Z,,644365001172516864,id: 644365001172516864,36,0,30,47,,"Want to welcome the Unruly team to News team and clients with their cutting edge creativity.    Great deal, Rebekah.",2011-12-31T18:29:24.000Z,,451586190,Rupert Murdoch,672794,125,6443,1714,rupertmurdoch,True
135,451586190,author_id: 451586190,conv_id: 643838343265038337,643838343265038337,2015-09-15T17:26:37.000Z,,643838343265038337,id: 643838343265038337,14,0,15,9,,"Correction.    It was NYT/CBS, not ABC.",2011-12-31T18:29:24.000Z,,451586190,Rupert Murdoch,672794,125,6443,1714,rupertmurdoch,True
136,451586190,author_id: 451586190,conv_id: 643836252442259460,643836252442259460,2015-09-15T17:18:19.000Z,,643836252442259460,id: 643836252442259460,45,0,36,37,,"NYT/ABC poll has Carson in near tie with Trump.  
23% to 27%!      Exciting times.",2011-12-31T18:29:24.000Z,,451586190,Rupert Murdoch,672794,125,6443,1714,rupertmurdoch,True
137,451586190,author_id: 451586190,conv_id: 643393860312399872,643393860312399872,2015-09-14T12:00:24.000Z,,643393860312399872,id: 643393860312399872,397,7,929,610,,Sad to see such a decent man as Abbott toppled.  Now Turnbull needs a November election before Labor sacks Shorten.,2011-12-31T18:29:24.000Z,,451586190,Rupert Murdoch,672794,125,6443,1714,rupertmurdoch,True
138,451586190,author_id: 451586190,conv_id: 642701397507485696,642701397507485696,2015-09-12T14:08:48.000Z,,642701397507485696,id: 642701397507485696,233,8,273,289,,"Hard left Corbyn wins in landslide, goes on TV singing ""Red Flag"".    How did Cameron get this lucky?  Hope he doesn't slack off.",2011-12-31T18:29:24.000Z,,451586190,Rupert Murdoch,672794,125,6443,1714,rupertmurdoch,True
139,451586190,author_id: 451586190,conv_id: 641963768566689792,641963768566689792,2015-09-10T13:17:44.000Z,,641963768566689792,id: 641963768566689792,48,0,93,50,,"Jeb Bush's tax proposals substantive and attractive to all.  Others note and adopt or debate.  Growth only answer to jobs, stronger America.",2011-12-31T18:29:24.000Z,,451586190,Rupert Murdoch,672794,125,6443,1714,rupertmurdoch,True
140,451586190,author_id: 451586190,conv_id: 641594275059343360,641594275059343360,2015-09-09T12:49:30.000Z,,641594275059343360,id: 641594275059343360,88,2,59,82,,"Trump on O'Reilly less loud and some good answers.  Carson on M Kelly impressive, humble but tough. A real vision for a great America again!",2011-12-31T18:29:24.000Z,,451586190,Rupert Murdoch,672794,125,6443,1714,rupertmurdoch,True
141,451586190,author_id: 451586190,conv_id: 641592885448716288,641592885448716288,2015-09-09T12:43:58.000Z,,641592885448716288,id: 641592885448716288,38,0,71,53,,Terrific piece by Jeb Bush in today's WSJ on kicking economy into 4% growth.   Making more and better jobs for all.  2 years away.,2011-12-31T18:29:24.000Z,,451586190,Rupert Murdoch,672794,125,6443,1714,rupertmurdoch,True
142,451586190,author_id: 451586190,conv_id: 641408895865462784,641408895865462784,2015-09-09T00:32:52.000Z,,641408895865462784,id: 641408895865462784,45,0,108,108,,"Seems Corbyn slightly less certain of winning,   Cooper just might do it on preferences.",2011-12-31T18:29:24.000Z,,451586190,Rupert Murdoch,672794,125,6443,1714,rupertmurdoch,True
143,451586190,author_id: 451586190,conv_id: 640150436020785152,640150436020785152,2015-09-07T23:12:33.000Z,"[{'start': 0, 'end': 10, 'username': 'KurMudGin', 'id': '367366383'}]",641026296458399744,id: 641026296458399744,28,0,12,21,"[{'type': 'replied_to', 'id': '641025542846853122'}]","@KurMudGin Carson would make a great candidate.    Reading his wonderful book, One Nation.   Recommend to everybody.",2011-12-31T18:29:24.000Z,,451586190,Rupert Murdoch,672794,125,6443,1714,rupertmurdoch,True
144,451586190,author_id: 451586190,conv_id: 641013128269049856,641013128269049856,2015-09-07T23:09:10.000Z,"[{'start': 0, 'end': 10, 'username': 'CorinneAM', 'id': '16911584'}]",641025444079386625,id: 641025444079386625,9,0,10,9,"[{'type': 'replied_to', 'id': '641023130463563776'}]","@CorinneAM the Sun did not win it for David Cameron.  Nicola Sturgeon is ""wot won it""!",2011-12-31T18:29:24.000Z,,451586190,Rupert Murdoch,672794,125,6443,1714,rupertmurdoch,True
145,451586190,author_id: 451586190,conv_id: 641013128269049856,641013128269049856,2015-09-07T22:20:13.000Z,,641013128269049856,id: 641013128269049856,220,5,440,369,,Looks like Biden already running.  Very likely he wins nomination and be hard to beat.,2011-12-31T18:29:24.000Z,,451586190,Rupert Murdoch,672794,125,6443,1714,rupertmurdoch,True
146,451586190,author_id: 451586190,conv_id: 640972458657468416,640972458657468416,2015-09-07T22:06:24.000Z,"[{'start': 0, 'end': 8, 'username': 'nytimes', 'id': '807095'}]",641009647567142912,id: 641009647567142912,62,0,10,31,"[{'type': 'replied_to', 'id': '640972458657468416'}]",@nytimes,2011-12-31T18:29:24.000Z,,451586190,Rupert Murdoch,672794,125,6443,1714,rupertmurdoch,True
147,451586190,author_id: 451586190,conv_id: 640996317569941505,640996317569941505,2015-09-07T21:13:25.000Z,,640996317569941505,id: 640996317569941505,179,1,135,133,,"School choice vastly improves education, thus liberating all families and forever eliminates ""victim"" excuse.  Only one enemy teacher unions",2011-12-31T18:29:24.000Z,,451586190,Rupert Murdoch,672794,125,6443,1714,rupertmurdoch,True
148,451586190,author_id: 451586190,conv_id: 640971590168104960,640971590168104960,2015-09-07T19:35:10.000Z,,640971590168104960,id: 640971590168104960,35,0,26,10,,Choice schools ARE  state schools.   Just have to compete with each  other to live.,2011-12-31T18:29:24.000Z,,451586190,Rupert Murdoch,672794,125,6443,1714,rupertmurdoch,True
149,451586190,author_id: 451586190,conv_id: 640899028662812673,640899028662812673,2015-09-07T14:46:50.000Z,,640899028662812673,id: 640899028662812673,74,1,64,47,,"If Obama really looking for legacy, public school reform, ie CHOICE and CHARTERS, desperately needed nationwide, Empower all parents.",2011-12-31T18:29:24.000Z,,451586190,Rupert Murdoch,672794,125,6443,1714,rupertmurdoch,True
150,451586190,author_id: 451586190,conv_id: 640897909970575360,640897909970575360,2015-09-07T14:42:23.000Z,,640897909970575360,id: 640897909970575360,35,0,24,24,,"With 500 days left, POTUS right to look at criminal justice system.   Let's see what he proposes.",2011-12-31T18:29:24.000Z,,451586190,Rupert Murdoch,672794,125,6443,1714,rupertmurdoch,True
151,451586190,author_id: 451586190,conv_id: 640814551802490880,640814551802490880,2015-09-07T09:11:09.000Z,,640814551802490880,id: 640814551802490880,24,0,39,19,,"UK right to divert foreign aid money to refugee relief, although all numbers probably far too low.",2011-12-31T18:29:24.000Z,,451586190,Rupert Murdoch,672794,125,6443,1714,rupertmurdoch,True
152,451586190,author_id: 451586190,conv_id: 640657876864905216,640657876864905216,2015-09-06T22:48:35.000Z,,640657876864905216,id: 640657876864905216,180,8,389,167,,Big military brings peace through strength.,2011-12-31T18:29:24.000Z,,451586190,Rupert Murdoch,672794,125,6443,1714,rupertmurdoch,True
153,451586190,author_id: 451586190,conv_id: 640579999146344449,640579999146344449,2015-09-06T17:39:07.000Z,,640579999146344449,id: 640579999146344449,100,0,103,95,,"ISIS, Putin, Iran free to run amok while all western nations continue to wind down defense abilities.",2011-12-31T18:29:24.000Z,,451586190,Rupert Murdoch,672794,125,6443,1714,rupertmurdoch,True
154,451586190,author_id: 451586190,conv_id: 640383623443562496,640383623443562496,2015-09-06T04:38:48.000Z,"[{'start': 0, 'end': 12, 'username': 'DonaldTrump', 'id': '736267842681602048'}]",640383623443562496,id: 640383623443562496,17,0,11,15,,"@DonaldTrump right on some things, but should not boast of bankruptcies and stiffing creditors.",2011-12-31T18:29:24.000Z,,451586190,Rupert Murdoch,672794,125,6443,1714,rupertmurdoch,True
155,451586190,author_id: 451586190,conv_id: 640382478176292864,640382478176292864,2015-09-06T04:34:15.000Z,,640382478176292864,id: 640382478176292864,114,1,101,92,,"Most of Syrian refugees to Europe are educated and skilled.  EU can, but won't, show it is real and welcome this first group.",2011-12-31T18:29:24.000Z,,451586190,Rupert Murdoch,672794,125,6443,1714,rupertmurdoch,True
156,451586190,author_id: 451586190,conv_id: 640381168223784960,640381168223784960,2015-09-06T04:29:02.000Z,,640381168223784960,id: 640381168223784960,63,2,51,81,,Can You Trump Donald Trump on Foreign Policy? I got 6 out of 6 on this quiz http://t.co/KMILGkxUay,2011-12-31T18:29:24.000Z,,451586190,Rupert Murdoch,672794,125,6443,1714,rupertmurdoch,True
157,451586190,author_id: 451586190,conv_id: 640152484866977792,640152484866977792,2015-09-05T13:20:20.000Z,,640152484866977792,id: 640152484866977792,124,1,189,151,,"2 stories.  Carson, Detroit ghetto to brilliant neurosurgeon.
Obama white upbringing to community organizer.  
Sincere men, different values",2011-12-31T18:29:24.000Z,,451586190,Rupert Murdoch,672794,125,6443,1714,rupertmurdoch,True
158,451586190,author_id: 451586190,conv_id: 640150436020785152,640150436020785152,2015-09-05T13:12:12.000Z,,640150436020785152,id: 640150436020785152,174,0,91,191,,"Ben Carson polls improving every week.  Maybe the one to beat.  Irreproachable on background, achievements, character, vision.",2011-12-31T18:29:24.000Z,,451586190,Rupert Murdoch,672794,125,6443,1714,rupertmurdoch,True
159,451586190,author_id: 451586190,conv_id: 640149729171472384,640149729171472384,2015-09-05T13:09:23.000Z,,640149729171472384,id: 640149729171472384,22,0,35,27,,Varied European responses pathetic in face of great outpouring of public sympathy.   Also consequences coming for US.,2011-12-31T18:29:24.000Z,,451586190,Rupert Murdoch,672794,125,6443,1714,rupertmurdoch,True
160,451586190,author_id: 451586190,conv_id: 640148766981394432,640148766981394432,2015-09-05T13:05:34.000Z,,640148766981394432,id: 640148766981394432,44,0,50,26,,Back in U.S. after perfect break in far north Aust.   Month's biggest story ME refugee flood to Europe as anarchy follows US retreat,2011-12-31T18:29:24.000Z,,451586190,Rupert Murdoch,672794,125,6443,1714,rupertmurdoch,True
161,451586190,author_id: 451586190,conv_id: 639410678076428288,639410678076428288,2015-09-03T12:12:39.000Z,,639410678076428288,id: 639410678076428288,92,1,554,179,,"In spite of some blind spots, Abbott far the best alternative.   Principled and a fighter.",2011-12-31T18:29:24.000Z,,451586190,Rupert Murdoch,672794,125,6443,1714,rupertmurdoch,True
162,451586190,author_id: 451586190,conv_id: 639409927577075712,639409927577075712,2015-09-03T12:09:41.000Z,,639409927577075712,id: 639409927577075712,34,1,130,51,,"Only hope is new poll with govt of all the talents ready to work together with clear mandate for reform, bringing in new, young able people",2011-12-31T18:29:24.000Z,,451586190,Rupert Murdoch,672794,125,6443,1714,rupertmurdoch,True
163,451586190,author_id: 451586190,conv_id: 639408093735030784,639408093735030784,2015-09-03T12:02:23.000Z,,639408093735030784,id: 639408093735030784,43,0,59,29,,"One over riding social issue dominating conversation everywhere is alarm at spread of new deadly drugs, especially in rural communities.",2011-12-31T18:29:24.000Z,,451586190,Rupert Murdoch,672794,125,6443,1714,rupertmurdoch,True
164,451586190,author_id: 451586190,conv_id: 639407492091539456,639407492091539456,2015-09-03T12:00:00.000Z,,639407492091539456,id: 639407492091539456,36,1,37,45,,"Great progress made with Asia trade agreements by Minister Robb. Now need close China FTA.  Big chance for food, healthcare, jobs.",2011-12-31T18:29:24.000Z,,451586190,Rupert Murdoch,672794,125,6443,1714,rupertmurdoch,True
165,451586190,author_id: 451586190,conv_id: 639406739872481280,639406739872481280,2015-09-03T11:57:01.000Z,,639406739872481280,id: 639406739872481280,62,1,170,81,,Seems capture of federal Labor leadership by corrupt violent unions. Govt must push on with reforms for sake of all sides or hold snap poll.,2011-12-31T18:29:24.000Z,,451586190,Rupert Murdoch,672794,125,6443,1714,rupertmurdoch,True
166,451586190,author_id: 451586190,conv_id: 639405851816685568,639405851816685568,2015-09-03T11:53:29.000Z,,639405851816685568,id: 639405851816685568,23,0,30,36,,Meanwhile world commodity prices in long term collapse as outrageous construction costs kill infrastructure projects.,2011-12-31T18:29:24.000Z,,451586190,Rupert Murdoch,672794,125,6443,1714,rupertmurdoch,True
167,451586190,author_id: 451586190,conv_id: 639405066433220608,639405066433220608,2015-09-03T11:50:22.000Z,,639405066433220608,id: 639405066433220608,52,1,173,70,,"Extreme greenies, increasing in support hold balance. Against growth and subsequent jobs.   Seem beyond reason.",2011-12-31T18:29:24.000Z,,451586190,Rupert Murdoch,672794,125,6443,1714,rupertmurdoch,True
168,451586190,author_id: 451586190,conv_id: 639404373911670784,639404373911670784,2015-09-03T11:47:36.000Z,,639404373911670784,id: 639404373911670784,47,0,95,42,,Country almost ungovernable with any Senate majority impossible for either side to execute. Bilateral agreement to change urgent if unlikely,2011-12-31T18:29:24.000Z,,451586190,Rupert Murdoch,672794,125,6443,1714,rupertmurdoch,True
169,451586190,author_id: 451586190,conv_id: 639401663711813632,639401663711813632,2015-09-03T11:36:50.000Z,,639401663711813632,id: 639401663711813632,66,1,208,65,,"Great month in Oz - beautiful country, gtreAt people but with large problems.",2011-12-31T18:29:24.000Z,,451586190,Rupert Murdoch,672794,125,6443,1714,rupertmurdoch,True
170,451586190,author_id: 451586190,conv_id: 639023743822659584,639023743822659584,2015-09-02T10:35:07.000Z,,639023743822659584,id: 639023743822659584,114,1,62,107,,Latest Iowa poll has Carson level with Trump.  America land of hope versus fear.,2011-12-31T18:29:24.000Z,,451586190,Rupert Murdoch,672794,125,6443,1714,rupertmurdoch,True
171,451586190,author_id: 451586190,conv_id: 638184796015865856,638184796015865856,2015-08-31T03:01:26.000Z,,638184796015865856,id: 638184796015865856,223,1,63,174,,Ben Carson polling.   So character DOES count.  His life story should make every American optimistic.,2011-12-31T18:29:24.000Z,,451586190,Rupert Murdoch,672794,125,6443,1714,rupertmurdoch,True
172,451586190,author_id: 451586190,conv_id: 638140637544509440,638140637544509440,2015-08-31T00:05:58.000Z,,638140637544509440,id: 638140637544509440,58,0,39,32,,"Iowa poll okay for Trump, if right, but terrific for Ben Carson, also topping favorability by very big margin.",2011-12-31T18:29:24.000Z,,451586190,Rupert Murdoch,672794,125,6443,1714,rupertmurdoch,True
173,451586190,author_id: 451586190,conv_id: 637931804025073664,637931804025073664,2015-08-30T10:16:08.000Z,,637931804025073664,id: 637931804025073664,51,1,37,40,,"This one, new technologies &amp; smart phones/internet will accelerate wealth creation, nearly abolishing poverty and disease.  With some bumps.",2011-12-31T18:29:24.000Z,,451586190,Rupert Murdoch,672794,125,6443,1714,rupertmurdoch,True
174,451586190,author_id: 451586190,conv_id: 637930597575467008,637930597575467008,2015-08-30T10:11:21.000Z,,637930597575467008,id: 637930597575467008,38,0,31,34,,"Ridley shows global GDP grew 5 times in 19th and 20th centuries, allowing billions to escape poverty thru inventions &amp; fossil fuels.",2011-12-31T18:29:24.000Z,,451586190,Rupert Murdoch,672794,125,6443,1714,rupertmurdoch,True
175,451586190,author_id: 451586190,conv_id: 637929866239832064,637929866239832064,2015-08-30T10:08:26.000Z,,637929866239832064,id: 637929866239832064,90,0,24,35,,Re-read Matt Ridley's great book The Rational Optimist after 5 years. As stimulating as ever.  Hope next book coming soon.,2011-12-31T18:29:24.000Z,,451586190,Rupert Murdoch,672794,125,6443,1714,rupertmurdoch,True
176,451586190,author_id: 451586190,conv_id: 637760772106354689,637760772106354689,2015-08-29T22:56:31.000Z,,637760772106354689,id: 637760772106354689,144,3,71,93,,"Most, or all, western societies are based on Judeo-Christian values, even if currently less church going. Why deny?  We should celebrate.",2011-12-31T18:29:24.000Z,,451586190,Rupert Murdoch,672794,125,6443,1714,rupertmurdoch,True
177,451586190,author_id: 451586190,conv_id: 637751005438808064,637751005438808064,2015-08-29T22:17:43.000Z,,637751005438808064,id: 637751005438808064,167,3,89,157,,"Countless Middle Eastern Christians facing slaughter.  More than time for US, others to step up in face  of genocide and offer shelter.",2011-12-31T18:29:24.000Z,,451586190,Rupert Murdoch,672794,125,6443,1714,rupertmurdoch,True
178,451586190,author_id: 451586190,conv_id: 637748983276834816,637748983276834816,2015-08-29T22:09:41.000Z,,637748983276834816,id: 637748983276834816,44,1,21,23,,World Heritage Fund and Queensland government doing great job preserving rain forests and Great Barrier Reef.,2011-12-31T18:29:24.000Z,,451586190,Rupert Murdoch,672794,125,6443,1714,rupertmurdoch,True
179,451586190,author_id: 451586190,conv_id: 637570131623723008,637570131623723008,2015-08-29T10:18:59.000Z,,637570131623723008,id: 637570131623723008,55,3,132,49,,"Just for the record, SkyNewsAust is totally independent of News Corp.",2011-12-31T18:29:24.000Z,,451586190,Rupert Murdoch,672794,125,6443,1714,rupertmurdoch,True
180,451586190,author_id: 451586190,conv_id: 637073250930003968,637073250930003968,2015-08-28T01:24:33.000Z,"[{'start': 5, 'end': 20, 'username': 'Peggynoonannyc', 'id': '35474809'}]",637073250930003968,id: 637073250930003968,34,0,28,24,,"Read @peggynoonannyc in wsj online re Trump appeal.    No wonder, US media real incomes less than 10 yrs ago. Not migrants, but poor govts.",2011-12-31T18:29:24.000Z,,451586190,Rupert Murdoch,672794,125,6443,1714,rupertmurdoch,True
181,451586190,author_id: 451586190,conv_id: 637071845154516992,637071845154516992,2015-08-28T01:18:58.000Z,,637071845154516992,id: 637071845154516992,26,0,38,28,,"Trump's loud anti-establishment line overwhelming all except more measured #2 Carson. Rubio level with Bush, Cruz in low third place.",2011-12-31T18:29:24.000Z,,451586190,Rupert Murdoch,672794,125,6443,1714,rupertmurdoch,True
182,451586190,author_id: 451586190,conv_id: 636740873401700352,636740873401700352,2015-08-27T03:23:48.000Z,,636740873401700352,id: 636740873401700352,81,25,188,98,,A climate change skeptic not a denier. Sept UN meets in NY with endless alarmist nonsense from u know whom!  Pessimists always seen as sages,2011-12-31T18:29:24.000Z,,451586190,Rupert Murdoch,672794,125,6443,1714,rupertmurdoch,True
183,451586190,author_id: 451586190,conv_id: 636739373183037440,636739373183037440,2015-08-27T03:17:51.000Z,,636739373183037440,id: 636739373183037440,51,2,81,56,,In last 3 decades carbon in US air has reduced by nearly 50%.,2011-12-31T18:29:24.000Z,,451586190,Rupert Murdoch,672794,125,6443,1714,rupertmurdoch,True
184,451586190,author_id: 451586190,conv_id: 636733849813147648,636733849813147648,2015-08-27T02:55:54.000Z,,636733849813147648,id: 636733849813147648,65,1,52,59,,"Global growth dangerously low. Blame politicians' layers of regulations . Too hard.  US federal regs 170,000 pages before states   &amp; cities.",2011-12-31T18:29:24.000Z,,451586190,Rupert Murdoch,672794,125,6443,1714,rupertmurdoch,True
185,451586190,author_id: 451586190,conv_id: 636732825773850625,636732825773850625,2015-08-27T02:51:50.000Z,,636732825773850625,id: 636732825773850625,117,0,33,130,,So markets bounce. Too much cash looking for a home.  Far too few prepared to invest and employ.  Small business the only hope for growth.,2011-12-31T18:29:24.000Z,,451586190,Rupert Murdoch,672794,125,6443,1714,rupertmurdoch,True
186,451586190,author_id: 451586190,conv_id: 636449378979446784,636449378979446784,2015-08-26T08:05:31.000Z,,636449378979446784,id: 636449378979446784,41,0,53,18,,"NBN may turn out ok, but nice if any govt. one day runs a project at original estimate.",2011-12-31T18:29:24.000Z,,451586190,Rupert Murdoch,672794,125,6443,1714,rupertmurdoch,True
187,451586190,author_id: 451586190,conv_id: 636390707889053696,636390707889053696,2015-08-26T04:12:22.000Z,,636390707889053696,id: 636390707889053696,60,1,26,74,,"Are asset values still too high?     By historic standards they are, and with global growth low everywhere, plenty to worry about.",2011-12-31T18:29:24.000Z,,451586190,Rupert Murdoch,672794,125,6443,1714,rupertmurdoch,True
188,451586190,author_id: 451586190,conv_id: 636075308567891968,636075308567891968,2015-08-25T07:19:05.000Z,,636075308567891968,id: 636075308567891968,63,27,317,104,,To the naked eye reef looks fully as good as it did 50 years ago.,2011-12-31T18:29:24.000Z,,451586190,Rupert Murdoch,672794,125,6443,1714,rupertmurdoch,True
189,451586190,author_id: 451586190,conv_id: 636074200059527168,636074200059527168,2015-08-25T07:14:41.000Z,,636074200059527168,id: 636074200059527168,76,7,199,100,,"Tony Abbott always the happy warrior.  Win or lose, usually win, and clever fighter.",2011-12-31T18:29:24.000Z,,451586190,Rupert Murdoch,672794,125,6443,1714,rupertmurdoch,True
190,451586190,author_id: 451586190,conv_id: 636073539704102912,636073539704102912,2015-08-25T07:12:04.000Z,,636073539704102912,id: 636073539704102912,34,0,16,36,,"Greg Sheridan's ""When we were young and foolish"" great yarn about youthful friends, Abbott, Turnbull, Rudd and Carr. Irish Catholic Sydney.",2011-12-31T18:29:24.000Z,,451586190,Rupert Murdoch,672794,125,6443,1714,rupertmurdoch,True
191,451586190,author_id: 451586190,conv_id: 636070648511660032,636070648511660032,2015-08-25T07:00:34.000Z,,636070648511660032,id: 636070648511660032,28,0,75,36,,"of course we should do everything to preserve the reef, but first let's get all the scientific facts in a row if greens can agree anything.",2011-12-31T18:29:24.000Z,,451586190,Rupert Murdoch,672794,125,6443,1714,rupertmurdoch,True
192,451586190,author_id: 451586190,conv_id: 636028412281364480,636028412281364480,2015-08-25T04:12:44.000Z,,636028412281364480,id: 636028412281364480,75,0,55,40,,Australia's Great Barrier Reef truly one of the world's great wonders.  Never more beautiful than today teeming with multi-coloured fish.,2011-12-31T18:29:24.000Z,,451586190,Rupert Murdoch,672794,125,6443,1714,rupertmurdoch,True
193,451586190,author_id: 451586190,conv_id: 635057089841373185,635057089841373185,2015-08-25T04:10:06.000Z,,636027749317124096,id: 636027749317124096,2,0,6,0,"[{'type': 'replied_to', 'id': '636014401561169920'}]","@frscmc  Yes, Free markets with a moral foundation vital.   And usually there.",2011-12-31T18:29:24.000Z,,451586190,Rupert Murdoch,672794,125,6443,1714,rupertmurdoch,True
194,451586190,author_id: 451586190,conv_id: 635948780806909952,635948780806909952,2015-08-24T22:56:19.000Z,,635948780806909952,id: 635948780806909952,37,2,124,48,,"NBN would be great for Foxtel, but at $56bn can nation afford it?  That's $2700 per man, woman and child. Who's in charge?",2011-12-31T18:29:24.000Z,,451586190,Rupert Murdoch,672794,125,6443,1714,rupertmurdoch,True
195,451586190,author_id: 451586190,conv_id: 635697654622781440,635697654622781440,2015-08-24T06:18:26.000Z,,635697654622781440,id: 635697654622781440,117,0,102,54,,Far away from world's troubles here on Great Barrier Reef swimming and reading.  Seems irresponsible.,2011-12-31T18:29:24.000Z,,451586190,Rupert Murdoch,672794,125,6443,1714,rupertmurdoch,True
196,451586190,author_id: 451586190,conv_id: 635657520393097216,635657520393097216,2015-08-24T03:38:57.000Z,,635657520393097216,id: 635657520393097216,52,3,48,51,,I did not say I would vote for him!    Just a friend I admire.,2011-12-31T18:29:24.000Z,,451586190,Rupert Murdoch,672794,125,6443,1714,rupertmurdoch,True
197,451586190,author_id: 451586190,conv_id: 635657087419330564,635657087419330564,2015-08-24T03:37:14.000Z,"[{'start': 3, 'end': 17, 'username': 'VJMachiavelli', 'id': '1213237104'}, {'start': 112, 'end': 126, 'username': 'rupertmurdoch', 'id': '451586190'}]",635657087419330564,id: 635657087419330564,0,0,0,34,"[{'type': 'retweeted', 'id': '635655661183979521'}]","RT @VJMachiavelli: Rupert Murdoch wants Michael Bloomberg to run for president http://t.co/i5nSdScxfv 

Memo to @rupertmurdoch WRONG &amp; it's",2011-12-31T18:29:24.000Z,,451586190,Rupert Murdoch,672794,125,6443,1714,rupertmurdoch,True
198,451586190,author_id: 451586190,conv_id: 635628620816490496,635628620816490496,2015-08-24T01:44:07.000Z,,635628620816490496,id: 635628620816490496,58,1,35,39,,"Agree much about Bloomberg, nannystate, etc, but still a great philanthropic executive who, with Guiliani, made NY the greatest.",2011-12-31T18:29:24.000Z,,451586190,Rupert Murdoch,672794,125,6443,1714,rupertmurdoch,True
199,451586190,author_id: 451586190,conv_id: 635621842477318144,635621842477318144,2015-08-24T01:17:11.000Z,,635621842477318144,id: 635621842477318144,547,11,252,511,,"With Trump becoming very serious candidate, it's time for next billionaire candidate, Mike Bloomberg to step into ring. Greatest mayor.",2011-12-31T18:29:24.000Z,,451586190,Rupert Murdoch,672794,125,6443,1714,rupertmurdoch,True
200,451586190,author_id: 451586190,conv_id: 635600829165211648,635600829165211648,2015-08-23T23:53:41.000Z,,635600829165211648,id: 635600829165211648,120,1,65,83,,"Smart phones give billions universal access to knowledge across national borders, hopefully bringing transparency everywhere.",2011-12-31T18:29:24.000Z,,451586190,Rupert Murdoch,672794,125,6443,1714,rupertmurdoch,True
