,author_id,author_id_new,conv_id_new,conversation_id,created_at,entities.mentions,id,id_new,public_metrics.like_count,public_metrics.quote_count,public_metrics.reply_count,public_metrics.retweet_count,referenced_tweets,text,users.created_at,users.description,users.id,users.name,users.public_metrics.followers_count,users.public_metrics.following_count,users.public_metrics.listed_count,users.public_metrics.tweet_count,users.username,users.verified
459,451586190,author_id: 451586190,conv_id: 536643559764819968,536643559764819968,2014-11-23T22:18:50.000Z,"[{'start': 0, 'end': 14, 'username': 'Mysterion3000', 'id': '546835943'}]",536645071916240896,id: 536645071916240896,3,0,2,1,"[{'type': 'replied_to', 'id': '536644009587126272'}]",@Mysterion3000  UK more dangerous.  Agreed.,2011-12-31T18:29:24.000Z,,451586190,Rupert Murdoch,672794,125,6443,1714,rupertmurdoch,True
460,451586190,author_id: 451586190,conv_id: 536643559764819968,536643559764819968,2014-11-23T22:12:49.000Z,,536643559764819968,id: 536643559764819968,30,0,57,42,,Everybody seems to be calling for perfect Southern border controls Almost impossible. What about Canadian border and returning ISIS killers?,2011-12-31T18:29:24.000Z,,451586190,Rupert Murdoch,672794,125,6443,1714,rupertmurdoch,True
461,451586190,author_id: 451586190,conv_id: 536640294180372483,536640294180372483,2014-11-23T22:01:49.000Z,"[{'start': 0, 'end': 14, 'username': 'rupertmurdoch', 'id': '451586190'}]",536640789229871105,id: 536640789229871105,13,0,21,8,"[{'type': 'replied_to', 'id': '536640294180372483'}]","@rupertmurdoch  Gruber, not Bruner!  Sorry.",2011-12-31T18:29:24.000Z,,451586190,Rupert Murdoch,672794,125,6443,1714,rupertmurdoch,True
462,451586190,author_id: 451586190,conv_id: 536640294180372483,536640294180372483,2014-11-23T21:59:51.000Z,,536640294180372483,id: 536640294180372483,30,0,25,23,,"Bruner, ACA architect, boasts US people dumb, so way understated price.  WH, Reid,Pelosi typical liberal arrogance.  Same in UK.",2011-12-31T18:29:24.000Z,,451586190,Rupert Murdoch,672794,125,6443,1714,rupertmurdoch,True
463,451586190,author_id: 451586190,conv_id: 536638728262131712,536638728262131712,2014-11-23T21:53:37.000Z,,536638728262131712,id: 536638728262131712,33,0,36,26,,"Obama's immigration moves mild, but new Congress would have gone further. Hope they still do.  O playing politics, oversteps constitution.",2011-12-31T18:29:24.000Z,,451586190,Rupert Murdoch,672794,125,6443,1714,rupertmurdoch,True
464,451586190,author_id: 451586190,conv_id: 536637462551207936,536637462551207936,2014-11-23T21:48:35.000Z,,536637462551207936,id: 536637462551207936,29,0,27,47,,"NY boom may hit a wall with new mayor and far left council. Hope I am wrong, but higher taxes, war on charter schools all developing.",2011-12-31T18:29:24.000Z,,451586190,Rupert Murdoch,672794,125,6443,1714,rupertmurdoch,True
465,451586190,author_id: 451586190,conv_id: 536636564865290241,536636564865290241,2014-11-23T21:45:01.000Z,,536636564865290241,id: 536636564865290241,32,0,28,47,,"NY City Bloomberg boom continues with amazing high-rise apartments all over Manhattan fuelled by Russian oligarchs, Chinese, easy money, etc",2011-12-31T18:29:24.000Z,,451586190,Rupert Murdoch,672794,125,6443,1714,rupertmurdoch,True
466,451586190,author_id: 451586190,conv_id: 536544848468533248,536544848468533248,2014-11-23T15:40:35.000Z,,536544848468533248,id: 536544848468533248,25,0,19,28,,"Great WSJ yeasty Historian Andrew Roberts on M.E. Holman Jenkins on airbag politics Review front on robotic skills making us dumber, more!",2011-12-31T18:29:24.000Z,,451586190,Rupert Murdoch,672794,125,6443,1714,rupertmurdoch,True
467,451586190,author_id: 451586190,conv_id: 531467341960601600,531467341960601600,2014-11-09T15:24:23.000Z,,531467341960601600,id: 531467341960601600,29,0,80,73,,"NY State, outside city, in miserable condition.   Big test for Cuomo who  could transform vast area with fracking, , ignore ignorant Greens.",2011-12-31T18:29:24.000Z,,451586190,Rupert Murdoch,672794,125,6443,1714,rupertmurdoch,True
468,451586190,author_id: 451586190,conv_id: 531465556508299264,531465556508299264,2014-11-09T15:17:17.000Z,,531465556508299264,id: 531465556508299264,27,0,36,48,,Seems Obama made good choice for new AG. Reputation for fairness and strict legality.,2011-12-31T18:29:24.000Z,,451586190,Rupert Murdoch,672794,125,6443,1714,rupertmurdoch,True
469,451586190,author_id: 451586190,conv_id: 530377708203945985,530377708203945985,2014-11-06T15:14:34.000Z,,530377708203945985,id: 530377708203945985,159,23,35,99,,"Amazing dance performance by Lil Buck,soon to be big star http://t.co/rwWJ8ZzCyg",2011-12-31T18:29:24.000Z,,451586190,Rupert Murdoch,672794,125,6443,1714,rupertmurdoch,True
470,451586190,author_id: 451586190,conv_id: 530373932843827200,530373932843827200,2014-11-06T14:59:34.000Z,,530373932843827200,id: 530373932843827200,17,0,4,11,,Great innovators celebration honors last night by WSJ Mag editor Kristina O'Neil.  Everybody at WSJ proud.,2011-12-31T18:29:24.000Z,,451586190,Rupert Murdoch,672794,125,6443,1714,rupertmurdoch,True
471,451586190,author_id: 451586190,conv_id: 529766588116140032,529766588116140032,2014-11-04T22:46:11.000Z,,529766588116140032,id: 529766588116140032,16,0,18,23,,Big night for US.  Senate control almost certain to change. Question is tight or big majority - say six?,2011-12-31T18:29:24.000Z,,451586190,Rupert Murdoch,672794,125,6443,1714,rupertmurdoch,True
472,451586190,author_id: 451586190,conv_id: 529765950586122240,529765950586122240,2014-11-04T22:43:39.000Z,,529765950586122240,id: 529765950586122240,49,0,31,54,,Huntsman jr says Tea Party damages Republicans. No big tent?  This elitist rubbish is pure snobbery and self- defeating.,2011-12-31T18:29:24.000Z,,451586190,Rupert Murdoch,672794,125,6443,1714,rupertmurdoch,True
473,451586190,author_id: 451586190,conv_id: 529004877419384832,529004877419384832,2014-11-02T20:19:25.000Z,,529004877419384832,id: 529004877419384832,30,0,57,38,,Salmond has not gone away. Bet Westminster tempts early return. And Milliband comes from famous Marxist family. No need to hide that.,2011-12-31T18:29:24.000Z,,451586190,Rupert Murdoch,672794,125,6443,1714,rupertmurdoch,True
474,451586190,author_id: 451586190,conv_id: 529002850245173248,529002850245173248,2014-11-02T20:11:22.000Z,,529002850245173248,id: 529002850245173248,42,0,38,85,,"Thank God - and@Gordon Brown- UK not in Euro which bringing Europe to breaking point, deflation, huge youth unemployment , etc",2011-12-31T18:29:24.000Z,,451586190,Rupert Murdoch,672794,125,6443,1714,rupertmurdoch,True
475,451586190,author_id: 451586190,conv_id: 529001599235284992,529001599235284992,2014-11-02T20:06:24.000Z,,529001599235284992,id: 529001599235284992,72,0,136,128,,In UK only Salmond and Farage connecting with people. Big Tory asset Marxist Milliband trusted even less than opportunist Cameron.,2011-12-31T18:29:24.000Z,,451586190,Rupert Murdoch,672794,125,6443,1714,rupertmurdoch,True
476,451586190,author_id: 451586190,conv_id: 528964085661315073,528964085661315073,2014-11-02T17:37:20.000Z,,528964085661315073,id: 528964085661315073,29,0,22,31,,Sunday NY Post shows police chief Bratton in impossible spot with mayor deBlasio bashing depressed cops full time.Danger ahead for NY.,2011-12-31T18:29:24.000Z,,451586190,Rupert Murdoch,672794,125,6443,1714,rupertmurdoch,True
477,451586190,author_id: 451586190,conv_id: 528960454564270080,528960454564270080,2014-11-02T17:22:54.000Z,,528960454564270080,id: 528960454564270080,26,0,10,10,,All Souls' Day. Timothy Cardinal Dolan speaks beautifully.,2011-12-31T18:29:24.000Z,,451586190,Rupert Murdoch,672794,125,6443,1714,rupertmurdoch,True
478,451586190,author_id: 451586190,conv_id: 528960055623041024,528960055623041024,2014-11-02T17:21:19.000Z,,528960055623041024,id: 528960055623041024,35,0,7,18,,All New Yorkers watching amazing athletes run Marathon in tough weather.  Inspiring. Even tennis champ Wozniacki runs tenth n fast time.,2011-12-31T18:29:24.000Z,,451586190,Rupert Murdoch,672794,125,6443,1714,rupertmurdoch,True
479,451586190,author_id: 451586190,conv_id: 528136819343233026,528136819343233026,2014-10-31T10:53:33.000Z,,528137695013257216,id: 528137695013257216,9,0,22,17,"[{'type': 'replied_to', 'id': '528136819343233026'}]",Wash Post shows 35 per cent registered Latinos under 30 leaning Republican.   Big change from Romney disaster.,2011-12-31T18:29:24.000Z,,451586190,Rupert Murdoch,672794,125,6443,1714,rupertmurdoch,True
480,451586190,author_id: 451586190,conv_id: 527927280107290624,527927280107290624,2014-10-30T20:57:26.000Z,"[{'start': 21, 'end': 32, 'username': 'JoelIKlein', 'id': '308149975'}]",527927280107290624,id: 527927280107290624,24,0,11,13,,Very proud of friend @JoelIKlein on his book Lessons of Hope. Relentless advocate for students and better schools http://t.co/JXfiEVUcS5,2011-12-31T18:29:24.000Z,,451586190,Rupert Murdoch,672794,125,6443,1714,rupertmurdoch,True
481,451586190,author_id: 451586190,conv_id: 527849288324620288,527849288324620288,2014-10-30T15:47:31.000Z,,527849288324620288,id: 527849288324620288,16,0,4,7,,Great WSJD Conference.  Congrats and many thanks to all staff and helpers led by Dorothea Herrey.   Enjoyed by all.,2011-12-31T18:29:24.000Z,,451586190,Rupert Murdoch,672794,125,6443,1714,rupertmurdoch,True
482,451586190,author_id: 451586190,conv_id: 527605153432866816,527605153432866816,2014-10-29T23:37:25.000Z,"[{'start': 87, 'end': 102, 'username': 'HillaryClinton', 'id': '1339835893'}]",527605153432866816,id: 527605153432866816,41,0,38,45,,"Elizabeth Warren right about middle class hardship, minority misery.
Real challenge to @HillaryClinton",2011-12-31T18:29:24.000Z,,451586190,Rupert Murdoch,672794,125,6443,1714,rupertmurdoch,True
483,451586190,author_id: 451586190,conv_id: 526900585011113984,526900585011113984,2014-10-28T00:57:43.000Z,,526900585011113984,id: 526900585011113984,128,4,93,145,,Trying out my new drone with Paul #WSJDLive http://t.co/o36DF1YVGC,2011-12-31T18:29:24.000Z,,451586190,Rupert Murdoch,672794,125,6443,1714,rupertmurdoch,True
484,451586190,author_id: 451586190,conv_id: 526453463648309248,526453463648309248,2014-10-26T19:21:01.000Z,,526453463648309248,id: 526453463648309248,74,0,58,169,,"Economist showing Europe heading for serious recession, euro currency a huge mistake.   UK lucky, but a political wreck.",2011-12-31T18:29:24.000Z,,451586190,Rupert Murdoch,672794,125,6443,1714,rupertmurdoch,True
485,451586190,author_id: 451586190,conv_id: 526449554850582528,526449554850582528,2014-10-26T19:13:41.000Z,"[{'start': 0, 'end': 10, 'username': 'POPSradio', 'id': '421642934'}]",526451620012642304,id: 526451620012642304,4,0,5,1,"[{'type': 'replied_to', 'id': '526449877694152704'}]","@POPSradio Republicans need forward looking agenda.  Agreed, although many have. Try Paul Ryan, Jeb Bush, Rand Paul.",2011-12-31T18:29:24.000Z,,451586190,Rupert Murdoch,672794,125,6443,1714,rupertmurdoch,True
486,451586190,author_id: 451586190,conv_id: 526449554850582528,526449554850582528,2014-10-26T19:05:29.000Z,,526449554850582528,id: 526449554850582528,28,0,43,22,,"Election polls mostly very close, but something very wrong if no Republican wave.",2011-12-31T18:29:24.000Z,,451586190,Rupert Murdoch,672794,125,6443,1714,rupertmurdoch,True
487,451586190,author_id: 451586190,conv_id: 526448933745475586,526448933745475586,2014-10-26T19:03:01.000Z,,526448933745475586,id: 526448933745475586,226,0,55,214,,"Quarantine for returning medicos obviously right, but they should be treated as selfless heroes, not roughly met at airports.",2011-12-31T18:29:24.000Z,,451586190,Rupert Murdoch,672794,125,6443,1714,rupertmurdoch,True
488,451586190,author_id: 451586190,conv_id: 525403723330506752,525403723330506752,2014-10-23T21:49:43.000Z,,525403723330506752,id: 525403723330506752,123,0,40,125,,"Pray for Doctor Craig Spencer, Ebola suspect.   Doctors Without Borders are today's greatest heroes.",2011-12-31T18:29:24.000Z,,451586190,Rupert Murdoch,672794,125,6443,1714,rupertmurdoch,True
489,451586190,author_id: 451586190,conv_id: 523842036047552512,523842036047552512,2014-10-19T14:24:08.000Z,,523842036047552512,id: 523842036047552512,17,0,21,22,,"Race to the bottom!  Multi-million $ effort by teachers to throw out many reforming governors after gaining control in NY, LA, and DC.",2011-12-31T18:29:24.000Z,,451586190,Rupert Murdoch,672794,125,6443,1714,rupertmurdoch,True
490,451586190,author_id: 451586190,conv_id: 523840407789404161,523840407789404161,2014-10-19T14:17:40.000Z,,523840407789404161,id: 523840407789404161,39,0,55,58,,"Huge percentage of African Americans now below poverty line.
Biggest disappointment of so-called ""recovery"".",2011-12-31T18:29:24.000Z,,451586190,Rupert Murdoch,672794,125,6443,1714,rupertmurdoch,True
491,451586190,author_id: 451586190,conv_id: 521454689443790848,521454689443790848,2014-10-13T00:17:40.000Z,,521454689443790848,id: 521454689443790848,215,0,61,117,,"Enjoying brilliant, often provocative, Peter Thiel book, Zero to One.
Will buy many and distribute to all senior  execs.",2011-12-31T18:29:24.000Z,,451586190,Rupert Murdoch,672794,125,6443,1714,rupertmurdoch,True
492,451586190,author_id: 451586190,conv_id: 521452445486956545,521452445486956545,2014-10-13T00:08:45.000Z,,521452445486956545,id: 521452445486956545,36,0,49,36,,"Clarifications, crazy tweeters. Editors make newspapers, not businessmen.  Court award of $ 800 m belongs to over 
100,000 Fox share holders",2011-12-31T18:29:24.000Z,,451586190,Rupert Murdoch,672794,125,6443,1714,rupertmurdoch,True
493,451586190,author_id: 451586190,conv_id: 521445970945384448,521445970945384448,2014-10-12T23:43:02.000Z,,521445970945384448,id: 521445970945384448,44,0,20,32,,"Endeavour and other spacecraft full of essential computer software.
Nothing to power of today's smartphone.  Luckily own beautiful
IPhone 6.",2011-12-31T18:29:24.000Z,,451586190,Rupert Murdoch,672794,125,6443,1714,rupertmurdoch,True
494,451586190,author_id: 451586190,conv_id: 521444679930228736,521444679930228736,2014-10-12T23:37:54.000Z,,521444679930228736,id: 521444679930228736,23,0,8,7,,Will return with more family whenever possible.   Philanthropists who made this possible deserve great thanks.,2011-12-31T18:29:24.000Z,,451586190,Rupert Murdoch,672794,125,6443,1714,rupertmurdoch,True
495,451586190,author_id: 451586190,conv_id: 521443419638358016,521443419638358016,2014-10-12T23:32:53.000Z,,521443419638358016,id: 521443419638358016,69,0,213,158,,"Proud to be an American. Just took son&amp;grandson to California science exhibition in LA fantastic show of spacecraft,other U.S. achievements",2011-12-31T18:29:24.000Z,,451586190,Rupert Murdoch,672794,125,6443,1714,rupertmurdoch,True
496,451586190,author_id: 451586190,conv_id: 520998347729932288,520998347729932288,2014-10-11T18:04:20.000Z,,520998347729932288,id: 520998347729932288,62,0,42,120,,"Oil down from $107 to $85 as US output rises, broke Nicaragua pumps every ounce possible, Iran increases, etc. Good as Russia gets hurt most",2011-12-31T18:29:24.000Z,,451586190,Rupert Murdoch,672794,125,6443,1714,rupertmurdoch,True
497,451586190,author_id: 451586190,conv_id: 520996576597004288,520996576597004288,2014-10-11T17:57:18.000Z,,520996576597004288,id: 520996576597004288,41,0,31,63,,"Trillions lost in  few weeks on oil, other commodities.   Tough, but good for lowering most costs for all, from families to factories.",2011-12-31T18:29:24.000Z,,451586190,Rupert Murdoch,672794,125,6443,1714,rupertmurdoch,True
498,451586190,author_id: 451586190,conv_id: 520995636917706752,520995636917706752,2014-10-11T17:53:34.000Z,,520995636917706752,id: 520995636917706752,43,0,32,53,,"Potential Ebola crisis needs immediate world-wide thorough precautions, not panic.",2011-12-31T18:29:24.000Z,,451586190,Rupert Murdoch,672794,125,6443,1714,rupertmurdoch,True
499,451586190,author_id: 451586190,conv_id: 520973070073217024,520973070073217024,2014-10-11T16:23:53.000Z,,520973070073217024,id: 520973070073217024,114,0,103,125,,Almost unbelievable US treating Qatar as ally when they financing most of our enemies.,2011-12-31T18:29:24.000Z,,451586190,Rupert Murdoch,672794,125,6443,1714,rupertmurdoch,True
0,451586190,author_id: 451586190,conv_id: 519657940320387073,519657940320387073,2014-10-08T01:18:02.000Z,,519657940320387073,id: 519657940320387073,163,0,156,94,,"Today Fox News' 18 th birthday!  Last week No I cable channel, including entertainment, Great achievement by Roger Ailes and wonderful team.",2011-12-31T18:29:24.000Z,,451586190,Rupert Murdoch,672794,125,6443,1714,rupertmurdoch,True
1,451586190,author_id: 451586190,conv_id: 518862441388969987,518862441388969987,2014-10-05T20:37:00.000Z,,518862441388969987,id: 518862441388969987,48,0,37,68,,News journals can prosper and  live with smart use of digital. Some already doing brilliantly in different countries.,2011-12-31T18:29:24.000Z,,451586190,Rupert Murdoch,672794,125,6443,1714,rupertmurdoch,True
2,451586190,author_id: 451586190,conv_id: 518861645393977344,518861645393977344,2014-10-05T20:33:50.000Z,,518861645393977344,id: 518861645393977344,41,0,54,113,,Newspapers suffered mor from radio (60 yrs ago) and tv (30 yrs) than Internet today. What happened to evening papers before dial arrived?,2011-12-31T18:29:24.000Z,,451586190,Rupert Murdoch,672794,125,6443,1714,rupertmurdoch,True
3,451586190,author_id: 451586190,conv_id: 518460721051738113,518460721051738113,2014-10-04T18:00:43.000Z,,518460721051738113,id: 518460721051738113,41,0,88,43,,"Too early to be sure, but November election shaping up as a Republican wave.  Could lead to immigration reform and some economic progress.",2011-12-31T18:29:24.000Z,,451586190,Rupert Murdoch,672794,125,6443,1714,rupertmurdoch,True
4,451586190,author_id: 451586190,conv_id: 518459518876135424,518459518876135424,2014-10-04T17:55:56.000Z,,518459518876135424,id: 518459518876135424,33,0,29,50,,NY mayor deBlasio' tax and regulations will soon stop Bloomberg's progressive momentum.  Tragic for world's greatest city.,2011-12-31T18:29:24.000Z,,451586190,Rupert Murdoch,672794,125,6443,1714,rupertmurdoch,True
5,451586190,author_id: 451586190,conv_id: 516335283022082048,516335283022082048,2014-09-28T21:14:59.000Z,,516335283022082048,id: 516335283022082048,56,0,50,22,,"Congrats to Fox folk on Gone Girl, coming this Friday.  Terrific reviews of brilliantly crafted suspense thriller. Opened NY Film Festival.",2011-12-31T18:29:24.000Z,,451586190,Rupert Murdoch,672794,125,6443,1714,rupertmurdoch,True
6,451586190,author_id: 451586190,conv_id: 516310977097506818,516310977097506818,2014-09-28T19:38:24.000Z,,516310977097506818,id: 516310977097506818,48,0,382,134,,"NO tax avoidance by News, Fox or any Murdochs in Australia.  Courts ruled, so move on!",2011-12-31T18:29:24.000Z,,451586190,Rupert Murdoch,672794,125,6443,1714,rupertmurdoch,True
7,451586190,author_id: 451586190,conv_id: 516291083379429377,516291083379429377,2014-09-28T18:19:21.000Z,,516291083379429377,id: 516291083379429377,32,0,32,43,,"US economy mixed at best, saved by massive shale gas finds, lower energy costs.   Look at Texas v. New York State.",2011-12-31T18:29:24.000Z,,451586190,Rupert Murdoch,672794,125,6443,1714,rupertmurdoch,True
8,451586190,author_id: 451586190,conv_id: 516290118303621123,516290118303621123,2014-09-28T18:15:31.000Z,,516290118303621123,id: 516290118303621123,101,0,197,204,,"Elites'policies crushing poor, printing money etc, uneconomic climate investments,all causing higher costs, more inequality. 
Backlash near",2011-12-31T18:29:24.000Z,,451586190,Rupert Murdoch,672794,125,6443,1714,rupertmurdoch,True
9,451586190,author_id: 451586190,conv_id: 516286778643607552,516286778643607552,2014-09-28T18:02:14.000Z,,516286778643607552,id: 516286778643607552,26,0,64,59,,"Brit Labour conference a real downer, Tories now shaping up for same.   Meanwhile UKIP surge likely guarantees Labour victory next May.",2011-12-31T18:29:24.000Z,,451586190,Rupert Murdoch,672794,125,6443,1714,rupertmurdoch,True
10,451586190,author_id: 451586190,conv_id: 513987997977829376,513987997977829376,2014-09-22T09:47:42.000Z,,513987997977829376,id: 513987997977829376,26,0,27,36,,"British Justice Secretary tells Scots ""get off my lawn"".  Will Cameron
now say the same thing to EU?  Needs to, to win coming election.",2011-12-31T18:29:24.000Z,,451586190,Rupert Murdoch,672794,125,6443,1714,rupertmurdoch,True
11,451586190,author_id: 451586190,conv_id: 513641882988318720,513641882988318720,2014-09-21T10:52:22.000Z,,513641882988318720,id: 513641882988318720,46,0,42,65,,"Most interesting week in British politics in memory.  Gordon Brown, a man reborn,most effective. Cameron's solo politics a knock-out.",2011-12-31T18:29:24.000Z,,451586190,Rupert Murdoch,672794,125,6443,1714,rupertmurdoch,True
12,451586190,author_id: 451586190,conv_id: 513252318490664960,513252318490664960,2014-09-20T09:04:23.000Z,,513252318490664960,id: 513252318490664960,30,0,28,38,,"Proposing Britain becomes a big Switzerland logical outcome of first promise to Scots, is pretty revolutionary. Many doubters, maybe delay.",2011-12-31T18:29:24.000Z,,451586190,Rupert Murdoch,672794,125,6443,1714,rupertmurdoch,True
13,451586190,author_id: 451586190,conv_id: 513251360113172480,513251360113172480,2014-09-20T09:00:34.000Z,,513251360113172480,id: 513251360113172480,26,0,17,46,,"Cameron's  promise of devolution, now for all parts of country, without consulting cabinet, clever politics, but divisions in all parties.",2011-12-31T18:29:24.000Z,,451586190,Rupert Murdoch,672794,125,6443,1714,rupertmurdoch,True
14,451586190,author_id: 451586190,conv_id: 513250450238627840,513250450238627840,2014-09-20T08:56:57.000Z,,513250450238627840,id: 513250450238627840,206,0,72,244,,Alex Salmond's sudden resignation makes him most honest politician in Britain.   Actually he seems to have changed country's future.,2011-12-31T18:29:24.000Z,,451586190,Rupert Murdoch,672794,125,6443,1714,rupertmurdoch,True
15,451586190,author_id: 451586190,conv_id: 512971497917673472,512971497917673472,2014-09-19T14:28:30.000Z,,512971497917673472,id: 512971497917673472,33,0,34,33,,Really proud of the whole team at Scottish Sun for superb coverage of referendum.   And grateful.,2011-12-31T18:29:24.000Z,,451586190,Rupert Murdoch,672794,125,6443,1714,rupertmurdoch,True
16,451586190,author_id: 451586190,conv_id: 512738517948964864,512738517948964864,2014-09-18T23:02:43.000Z,,512738517948964864,id: 512738517948964864,57,0,129,128,,Exit polls sound very ominous for YES.  Now everybody on both sides must ensure Cameron and Milliband keep heir promises and not weasel out.,2011-12-31T18:29:24.000Z,,451586190,Rupert Murdoch,672794,125,6443,1714,rupertmurdoch,True
17,451586190,author_id: 451586190,conv_id: 512553024041287681,512553024041287681,2014-09-18T10:45:38.000Z,,512553024041287681,id: 512553024041287681,68,0,44,110,,"Nonsense reports alleging violence in Scotland, surprisingly good mannered crowds both sides. May change tonight with pubs open all night!",2011-12-31T18:29:24.000Z,,451586190,Rupert Murdoch,672794,125,6443,1714,rupertmurdoch,True
18,451586190,author_id: 451586190,conv_id: 512498467928014848,512498467928014848,2014-09-18T07:08:51.000Z,,512498467928014848,id: 512498467928014848,92,0,69,247,,"Scotland now voting.  Nobody can be sure of outcome, but Yes organisation likely to make it very close.  Either way, UK changes forever.",2011-12-31T18:29:24.000Z,,451586190,Rupert Murdoch,672794,125,6443,1714,rupertmurdoch,True
19,451586190,author_id: 451586190,conv_id: 512483185557798912,512483185557798912,2014-09-18T06:08:07.000Z,,512483185557798912,id: 512483185557798912,19,0,34,38,,Huge AUST surprise anti-terrorist raids netted many suspects. Also seems $9m stolen and sent to ISIS.,2011-12-31T18:29:24.000Z,,451586190,Rupert Murdoch,672794,125,6443,1714,rupertmurdoch,True
20,451586190,author_id: 451586190,conv_id: 512230041993084928,512230041993084928,2014-09-17T13:22:13.000Z,,512230041993084928,id: 512230041993084928,105,0,36,50,,Just saw the hilarious Simpsons short video on YouTube. Brilliant fun.,2011-12-31T18:29:24.000Z,,451586190,Rupert Murdoch,672794,125,6443,1714,rupertmurdoch,True
21,451586190,author_id: 451586190,conv_id: 511473573115228160,511473573115228160,2014-09-15T11:16:17.000Z,,511473573115228160,id: 511473573115228160,26,0,46,16,,"Correction.  Battle of Bannockburn was June 1314,  treaty with England signed in September!",2011-12-31T18:29:24.000Z,,451586190,Rupert Murdoch,672794,125,6443,1714,rupertmurdoch,True
22,451586190,author_id: 451586190,conv_id: 511187972453314560,511187972453314560,2014-09-14T16:21:24.000Z,,511187972453314560,id: 511187972453314560,111,0,172,291,,"SNP not talking about independence, but more more welfarism, expensive greenery, etc and passing sovereignty to Brussels.",2011-12-31T18:29:24.000Z,,451586190,Rupert Murdoch,672794,125,6443,1714,rupertmurdoch,True
23,451586190,author_id: 451586190,conv_id: 511187044383870977,511187044383870977,2014-09-14T16:17:43.000Z,,511187044383870977,id: 511187044383870977,57,0,54,110,,"Scottish economy may or may not be ready for independence, but country is ready emotionally and politically.  However.......",2011-12-31T18:29:24.000Z,,451586190,Rupert Murdoch,672794,125,6443,1714,rupertmurdoch,True
24,451586190,author_id: 451586190,conv_id: 511153084010364928,511153084010364928,2014-09-14T14:02:46.000Z,,511153084010364928,id: 511153084010364928,56,0,110,133,,Coincidence or fate?   Sept 18 2014  700 years since Battle of Bannockburn threw off English yoke. But now SNP wants to swap UK rule for EU.,2011-12-31T18:29:24.000Z,,451586190,Rupert Murdoch,672794,125,6443,1714,rupertmurdoch,True
